library/src/amd_detail/rocblaslt/src/Tensile/Logic/asm_full/aquavanjaram/gfx942_64cu/Equality/aquavanjaram_Cijk_Alik_Bljk_SB_Bias_HA_SAV.yaml
- {MinimumRequiredVersion: 4.33.0}
- aquavanjaram
- {Architecture: gfx942, CUCount: 64}
- [Device 0049]
    SolutionIndex: 0
    SolutionNameMin: Cijk_Alik_Bljk_SB_SAV_MT80x64x32_MI16x16x4x1_SN_1LDSB0_GRVW2_GSU1_LPA8_LPB8_LRVW4_PLR9_TT5_16_WG16_16_1
    SolutionIndex: 1
    SolutionNameMin: Cijk_Alik_Bljk_SB_SAV_MT128x16x16_MI16x16x4x1_SN_1LDSB0_GRVW1_GSU1_LPA2_LPB2_LRVW2_NEPBS2_PLR5_SPO1_TT2_16_WG64_4_1
    SolutionIndex: 2
    SolutionNameMin: Cijk_Alik_Bljk_SB_SAV_MT64x16x16_MI16x16x4x1_SN_1LDSB0_GRVW1_GSU1_LPA2_LPB2_LRVW2_NEPBS2_PLR5_SPO1_TT1_16_WG64_4_1
    SolutionIndex: 3
    SolutionNameMin: Cijk_Alik_Bljk_SB_SAV_MT128x128x16_MI32x32x2x1_SN_1LDSB1_GRVW4_GSU1_LPA4_LPB4_LRVW4_NEPBS2_PLR9_SPO1_TT2_64_WG64_4_1
    SolutionIndex: 4
    SolutionNameMin: Cijk_Alik_Bljk_SB_SAV_MT64x16x32_MI16x16x4x1_SN_1LDSB0_GRVW2_GSU5_LPA8_LPB8_LRVW4_NEPBS2_PLR9_SPO1_TT1_16_WG64_4_1
    SolutionIndex: 5
    SolutionNameMin: Cijk_Alik_Bljk_SB_SAV_MT96x32x32_MI16x16x4x1_SN_1LDSB1_GRVW4_GSU1_LPA8_LPB8_LRVW4_NEPBS2_PLR9_SPO1_TT3_16_WG32_8_1
    SolutionIndex: 6
    SolutionNameMin: Cijk_Alik_Bljk_SB_SAV_MT256x16x16_MI16x16x4x1_SN_1LDSB1_GRVW1_GSU1_LPA2_LPB2_LRVW2_NEPBS2_PLR5_SPO1_TT4_16_WG64_4_1
    SolutionIndex: 7
    SolutionNameMin: Cijk_Alik_Bljk_SB_SAV_MT32x32x32_MI16x16x4x1_SN_1LDSB0_GRVW4_GSU1_LPA8_LPB8_LRVW4_NEPBS2_PLR9_SPO1_TT1_16_WG32_8_1
    SolutionIndex: 8
    SolutionNameMin: Cijk_Alik_Bljk_SB_SAV_MT64x48x32_MI16x16x4x1_SN_1LDSB1_GRVW2_GSU1_LPA8_LPB8_LRVW4_NEPBS2_PLR9_SPO1_TT1_48_WG64_4_1
    SolutionIndex: 9
    SolutionNameMin: Cijk_Alik_Bljk_SB_SAV_MT16x256x16_MI16x16x4x1_SN_1LDSB1_GRVW1_GSU1_LPA2_LPB2_LRVW2_NEPBS2_PLR5_SPO1_TT1_64_WG16_16_1
    SolutionIndex: 10
    SolutionNameMin: Cijk_Alik_Bljk_SB_SAV_MT192x64x16_MI32x32x2x1_SN_1LDSB1_GRVW4_GSU1_LPA4_LPB4_LRVW4_NEPBS2_PLR9_SPO1_TT3_32_WG64_4_1
    SolutionIndex: 11
    SolutionNameMin: Cijk_Alik_Bljk_SB_SAV_MT64x64x32_MI32x32x2x1_SN_1LDSB0_GRVW4_GSU7_LPA4_LPB4_LRVW4_PLR17_TT1_32_WG64_4_1
    SolutionIndex: 12
    SolutionNameMin: Cijk_Alik_Bljk_SB_SAV_MT32x64x32_MI16x16x4x1_SN_1LDSB0_GRVW4_GSU1_LPA8_LPB8_LRVW4_NEPBS2_PLR9_SPO1_TT2_16_WG16_16_1
    SolutionIndex: 13
    SolutionNameMin: Cijk_Alik_Bljk_SB_SAV_MT160x32x32_MI16x16x4x1_SN_1LDSB1_GRVW4_GSU1_LPA8_LPB8_LRVW4_NEPBS2_PLR9_SPO1_TT5_16_WG32_8_1
    SolutionIndex: 14
    SolutionNameMin: Cijk_Alik_Bljk_SB_SAV_MT64x16x32_MI16x16x4x1_SN_1LDSB0_GRVW2_GSU7_LPA8_LPB8_LRVW4_NEPBS2_PLR9_SPO1_TT1_16_WG64_4_1
    SolutionIndex: 15
    SolutionNameMin: Cijk_Alik_Bljk_SB_SAV_MT112x64x32_MI16x16x4x1_SN_1LDSB1_GRVW2_GSU1_LPA8_LPB8_LRVW4_NEPBS2_PLR9_SPO1_TT7_16_WG16_16_1
    SolutionIndex: 16
    SolutionNameMin: Cijk_Alik_Bljk_SB_SAV_MT128x256x16_MI32x32x2x1_SN_1LDSB1_GRVW4_GSU1_LPA4_LPB4_LRVW4_NEPBS2_PLR9_SPO1_TT2_128_WG64_4_1
    SolutionIndex: 17
    SolutionNameMin: Cijk_Alik_Bljk_SB_SAV_MT176x64x32_MI16x16x4x1_SN_1LDSB1_GRVW2_GSU1_LPA8_LPB8_LRVW4_PLR9_TT11_16_WG16_16_1
    SolutionIndex: 18
    SolutionNameMin: Cijk_Alik_Bljk_SB_SAV_MT32x64x16_MI16x16x4x1_SN_1LDSB0_GRVW2_GSU1_LPA2_LPB2_LRVW2_NEPBS2_PLR5_SPO1_TT2_16_WG16_16_1
    SolutionIndex: 19
    SolutionNameMin: Cijk_Alik_Bljk_SB_UserArgs_MT16x128x16_MI16x16x1_SN_GRPM1_GRVWB1_GSU1_GSUC0_GSUWGMRR0_K1_LRVW1_LWPM0p26_MIWT1_2_SU4_SUM0_SUS256_SK0_WGM1_WGMXCC1_WGMXCCG8
    SolutionIndex: 20
    SolutionNameMin: Cijk_Alik_Bljk_SB_SAV_MT128x128x16_MI32x32x2x1_SN_
    SolutionIndex: 21
    SolutionNameMin: Cijk_Alik_Bljk_SB_SAV_MT64x64x16_MI32x32x2x1_SN_1LDSB0_GRVW4_GSU1_LPA4_LPB4_LRVW4_NEPBS2_PLR9_SPO1_TT1_32_WG64_4_1
    SolutionIndex: 22
    SolutionNameMin: Cijk_Alik_Bljk_SB_SAV_MT112x64x32_MI16x16x4x1_SN_1LDSB0_GRVW2_GSU1_LPA8_LPB8_LRVW4_PLR9_TT7_16_WG16_16_1
    SolutionIndex: 23
    SolutionNameMin: Cijk_Alik_Bljk_SB_SAV_MT80x64x16_MI16x16x4x1_SN_1LDSB0_GRVW1_GSU1_LPA2_LPB2_LRVW2_NEPBS2_PLR5_SPO1_TT5_16_WG16_16_1
    SolutionIndex: 24
    SolutionNameMin: Cijk_Alik_Bljk_SB_SAV_MT96x32x32_MI16x16x4x1_SN_1LDSB1_GRVW4_GSU5_LPA8_LPB8_LRVW4_NEPBS2_PLR9_SPO1_TT3_16_WG32_8_1
    SolutionIndex: 25
    SolutionNameMin: Cijk_Alik_Bljk_SB_SAV_MT256x128x16_MI32x32x2x1_SN_1LDSB1_GRVW4_GSU1_LPA4_LPB4_LRVW4_NEPBS2_PLR9_SPO1_TT4_64_WG64_4_1
    SolutionIndex: 26
    SolutionNameMin: Cijk_Alik_Bljk_SB_SAV_MT64x32x32_MI16x16x4x1_SN_1LDSB0_GRVW4_GSU1_LPA8_LPB8_LRVW4_NEPBS2_PLR9_SPO1_TT2_16_WG32_8_1
    SolutionIndex: 27
    SolutionNameMin: Cijk_Alik_Bljk_SB_UserArgs_MT16x128x16_MI16x16x1_SN_GRVWB1_GSU1_GSUC0_GSUWGMRR0_K1_LRVW1_MIWT1_2_SU4_SUM0_SUS256_WGM1_WGMXCC1_WGMXCCG38
    SolutionIndex: 28
    SolutionNameMin: Cijk_Alik_Bljk_SB_SAV_MT64x32x32_MI16x16x4x1_SN_1LDSB0_GRVW4_GSU3_LPA8_LPB8_LRVW4_PLR9_TT2_16_WG32_8_1
    SolutionIndex: 29
    SolutionNameMin: Cijk_Alik_Bljk_SB_SAV_MT112x64x16_MI16x16x4x1_SN_1LDSB0_GRVW1_GSU1_LPA2_LPB2_LRVW2_NEPBS2_PLR5_SPO1_TT7_16_WG16_16_1
    SolutionIndex: 30
    SolutionNameMin: Cijk_Alik_Bljk_SB_SAV_MT64x64x32_MI32x32x2x1_SN_1LDSB0_GRVW4_GSU1_LPA4_LPB4_LRVW4_PLR17_TT1_32_WG64_4_1
    SolutionIndex: 31
    SolutionNameMin: Cijk_Alik_Bljk_SB_SAV_MT224x32x32_MI16x16x4x1_SN_1LDSB1_GRVW4_GSU1_LPA8_LPB8_LRVW4_NEPBS0_PLR9_SPO0_TT7_16_WG32_8_1
    SolutionIndex: 32
    SolutionNameMin: Cijk_Alik_Bljk_SB_SAV_MT128x144x16_MI16x16x4x1_SN_1LDSB1_GRVW1_GSU1_LPA2_LPB2_LRVW2_NEPBS2_PLR5_SPO1_TT2_144_WG64_4_1
    SolutionIndex: 33
    SolutionNameMin: Cijk_Alik_Bljk_SB_SAV_MT32x32x16_MI16x16x4x1_SN_1LDSB0_GRVW2_GSU1_LPA2_LPB2_LRVW2_NEPBS2_PLR5_SPO1_TT1_16_WG32_8_1
    SolutionIndex: 34
    SolutionNameMin: Cijk_Alik_Bljk_SB_SAV_MT16x64x16_MI16x16x4x1_SN_1LDSB0_GRVW1_GSU1_LPA2_LPB2_LRVW2_NEPBS2_PLR5_SPO1_TT1_16_WG16_16_1
- - - [1128, 252, 1, 512]
    - [0, 0.0]
  - - [256, 1, 44, 1]
    - [1, 0.0]
  - - [1302, 34, 1, 32]
    - [2, 0.0]
  - - [128, 40960, 1, 32]
    - [3, 0.0]
  - - [1128, 15, 1, 512]
    - [4, 0.0]
  - - [82, 16, 512, 16]
    - [1, 0.0]
  - - [1144, 512, 1, 512]
    - [5, 0.0]
  - - [256, 1, 81, 1]
    - [6, 0.0]
  - - [740, 512, 1, 540]
    - [5, 0.0]
  - - [512, 93, 1, 256]
    - [7, 0.0]
  - - [1128, 100, 1, 512]
    - [8, 0.0]
  - - [82, 8192, 1, 16]
    - [9, 0.0]
  - - [256, 1, 96, 1]
    - [6, 0.0]
  - - [256, 1, 85, 1]
    - [6, 0.0]
  - - [1128, 92, 1, 512]
    - [7, 0.0]
  - - [640, 512, 1, 768]
    - [0, 0.0]
  - - [2968, 512, 1, 256]
    - [10, 0.0]
  - - [64, 512, 1, 1312]
    - [11, 0.0]
  - - [1128, 98, 1, 512]
    - [8, 0.0]
  - - [416, 512, 1, 160]
    - [12, 0.0]
  - - [1168, 512, 1, 256]
    - [13, 0.0]
  - - [256, 1, 37, 1]
    - [1, 0.0]
  - - [1128, 13, 1, 512]
    - [14, 0.0]
  - - [2668, 512, 1, 640]
    - [15, 0.0]
  - - [128, 32768, 1, 256]
    - [16, 0.0]
  - - [256, 1, 57, 1]
    - [1, 0.0]
  - - [256, 1, 73, 1]
    - [6, 0.0]
  - - [1293, 512, 1, 768]
    - [17, 0.0]
  - - [256, 1, 62, 1]
    - [1, 0.0]
  - - [512, 101, 1, 256]
    - [7, 0.0]
  - - [256, 1, 71, 1]
    - [6, 0.0]
  - - [32, 64, 512, 32]
    - [18, 0.0]
  - - [256, 1, 51, 1]
    - [1, 0.0]
  - - [1128, 235, 1, 512]
    - [0, 0.0]
  - - [512, 65, 1, 256]
    - [7, 0.0]
  - - [16, 512, 1, 1]
    - [19, 0.0]
  - - [5897, 512, 1, 540]
    - [20, 0.0]
  - - [800, 512, 1, 128]
    - [21, 0.0]
  - - [896, 512, 1, 256]
    - [22, 0.0]
  - - [256, 1, 41, 1]
    - [1, 0.0]
  - - [1128, 256, 1, 512]
    - [0, 0.0]
  - - [1792, 512, 1, 128]
    - [15, 0.0]
  - - [256, 1, 16, 1]
    - [2, 0.0]
  - - [512, 74, 1, 256]
    - [7, 0.0]
  - - [256, 1, 46, 1]
    - [1, 0.0]
  - - [1236, 512, 1, 128]
    - [23, 0.0]
  - - [1128, 20, 1, 512]
    - [24, 0.0]
  - - [256, 16384, 1, 128]
    - [25, 0.0]
  - - [1312, 512, 1, 256]
    - [17, 0.0]
  - - [256, 1, 15, 1]
    - [2, 0.0]
  - - [256, 1, 50, 1]
    - [1, 0.0]
  - - [444, 512, 1, 444]
    - [26, 0.0]
  - - [1128, 101, 1, 512]
    - [8, 0.0]
  - - [444, 512, 1, 128]
    - [26, 0.0]
  - - [5897, 512, 1, 1520]
    - [20, 0.0]
  - - [1128, 203, 1, 512]
    - [26, 0.0]
  - - [16, 19, 1, 1]
    - [19, 0.0]
  - - [16, 82, 512, 16]
    - [19, 0.0]
  - - [16, 34, 1, 1]
    - [19, 0.0]
  - - [704, 512, 1, 128]
    - [5, 0.0]
  - - [32, 25, 1, 16]
    - [2, 0.0]
  - - [256, 252, 1, 1]
    - [27, 0.0]
  - - [512, 73, 1, 256]
    - [7, 0.0]
  - - [512, 125, 1, 256]
    - [7, 0.0]
  - - [1128, 25, 1, 512]
    - [28, 0.0]
  - - [1128, 217, 1, 512]
    - [26, 0.0]
  - - [256, 1, 47, 1]
    - [1, 0.0]
  - - [1792, 512, 1, 257]
    - [29, 0.0]
  - - [1128, 125, 1, 512]
    - [8, 0.0]
  - - [256, 1, 13, 1]
    - [2, 0.0]
  - - [256, 1, 74, 1]
    - [6, 0.0]
  - - [1128, 251, 1, 512]
    - [0, 0.0]
  - - [256, 1, 31, 1]
    - [1, 0.0]
  - - [1128, 187, 1, 512]
    - [30, 0.0]
  - - [256, 1, 60, 1]
    - [1, 0.0]
  - - [256, 32768, 1, 128]
    - [16, 0.0]
  - - [256, 1, 49, 1]
    - [1, 0.0]
  - - [540, 512, 1, 256]
    - [0, 0.0]
  - - [256, 1, 64, 1]
    - [1, 0.0]
  - - [256, 1, 23, 1]
    - [1, 0.0]
  - - [776, 512, 1, 256]
    - [31, 0.0]
  - - [896, 512, 1, 128]
    - [22, 0.0]
  - - [352, 512, 1, 352]
    - [5, 0.0]
  - - [1128, 227, 1, 512]
    - [0, 0.0]
  - - [256, 1, 48, 1]
    - [1, 0.0]
  - - [512, 98, 1, 256]
    - [7, 0.0]
  - - [256, 1, 91, 1]
    - [6, 0.0]
  - - [512, 86, 1, 256]
    - [7, 0.0]
  - - [1128, 190, 1, 512]
    - [30, 0.0]
  - - [256, 1, 65, 1]
    - [6, 0.0]
  - - [256, 1, 93, 1]
    - [6, 0.0]
  - - [256, 1, 82, 1]
    - [6, 0.0]
  - - [1128, 75, 1, 512]
    - [7, 0.0]
  - - [512, 82, 1, 256]
    - [7, 0.0]
  - - [256, 1, 43, 1]
    - [1, 0.0]
  - - [256, 40960, 1, 128]
    - [32, 0.0]
  - - [128, 32768, 1, 32]
    - [16, 0.0]
  - - [256, 1, 84, 1]
    - [6, 0.0]
  - - [32, 512, 1, 16]
    - [33, 0.0]
  - - [32, 27, 1, 16]
    - [34, 0.0]
- null
- null
- DeviceEfficiency
- Equality
