library/src/amd_detail/rocblaslt/src/Tensile/Logic/asm_full/aquavanjaram/gfx942_64cu/Equality/aquavanjaram_Cijk_Ailk_Bljk_BBS_BH_UserArgs.yaml
- {MinimumRequiredVersion: 4.33.0}
- aquavanjaram
- {Architecture: gfx942, CUCount: 64}
- [Device 0049, Device 0050]
    SolutionIndex: 0
    SolutionNameMin: Cijk_Ailk_Bljk_BBS_BH_MT256x128x32_MI16x16x1_SN_LDSB1_GRVWB4_GSU1_LBSPPA2048_LBSPPB128_LPA16_LWPMn1_MIWT4_8_SU4_SUM2_SUS256_SVW4_VWA4_WG64_4_1
    SolutionIndex: 1
    SolutionNameMin: Cijk_Ailk_Bljk_BBS_BH_UserArgs_MT256x80x64_MI16x16x1_SN_LDSB1_CLR1_GRVWA8_GRVWB4_GSU1_GSUC0_GSUWGMRR0_K1_LBSPPA4096_LBSPPB128_LPA0_LPB16_LRVW8_MIWT4_5_NLCA1_PLR1_SU16_SUM0_SUS128_SVW4_VWA4_VWB1_WG64_4_1_WGM8_WGMXCC8_WGMXCCG304
    SolutionIndex: 2
    SolutionNameMin: Cijk_Ailk_Bljk_BBS_BH_UserArgs_MT32x16x32_MI16x16x1_SN_LDSB0_CLR0_GRVWA4_GRVWB2_GSU1_GSUC0_GSUWGMRR0_K1_LBSPPA256_LBSPPB128_LPA16_LPB4_LRVW4_MIWT1_1_NLCA1_PLR0_SU16_SUM0_SUS64_SVW1_VWA1_VWB1_WG32_4_2_WGM1_WGMXCC1_WGMXCCG0
    SolutionIndex: 3
    SolutionNameMin: Cijk_Ailk_Bljk_BBS_BH_UserArgs_MT512x128x64_MI16x16x1_SN_LDSB0_DTVA1_GRVWA8_GSU1_GSUC0_GSUWGMRR0_K1_LBSPPA0_MIWT8_8_SU8_SUM0_SUS128_SVW8_ULSGRO0_VWA8_WG64_4_1_WGM1_WGMXCC1_WGMXCCGn1
    SolutionIndex: 4
    SolutionNameMin: Cijk_Ailk_Bljk_BBS_BH_UserArgs_MT128x64x128_MI16x16x1_SN_LDSB1_CLR1_GRVWA8_GRVWB8_GSU1_GSUC0_GSUWGMRR0_K1_LBSPPA2048_LBSPPB1024_LPA0_LPB16_LRVW8_MIWT4_4_NLCA1_PLR1_SU16_SUM0_SUS256_SVW4_VWA4_VWB4_WG32_4_2_WGM8_WGMXCC8_WGMXCCG304
- - - [3072, 1024, 32, 1024]
    - [0, 0.0]
  - - [3072, 1024, 8, 768]
    - [0, 0.0]
  - - [2304, 512, 1, 1792]
    - [1, 0.0]
  - - [64, 1024, 1, 64]
    - [2, 0.0]
  - - [3072, 1024, 32, 896]
    - [0, 0.0]
  - - [1536, 1024, 32, 896]
    - [0, 0.0]
  - - [1024, 1024, 32, 3072]
    - [3, 0.0]
  - - [1024, 1024, 32, 1536]
    - [3, 0.0]
  - - [512, 1024, 1, 1024]
    - [4, 0.0]
  - - [3072, 1024, 32, 3072]
    - [3, 0.0]
  - - [512, 126976, 1, 1024]
    - [3, 0.0]
  - - [3072, 1024, 28, 3072]
    - [3, 0.0]
  - - [3072, 1024, 16, 768]
    - [0, 0.0]
  - - [1024, 1024, 28, 3072]
    - [3, 0.0]
  - - [1024, 1024, 28, 1536]
    - [3, 0.0]
  - - [1536, 1024, 28, 768]
    - [0, 0.0]
  - - [3072, 1024, 28, 768]
    - [0, 0.0]
- null
- null
- DeviceEfficiency
- Equality
