library/src/amd_detail/rocblaslt/src/Tensile/Logic/asm_full/aquavanjaram/gfx942_64cu/Equality/aquavanjaram_Cijk_Ailk_Bjlk_SB_Bias_HA_SAV.yaml
- {MinimumRequiredVersion: 4.33.0}
- aquavanjaram
- {Architecture: gfx942, CUCount: 64}
- [Device 0049]
    SolutionIndex: 0
    SolutionNameMin: Cijk_Ailk_Bjlk_SB_UserArgs_MT16x16x4_MI16x16x1_SN_DTVA0_DTVB0_GRPM1_GSU1_GSUC0_GSUWGMRR0_K1_LBSPPA64_LBSPPB64_LWPM0p27_MIWT1_1_SU8_SUM0_SUS16_WGM1_WGMXCC1_WGMXCCG0
    SolutionIndex: 1
    SolutionNameMin: Cijk_Ailk_Bjlk_SB_SAV_MT64x32x32_MI16x16x4x1_SN_1LDSB0_GRVW4_GSU1_NLCA1_NLCB1_PLR9_TT2_16_WG32_8_1
    SolutionIndex: 2
    SolutionNameMin: Cijk_Ailk_Bjlk_SB_SAV_MT16x64x16_MI16x16x4x1_SN_1LDSB0_GRVW1_GSU1_NEPBS2_NLCA1_NLCB1_PLR5_SPO1_TT1_16_WG16_16_1
    SolutionIndex: 3
    SolutionNameMin: Cijk_Ailk_Bjlk_SB_SAV_MT64x48x16_MI16x16x4x1_SN_1LDSB0_GRVW1_GSU1_NEPBS2_NLCA1_NLCB3_PLR5_SPO1_TT1_48_WG64_4_1
    SolutionIndex: 4
    SolutionNameMin: Cijk_Ailk_Bjlk_SB_SAV_MT16x256x16_MI16x16x4x1_SN_1LDSB1_GRVW1_GSU1_NEPBS2_NLCA1_NLCB1_PLR5_SPO1_TT1_64_WG16_16_1
    SolutionIndex: 5
    SolutionNameMin: Cijk_Ailk_Bjlk_SB_SAV_MT64x144x32_MI16x16x4x1_SN_1LDSB1_GRVW2_GSU1_NEPBS2_NLCA1_NLCB9_PLR9_SPO1_TT1_144_WG64_4_1
    SolutionIndex: 6
    SolutionNameMin: Cijk_Ailk_Bjlk_SB_SAV_MT64x48x32_MI16x16x4x1_SN_1LDSB0_GRVW2_GSU1_NLCA1_NLCB3_PLR9_TT1_48_WG64_4_1
    SolutionIndex: 7
    SolutionNameMin: Cijk_Ailk_Bjlk_SB_SAV_MT32x32x16_MI16x16x4x1_SN_1LDSB0_GRVW2_GSU1_NEPBS2_NLCA1_NLCB1_PLR5_SPO1_TT1_16_WG32_8_1
    SolutionIndex: 8
    SolutionNameMin: Cijk_Ailk_Bjlk_SB_UserArgs_MT16x16x4_MI16x16x1_SN_DTVA0_DTVB0_GRPM1_GSU1_GSUC0_GSUWGMRR0_K1_LBSPPA64_LBSPPB64_LWPM0p25_MIWT1_1_SU32_SUM0_SUS16_WGM1_WGMXCC1_WGMXCCG0
    SolutionIndex: 9
    SolutionNameMin: Cijk_Ailk_Bjlk_SB_SAV_MT48x64x16_MI16x16x4x1_SN_1LDSB0_GRVW1_GSU7_NEPBS2_NLCA3_NLCB1_PLR5_SPO1_TT3_16_WG16_16_1
    SolutionIndex: 10
    SolutionNameMin: Cijk_Ailk_Bjlk_SB_SAV_MT32x128x16_MI32x32x2x1_SN_1LDSB0_GRVW2_GSU1_NEPBS2_NLCA1_NLCB1_PLR9_SPO1_TT1_32_WG32_8_1
    SolutionIndex: 11
    SolutionNameMin: Cijk_Ailk_Bjlk_SB_SAV_MT96x64x32_MI16x16x4x1_SN_1LDSB1_GRVW4_GSU1_NEPBS2_NLCA3_NLCB1_PLR9_SPO1_TT6_16_WG16_16_1
    SolutionIndex: 12
    SolutionNameMin: Cijk_Ailk_Bjlk_SB_SAV_MT96x192x16_MI16x16x4x1_SN_1LDSB1_GRVW2_GSU1_NEPBS2_NLCA3_NLCB3_PLR5_SPO1_TT6_48_WG16_16_1
    SolutionIndex: 13
    SolutionNameMin: Cijk_Ailk_Bjlk_SB_SAV_MT144x128x16_MI16x16x4x1_SN_1LDSB1_GRVW1_GSU1_NEPBS2_NLCA9_NLCB1_PLR5_SPO1_TT9_32_WG16_16_1
    SolutionIndex: 14
    SolutionNameMin: Cijk_Ailk_Bjlk_SB_SAV_MT64x32x32_MI16x16x4x1_SN_1LDSB0_GRVW4_GSU1_NEPBS2_NLCA1_NLCB1_PLR9_SPO1_TT2_16_WG32_8_1
    SolutionIndex: 15
    SolutionNameMin: Cijk_Ailk_Bjlk_SB_SAV_MT64x16x16_MI16x16x4x1_SN_1LDSB0_GRVW1_GSU15_NEPBS2_NLCA1_NLCB1_PLR5_SPO1_TT1_16_WG64_4_1
    SolutionIndex: 16
    SolutionNameMin: Cijk_Ailk_Bjlk_SB_SAV_MT64x48x32_MI16x16x4x1_SN_1LDSB0_GRVW2_GSU1_NEPBS2_NLCA1_NLCB3_PLR9_SPO1_TT1_48_WG64_4_1
    SolutionIndex: 17
    SolutionNameMin: Cijk_Ailk_Bjlk_SB_SAV_MT32x32x32_MI16x16x4x1_SN_1LDSB0_GRVW4_GSU1_NEPBS2_NLCA1_NLCB1_PLR9_SPO1_TT1_16_WG32_8_1
    SolutionIndex: 18
    SolutionNameMin: Cijk_Ailk_Bjlk_SB_SAV_MT64x32x16_MI16x16x4x1_SN_1LDSB0_GRVW2_GSU1_NEPBS2_NLCA1_NLCB1_PLR5_SPO1_TT2_16_WG32_8_1
    SolutionIndex: 19
    SolutionNameMin: Cijk_Ailk_Bjlk_SB_SAV_MT128x64x32_MI32x32x2x1_SN_1LDSB1_GRVW4_GSU15_NEPBS2_NLCA1_NLCB1_PLR17_SPO1_TT2_32_WG64_4_1
    SolutionIndex: 20
    SolutionNameMin: Cijk_Ailk_Bjlk_SB_SAV_MT32x160x32_MI16x16x4x1_SN_1LDSB1_GRVW4_GSU1_NEPBS2_NLCA1_NLCB5_PLR9_SPO1_TT1_80_WG32_8_1
    SolutionIndex: 21
    SolutionNameMin: Cijk_Ailk_Bjlk_SB_SAV_MT32x32x32_MI16x16x4x1_SN_1LDSB0_GRVW4_GSU15_NEPBS2_NLCA1_NLCB1_PLR9_SPO1_TT1_16_WG32_8_1
    SolutionIndex: 22
    SolutionNameMin: Cijk_Ailk_Bjlk_SB_SAV_MT16x64x32_MI16x16x4x1_SN_1LDSB0_GRVW2_GSU15_NLCA1_NLCB1_PLR9_TT1_16_WG16_16_1
    SolutionIndex: 23
    SolutionNameMin: Cijk_Ailk_Bjlk_SB_SAV_MT64x16x16_MI16x16x4x1_SN_1LDSB0_GRVW1_GSU7_NEPBS2_NLCA1_NLCB1_PLR5_SPO1_TT1_16_WG64_4_1
    SolutionIndex: 24
    SolutionNameMin: Cijk_Ailk_Bjlk_SB_SAV_MT96x32x32_MI16x16x4x1_SN_1LDSB0_GRVW4_GSU1_NLCA3_NLCB1_PLR9_TT3_16_WG32_8_1
    SolutionIndex: 25
    SolutionNameMin: Cijk_Ailk_Bjlk_SB_SAV_MT64x64x32_MI32x32x2x1_SN_1LDSB0_GRVW4_GSU1_NLCA1_NLCB1_PLR17_TT1_32_WG64_4_1
    SolutionIndex: 26
    SolutionNameMin: Cijk_Ailk_Bjlk_SB_SAV_MT128x16x16_MI16x16x4x1_SN_1LDSB0_GRVW1_GSU15_NEPBS2_NLCA1_NLCB1_PLR5_SPO1_TT2_16_WG64_4_1
    SolutionIndex: 27
    SolutionNameMin: Cijk_Ailk_Bjlk_SB_SAV_MT64x64x16_MI32x32x2x1_SN_1LDSB0_GRVW4_GSU1_NEPBS2_NLCA1_NLCB1_PLR9_SPO1_TT1_32_WG64_4_1
    SolutionIndex: 28
    SolutionNameMin: Cijk_Ailk_Bjlk_SB_SAV_MT112x64x16_MI16x16x4x1_SN_1LDSB0_GRVW1_GSU1_NLCA7_NLCB1_PLR5_TT7_16_WG16_16_1
    SolutionIndex: 29
    SolutionNameMin: Cijk_Ailk_Bjlk_SB_SAV_MT32x64x16_MI16x16x4x1_SN_1LDSB0_GRVW2_GSU1_NEPBS2_NLCA1_NLCB1_PLR5_SPO1_TT2_16_WG16_16_1
    SolutionIndex: 30
    SolutionNameMin: Cijk_Ailk_Bjlk_SB_SAV_MT32x32x32_MI16x16x4x1_SN_1LDSB0_GRVW4_GSU15_NLCA1_NLCB1_PLR9_TT1_16_WG32_8_1
    SolutionIndex: 31
    SolutionNameMin: Cijk_Ailk_Bjlk_SB_SAV_MT128x112x16_MI16x16x4x1_SN_1LDSB0_GRVW1_GSU1_NEPBS2_NLCA1_NLCB7_PLR5_SPO1_TT2_112_WG64_4_1
- - - [1, 256, 60, 1]
    - [0, 0.0]
  - - [256, 512, 1, 98]
    - [1, 0.0]
  - - [256, 512, 1, 60]
    - [2, 0.0]
  - - [256, 512, 1, 19]
    - [2, 0.0]
  - - [256, 512, 1, 27]
    - [2, 0.0]
  - - [512, 1128, 1, 75]
    - [3, 0.0]
  - - [1, 256, 64, 1]
    - [0, 0.0]
  - - [1, 256, 91, 1]
    - [4, 0.0]
  - - [512, 1144, 1, 512]
    - [5, 0.0]
  - - [256, 512, 1, 100]
    - [1, 0.0]
  - - [1, 256, 76, 1]
    - [0, 0.0]
  - - [256, 512, 1, 14]
    - [0, 0.0]
  - - [128, 1236, 1, 512]
    - [6, 0.0]
  - - [1, 16, 1, 27]
    - [0, 0.0]
  - - [1, 256, 101, 1]
    - [4, 0.0]
  - - [32, 32, 512, 80]
    - [7, 0.0]
  - - [16, 32, 1, 19]
    - [0, 0.0]
  - - [1, 256, 98, 1]
    - [4, 0.0]
  - - [512, 1128, 1, 13]
    - [3, 0.0]
  - - [32, 1302, 1, 19]
    - [8, 0.0]
  - - [256, 512, 1, 256]
    - [1, 0.0]
  - - [16, 32, 1, 24]
    - [0, 0.0]
  - - [256, 512, 1, 20]
    - [0, 0.0]
  - - [512, 1128, 1, 100]
    - [3, 0.0]
  - - [256, 512, 1, 46]
    - [1, 0.0]
  - - [1, 256, 1, 227]
    - [9, 0.0]
  - - [512, 1128, 1, 25]
    - [3, 0.0]
  - - [16, 32, 1, 22]
    - [8, 0.0]
  - - [512, 1128, 1, 82]
    - [3, 0.0]
  - - [1, 256, 27, 1]
    - [8, 0.0]
  - - [1, 256, 75, 1]
    - [0, 0.0]
  - - [512, 1128, 1, 190]
    - [3, 0.0]
  - - [512, 1128, 1, 44]
    - [3, 0.0]
  - - [257, 1792, 1, 512]
    - [10, 0.0]
  - - [32, 1302, 1, 24]
    - [0, 0.0]
  - - [512, 1128, 1, 19]
    - [3, 0.0]
  - - [512, 1128, 1, 65]
    - [3, 0.0]
  - - [768, 512, 1, 512]
    - [11, 0.0]
  - - [1, 256, 43, 1]
    - [0, 0.0]
  - - [512, 1128, 1, 47]
    - [3, 0.0]
  - - [1, 256, 125, 1]
    - [4, 0.0]
  - - [1520, 5897, 1, 512]
    - [12, 0.0]
  - - [540, 5897, 1, 512]
    - [13, 0.0]
  - - [256, 512, 1, 85]
    - [14, 0.0]
  - - [3, 32, 1, 512]
    - [15, 0.0]
  - - [256, 512, 1, 92]
    - [1, 0.0]
  - - [16, 32, 1, 25]
    - [8, 0.0]
  - - [256, 1312, 1, 512]
    - [16, 0.0]
  - - [1, 256, 1, 256]
    - [9, 0.0]
  - - [1, 256, 65, 1]
    - [0, 0.0]
  - - [512, 1128, 1, 86]
    - [3, 0.0]
  - - [512, 1128, 1, 20]
    - [3, 0.0]
  - - [1, 256, 84, 1]
    - [4, 0.0]
  - - [1, 256, 100, 1]
    - [4, 0.0]
  - - [256, 512, 1, 217]
    - [1, 0.0]
  - - [32, 20, 1, 512]
    - [15, 0.0]
  - - [1, 256, 1, 101]
    - [2, 0.0]
  - - [256, 512, 1, 187]
    - [1, 0.0]
  - - [256, 512, 1, 190]
    - [1, 0.0]
  - - [1, 256, 41, 1]
    - [0, 0.0]
  - - [16, 32, 1, 23]
    - [17, 0.0]
  - - [1, 256, 92, 1]
    - [4, 0.0]
  - - [1, 256, 96, 1]
    - [4, 0.0]
  - - [256, 512, 1, 50]
    - [18, 0.0]
  - - [32, 1302, 1, 23]
    - [2, 0.0]
  - - [512, 1128, 1, 101]
    - [3, 0.0]
  - - [256, 128, 1, 32768]
    - [19, 0.0]
  - - [256, 512, 1, 31]
    - [2, 0.0]
  - - [256, 512, 1, 44]
    - [1, 0.0]
  - - [1, 256, 62, 1]
    - [0, 0.0]
  - - [256, 1168, 1, 512]
    - [20, 0.0]
  - - [512, 1128, 1, 41]
    - [3, 0.0]
  - - [32, 1302, 1, 34]
    - [17, 0.0]
  - - [128, 256, 1, 32768]
    - [19, 0.0]
  - - [512, 1128, 1, 91]
    - [3, 0.0]
  - - [1, 256, 93, 1]
    - [4, 0.0]
  - - [16, 82, 1, 8192]
    - [21, 0.0]
  - - [512, 1128, 1, 50]
    - [3, 0.0]
  - - [512, 1128, 1, 76]
    - [3, 0.0]
  - - [1, 256, 71, 1]
    - [0, 0.0]
  - - [512, 1128, 1, 62]
    - [3, 0.0]
  - - [512, 1128, 1, 83]
    - [3, 0.0]
  - - [256, 640, 1, 512]
    - [6, 0.0]
  - - [1, 256, 57, 1]
    - [0, 0.0]
  - - [1, 256, 25, 1]
    - [8, 0.0]
  - - [256, 512, 1, 43]
    - [1, 0.0]
  - - [256, 512, 1, 15]
    - [0, 0.0]
  - - [1, 256, 1, 203]
    - [2, 0.0]
  - - [1, 16, 1, 24]
    - [0, 0.0]
  - - [512, 1128, 1, 74]
    - [3, 0.0]
  - - [512, 1128, 1, 51]
    - [3, 0.0]
  - - [512, 1128, 1, 14]
    - [3, 0.0]
  - - [512, 1128, 1, 23]
    - [3, 0.0]
  - - [256, 512, 1, 74]
    - [1, 0.0]
  - - [1, 16, 1, 20]
    - [0, 0.0]
  - - [32, 128, 1, 40960]
    - [22, 0.0]
  - - [128, 444, 1, 512]
    - [17, 0.0]
  - - [512, 1128, 1, 60]
    - [3, 0.0]
  - - [256, 512, 1, 91]
    - [1, 0.0]
  - - [512, 1128, 1, 31]
    - [3, 0.0]
  - - [32, 32, 512, 64]
    - [7, 0.0]
  - - [512, 1128, 1, 203]
    - [3, 0.0]
  - - [1, 256, 16, 1]
    - [0, 0.0]
  - - [32, 1302, 1, 22]
    - [17, 0.0]
  - - [1, 256, 73, 1]
    - [0, 0.0]
  - - [1, 256, 14, 1]
    - [0, 0.0]
  - - [1, 16, 1, 25]
    - [0, 0.0]
  - - [256, 512, 1, 37]
    - [1, 0.0]
  - - [1, 256, 1, 252]
    - [23, 0.0]
  - - [512, 1128, 1, 217]
    - [3, 0.0]
  - - [256, 512, 1, 47]
    - [1, 0.0]
  - - [1, 256, 46, 1]
    - [0, 0.0]
  - - [16, 32, 1, 27]
    - [0, 0.0]
  - - [1, 256, 23, 1]
    - [8, 0.0]
  - - [768, 256, 1, 512]
    - [24, 0.0]
  - - [444, 444, 1, 512]
    - [25, 0.0]
  - - [1, 256, 31, 1]
    - [8, 0.0]
  - - [256, 512, 1, 81]
    - [1, 0.0]
  - - [256, 512, 1, 57]
    - [2, 0.0]
  - - [256, 128, 1, 16384]
    - [19, 0.0]
  - - [256, 512, 1, 227]
    - [1, 0.0]
  - - [1, 256, 1, 217]
    - [2, 0.0]
  - - [32, 1302, 1, 20]
    - [0, 0.0]
  - - [1, 16, 1, 512]
    - [26, 0.0]
  - - [512, 1128, 1, 84]
    - [3, 0.0]
  - - [1, 256, 74, 1]
    - [0, 0.0]
  - - [512, 1128, 1, 37]
    - [3, 0.0]
  - - [32, 1302, 1, 35]
    - [17, 0.0]
  - - [256, 512, 1, 62]
    - [2, 0.0]
  - - [512, 1128, 1, 81]
    - [3, 0.0]
  - - [1, 256, 50, 1]
    - [0, 0.0]
  - - [1, 16, 1, 35]
    - [0, 0.0]
  - - [256, 512, 1, 252]
    - [1, 0.0]
  - - [512, 1128, 1, 57]
    - [3, 0.0]
  - - [768, 1293, 1, 512]
    - [27, 0.0]
  - - [256, 512, 1, 235]
    - [1, 0.0]
  - - [1, 256, 20, 1]
    - [0, 0.0]
  - - [1, 16, 1, 19]
    - [8, 0.0]
  - - [540, 740, 1, 512]
    - [28, 0.0]
  - - [512, 1128, 1, 187]
    - [3, 0.0]
  - - [256, 512, 1, 48]
    - [29, 0.0]
  - - [1, 256, 83, 1]
    - [4, 0.0]
  - - [1, 256, 13, 1]
    - [8, 0.0]
  - - [1, 256, 44, 1]
    - [0, 0.0]
  - - [256, 512, 1, 84]
    - [1, 0.0]
  - - [1, 256, 49, 1]
    - [0, 0.0]
  - - [256, 512, 1, 251]
    - [1, 0.0]
  - - [256, 512, 1, 71]
    - [1, 0.0]
  - - [512, 1128, 1, 93]
    - [3, 0.0]
  - - [256, 512, 1, 101]
    - [1, 0.0]
  - - [1, 256, 82, 1]
    - [4, 0.0]
  - - [512, 1128, 1, 252]
    - [3, 0.0]
  - - [1, 16, 1, 23]
    - [2, 0.0]
  - - [256, 512, 1, 49]
    - [2, 0.0]
  - - [32, 1302, 1, 25]
    - [17, 0.0]
  - - [512, 1128, 1, 227]
    - [3, 0.0]
  - - [256, 512, 1, 82]
    - [1, 0.0]
  - - [512, 1128, 1, 16]
    - [3, 0.0]
  - - [256, 512, 1, 65]
    - [1, 0.0]
  - - [256, 512, 1, 76]
    - [1, 0.0]
  - - [128, 896, 1, 512]
    - [1, 0.0]
  - - [128, 800, 1, 512]
    - [1, 0.0]
  - - [128, 704, 1, 512]
    - [1, 0.0]
  - - [1, 16, 1, 17]
    - [0, 0.0]
  - - [512, 1128, 1, 49]
    - [3, 0.0]
  - - [256, 128, 1, 40960]
    - [19, 0.0]
  - - [1, 256, 1, 190]
    - [2, 0.0]
  - - [1, 256, 85, 1]
    - [4, 0.0]
  - - [1, 256, 48, 1]
    - [0, 0.0]
  - - [512, 1128, 1, 251]
    - [3, 0.0]
  - - [256, 512, 1, 75]
    - [1, 0.0]
  - - [128, 256, 1, 16384]
    - [19, 0.0]
  - - [16, 32, 1, 35]
    - [0, 0.0]
  - - [256, 512, 1, 96]
    - [1, 0.0]
  - - [1, 256, 86, 1]
    - [4, 0.0]
  - - [512, 1128, 1, 256]
    - [3, 0.0]
  - - [512, 1128, 1, 85]
    - [3, 0.0]
  - - [32, 128, 1, 16384]
    - [30, 0.0]
  - - [1, 256, 72, 1]
    - [0, 0.0]
  - - [1, 16, 1, 22]
    - [0, 0.0]
  - - [512, 1128, 1, 15]
    - [3, 0.0]
  - - [32, 1302, 1, 17]
    - [2, 0.0]
  - - [1, 256, 1, 251]
    - [23, 0.0]
  - - [1, 256, 19, 1]
    - [8, 0.0]
  - - [640, 2668, 1, 512]
    - [31, 0.0]
  - - [512, 1128, 1, 48]
    - [3, 0.0]
  - - [512, 1128, 1, 235]
    - [3, 0.0]
  - - [16, 32, 1, 17]
    - [8, 0.0]
  - - [256, 512, 1, 86]
    - [1, 0.0]
  - - [256, 512, 1, 16]
    - [29, 0.0]
  - - [256, 512, 1, 83]
    - [1, 0.0]
  - - [512, 1128, 1, 92]
    - [3, 0.0]
  - - [256, 540, 1, 512]
    - [6, 0.0]
  - - [512, 1128, 1, 27]
    - [3, 0.0]
  - - [16, 32, 1, 34]
    - [17, 0.0]
  - - [512, 1128, 1, 72]
    - [3, 0.0]
  - - [256, 512, 1, 72]
    - [1, 0.0]
  - - [1, 256, 47, 1]
    - [0, 0.0]
  - - [32, 1302, 1, 27]
    - [17, 0.0]
  - - [16, 16, 512, 82]
    - [8, 0.0]
  - - [32, 128, 1, 32768]
    - [22, 0.0]
  - - [512, 1128, 1, 98]
    - [3, 0.0]
  - - [512, 1128, 1, 73]
    - [3, 0.0]
  - - [256, 512, 1, 125]
    - [1, 0.0]
  - - [1, 256, 15, 1]
    - [8, 0.0]
  - - [512, 1128, 1, 71]
    - [3, 0.0]
  - - [256, 512, 1, 23]
    - [1, 0.0]
  - - [1, 256, 37, 1]
    - [0, 0.0]
  - - [512, 1128, 1, 46]
    - [3, 0.0]
  - - [1, 16, 1, 34]
    - [0, 0.0]
  - - [256, 512, 1, 203]
    - [1, 0.0]
  - - [1, 256, 51, 1]
    - [0, 0.0]
  - - [256, 512, 1, 25]
    - [2, 0.0]
  - - [512, 1128, 1, 125]
    - [3, 0.0]
  - - [16, 32, 1, 20]
    - [8, 0.0]
  - - [256, 512, 1, 41]
    - [1, 0.0]
  - - [256, 512, 1, 93]
    - [1, 0.0]
  - - [1, 256, 81, 1]
    - [4, 0.0]
  - - [1, 256, 1, 187]
    - [2, 0.0]
  - - [256, 512, 1, 13]
    - [0, 0.0]
  - - [32, 32, 512, 32]
    - [7, 0.0]
  - - [128, 256, 1, 40960]
    - [19, 0.0]
  - - [256, 512, 1, 51]
    - [1, 0.0]
  - - [256, 512, 1, 73]
    - [1, 0.0]
  - - [1, 256, 1, 235]
    - [23, 0.0]
  - - [512, 1128, 1, 43]
    - [3, 0.0]
- null
- null
- DeviceEfficiency
- Equality
