library/src/amd_detail/rocblaslt/src/Tensile/Logic/asm_full/aquavanjaram/gfx942_64cu/Equality/aquavanjaram_Cijk_Ailk_Bljk_BBS_BH_Bias_HAS_SAV_UserArgs.yaml
- {MinimumRequiredVersion: 4.33.0}
- aquavanjaram
- {Architecture: gfx942, CUCount: 64}
- [Device 0049, Device 0050]
    SolutionIndex: 0
    SolutionNameMin: Cijk_Ailk_Bljk_BBS_BH_Bias_HAS_SAV_UserArgs_MT256x128x32_MI16x16x1_SN_LDSB1_DTVA0_GRVWA8_GRVWB4_GSU1_GSUC0_GSUWGMRR0_K1_LBSPPA2048_LBSPPB512_MIWT4_8_SU8_SUM0_SUS64_SVW4_ULSGRO0_VWA4_VWB8_WG64_4_1_WGM8_WGMXCC1_WGMXCCG304
    SolutionIndex: 1
    SolutionNameMin: Cijk_Ailk_Bljk_BBS_BH_Bias_HAS_SAV_UserArgs_MT64x32x128_MI16x16x1_SN_LDSB1_GRVWA8_GRVWB8_GSU1_GSUC0_GSUWGMRR0_K1_LBSPPA1024_LBSPPB256_LPA32_LPB16_LRVW8_MIWT2_1_NTB0_NLCA1_SU16_SUM0_SUS256_SVW2_VWA2_VWB1_WG32_8_1_WGM8_WGMXCC8_WGMXCCG304
    SolutionIndex: 2
    SolutionNameMin: Cijk_Ailk_Bljk_BBS_BH_Bias_HAS_SAV_UserArgs_MT32x64x64_MI16x16x1_SN_LDSB0_GRVWA8_GRVWB8_GSU1_GSUC0_GSUWGMRR0_K1_LBSPPA512_LBSPPB128_LPA32_LPB16_LRVW8_MIWT2_1_NTB0_NLCA1_SU16_SUM0_SUS128_SVW2_VWA2_VWB1_WG16_16_1_WGM8_WGMXCC8_WGMXCCG304
    SolutionIndex: 3
    SolutionNameMin: Cijk_Ailk_Bljk_BBS_BH_Bias_HAS_SAV_UserArgs_MT128x64x64_MI16x16x1_SN_LDSB1_GRVWA8_GRVWB8_GSU1_GSUC0_GSUWGMRR0_K1_LBSPPA2048_LBSPPB256_LPA0_LWPM0p27_MIWT4_2_NTD0_SU16_SUM0_SUS256_SVW4_ULSGRO0_VWA4_VWB2_WG32_8_1_WGM1_WGMXCC8_WGMXCCG304
    SolutionIndex: 4
    SolutionNameMin: Cijk_Ailk_Bljk_BBS_BH_Bias_HAS_SAV_UserArgs_MT128x128x32_MI16x16x1_SN_GRVWB4_GSU1_GSUC0_GSUWGMRR1_K1_LBSPPA1024_LPB4_LRVW4_MIWT4_4_SU2_SUM0_SUS256_WG32_8_1_WGM1_WGMXCC16_WGMXCCG0
    SolutionIndex: 5
    SolutionNameMin: Cijk_Ailk_Bljk_BBS_BH_Bias_HAS_SAV_UserArgs_MT32x192x64_MI16x16x1_SN_GSU1_GSUAMBSK_GSUC0_GSUWGMRR1_K1_MIWT1_6_SU4_SUM0_SUS128_WGM0_WGMXCC1_WGMXCCG2
    SolutionIndex: 6
    SolutionNameMin: Cijk_Ailk_Bljk_BBS_BH_Bias_HAS_SAV_UserArgs_MT64x16x128_MI16x16x1_SN_LDSB1_GRVWA8_GRVWB8_GSU1_GSUC0_GSUWGMRR0_K1_LBSPPA1024_LBSPPB256_LPA16_LPB16_LRVW8_MIWT1_1_NLCA1_SU16_SUM0_SUS256_SVW1_VWA1_VWB1_WG64_4_1_WGM8_WGMXCC8_WGMXCCG304
    SolutionIndex: 7
    SolutionNameMin: Cijk_Ailk_Bljk_BBS_BH_Bias_HAS_SAV_UserArgs_MT128x64x64_MI16x16x1_SN_LDSB1_GRVWA8_GRVWB8_GSU1_GSUC0_GSUWGMRR0_K1_LBSPPA2048_LBSPPB256_LPA0_LWPM0p26_MIWT4_2_NTD4_SU0_SUM0_SUS0_SVW4_ULSGRO1_VWA4_VWB2_WG32_8_1_WGM1_WGMXCC8_WGMXCCG304
    SolutionIndex: 8
    SolutionNameMin: Cijk_Ailk_Bljk_BBS_BH_Bias_HAS_SAV_UserArgs_MT64x64x64_MI16x16x1_SN_LDSB1_GRVWA8_GRVWB8_GSU1_GSUC0_GSUWGMRR0_K1_LBSPPA1024_LBSPPB128_LPA0_LPB16_LRVW8_MIWT4_1_NTB0_NLCA1_SU16_SUM0_SUS128_SVW4_VWA4_VWB1_WG16_16_1_WGM8_WGMXCC8_WGMXCCG304
    SolutionIndex: 9
    SolutionNameMin: Cijk_Ailk_Bljk_BBS_BH_Bias_HAS_SAV_UserArgs_MT32x32x128_MI16x16x1_SN_LDSB1_GRVWA8_GRVWB8_GSU1_GSUC0_GSUWGMRR0_K1_LBSPPA512_LBSPPB256_LPA16_LPB16_LRVW8_MIWT1_1_NLCA1_SU16_SUM0_SUS256_SVW1_VWA1_VWB1_WG32_8_1_WGM8_WGMXCC8_WGMXCCG304
    SolutionIndex: 10
    SolutionNameMin: Cijk_Ailk_Bljk_BBS_BH_Bias_HAS_SAV_UserArgs_MT128x32x64_MI16x16x1_SN_LDSB1_GRVWA8_GRVWB8_GSU2_GSUAMB_GSUC0_GSUWGMRR0_K1_LBSPPA2048_LBSPPB256_LPA32_LPB16_LRVW8_MIWT2_2_NTD0_NEPBS16_NLCA1_SU0_SUM0_SUS0_SVW2_VWA2_VWB2_WG64_4_1_WGM1_WGMXCC1_WGMXCCG0
    SolutionIndex: 11
    SolutionNameMin: Cijk_Ailk_Bljk_BBS_BH_Bias_HAS_SAV_UserArgs_MT64x64x64_MI16x16x1_SN_LDSB1_GRVWA8_GRVWB8_GSU1_GSUC0_GSUWGMRR0_K1_LBSPPA1024_LBSPPB256_LPA32_LPB16_LRVW8_MIWT2_2_NTB0_NLCA1_SU16_SUM0_SUS128_SVW2_VWA2_VWB2_WG32_8_1_WGM8_WGMXCC8_WGMXCCG304
    SolutionIndex: 12
    SolutionNameMin: Cijk_Ailk_Bljk_BBS_BH_Bias_HAS_SAV_UserArgs_MT16x16x32_MI16x16x1_SN_GRVWB4_GSU1_LBSPPA128_LBSPPB128_LPB4_LRVW4_MIWT1_1_SU0_SUM0_SUS0_WGM1
    SolutionIndex: 13
    SolutionNameMin: Cijk_Ailk_Bljk_BBS_BH_Bias_HAS_SAV_UserArgs_MT128x128x64_MI16x16x1_SN_LDSB1_GRVWA8_GRVWB8_GSU8_GSUAMB_GSUC0_GSUWGMRR0_K1_LBSPPA2048_LBSPPB512_LPA0_LPB16_LRVW8_MIWT4_4_NTD0_NEPBS16_NLCA1_SU0_SUM0_SUS0_SVW4_VWA4_VWB4_WG32_8_1_WGM1_WGMXCC1_WGMXCCG0
    SolutionIndex: 14
    SolutionNameMin: Cijk_Ailk_Bljk_BBS_BH_Bias_HAS_SAV_UserArgs_MT32x64x64_MI16x16x1_SN_GSU1_GSUC0_GSUWGMRR1_K1_MIWT2_1_SU8_SUM3_SUS128_WGM57_WGMXCC8_WGMXCCG0
    SolutionIndex: 15
    SolutionNameMin: Cijk_Ailk_Bljk_BBS_BH_Bias_HAS_SAV_UserArgs_MT32x128x64_MI16x16x1_SN_GSU1_GSUC0_GSUWGMRR0_K1_MIWT2_2_SU2_SUM0_SUS128_WGM1_WGMXCC1_WGMXCCG38
    SolutionIndex: 16
    SolutionNameMin: Cijk_Ailk_Bljk_BBS_BH_Bias_HAS_SAV_UserArgs_MT64x32x64_MI16x16x1_SN_LDSB0_GRVWA8_GRVWB8_GSU1_GSUC0_GSUWGMRR0_K1_LBSPPA1024_LBSPPB128_LPA32_LPB16_LRVW8_MIWT2_1_NTB0_NLCA1_SU16_SUM0_SUS128_SVW2_VWA2_VWB1_WG32_8_1_WGM8_WGMXCC8_WGMXCCG304
    SolutionIndex: 17
    SolutionNameMin: Cijk_Ailk_Bljk_BBS_BH_Bias_HAS_SAV_UserArgs_MT64x64x128_MI16x16x1_SN_LDSB1_GRVWA8_GRVWB8_GSU1_GSUC0_GSUWGMRR0_K1_LBSPPA1024_LBSPPB512_LPA32_LPB16_LRVW8_MIWT2_2_NLCA1_SU16_SUM0_SUS256_SVW2_VWA2_VWB2_WG32_8_1_WGM8_WGMXCC8_WGMXCCG304
    SolutionIndex: 18
    SolutionNameMin: Cijk_Ailk_Bljk_BBS_BH_Bias_HAS_SAV_UserArgs_MT128x32x64_MI16x16x1_SN_LDSB1_GRVWA8_GRVWB8_GSU1_GSUC0_GSUWGMRR0_K1_LBSPPA2048_LBSPPB128_LPA0_LWPMn1_MIWT4_1_NTD4_SU0_SUM0_SUS0_SVW4_ULSGRO0_VWA4_VWB1_WG32_8_1_WGM1_WGMXCC8_WGMXCCG304
    SolutionIndex: 19
    SolutionNameMin: Cijk_Ailk_Bljk_BBS_BH_Bias_HAS_SAV_UserArgs_MT32x16x64_MI16x16x1_SN_GSU1_GSUC0_GSUWGMRR1_K1_MIWT1_1_SU2_SUM1_SUS128_WGM1_WGMXCC16_WGMXCCG0
    SolutionIndex: 20
    SolutionNameMin: Cijk_Ailk_Bljk_BBS_BH_Bias_HAS_SAV_UserArgs_MT64x64x64_MI16x16x1_SN_LDSB1_GRVWA8_GRVWB8_GSU4_GSUAMB_GSUC0_GSUWGMRR0_K1_LBSPPA1024_LBSPPB256_LPA32_LPB16_LRVW8_MIWT2_2_NTD0_NEPBS16_NLCA1_SU0_SUM0_SUS0_SVW2_VWA2_VWB2_WG32_8_1_WGM1_WGMXCC1_WGMXCCG0
    SolutionIndex: 21
    SolutionNameMin: Cijk_Ailk_Bljk_BBS_BH_Bias_HAS_SAV_UserArgs_MT32x16x128_MI16x16x1_SN_LDSB0_GRVWA8_GRVWB8_GSU1_LBSPPA512_LBSPPB256_LPA16_LPB16_LRVW8_MIWT1_1_NLCA1_SU16_SUM1_SUS256_SVW1_VWA1_VWB1_WG32_4_1_WGM8_WGMXCC8_WGMXCCG304
    SolutionIndex: 22
    SolutionNameMin: Cijk_Ailk_Bljk_BBS_BH_Bias_HAS_SAV_UserArgs_MT32x96x32_MI16x16x1_SN_GSU1_GSUC0_GSUWGMRR1_K1_MIWT2_3_SU2_SUM0_SUS64_WGM1_WGMXCC8_WGMXCCG0
    SolutionIndex: 23
    SolutionNameMin: Cijk_Ailk_Bljk_BBS_BH_Bias_HAS_SAV_UserArgs_MT64x256x32_MI16x16x1_SN_LDSB1_GRVWA8_GRVWB4_GSU1_GSUC0_GSUWGMRR0_K1_LBSPPA512_LBSPPB256_LPA0_LPB4_LRVW4_MIWT4_4_NLCA1_SU16_SUM0_SUS64_SVW4_VWA4_VWB4_WG16_16_1_WGM8_WGMXCC8_WGMXCCG304
    SolutionIndex: 24
    SolutionNameMin: Cijk_Ailk_Bljk_BBS_BH_Bias_HAS_SAV_UserArgs_MT128x64x64_MI16x16x1_SN_LDSB1_GRVWA8_GRVWB8_GSU4_GSUAMB_GSUC0_GSUWGMRR0_K1_LBSPPA2048_LBSPPB256_LPA0_LPB16_LRVW8_MIWT4_2_NTD0_NEPBS16_NLCA1_SU0_SUM0_SUS0_SVW4_VWA4_VWB2_WG32_8_1_WGM1_WGMXCC1_WGMXCCG0
    SolutionIndex: 25
    SolutionNameMin: Cijk_Ailk_Bljk_BBS_BH_Bias_AS_SAV_UserArgs_MT256x128x32_MI16x16x1_SN_LDSB1_GRVWB4_GSU1_GSUC0_GSUWGMRR0_K1_LBSPPA2048_LBSPPB256_LPB4_LRVW4_MIWT8_4_NTA1_NTB3_NTC5_NTD4_NEPBS0_SU0_SUM0_SUS0_SVW8_VWA8_VWB4_WG32_8_1_WGM1_WGMXCC8_WGMXCCG0
    SolutionIndex: 26
    SolutionNameMin: Cijk_Ailk_Bljk_BBS_BH_Bias_HAS_SAV_UserArgs_MT128x160x32_MI16x16x1_SN_LDSB1_GRVWA8_GRVWB4_GSU1_GSUC0_GSUWGMRR0_K1_LBSPPA1024_LBSPPB128_LPA0_LPB4_LRVW4_MIWT4_5_NTB0_NLCA1_SU16_SUM0_SUS64_SVW4_VWA4_VWB1_WG32_8_1_WGM8_WGMXCC8_WGMXCCG304
    SolutionIndex: 27
    SolutionNameMin: Cijk_Ailk_Bljk_BBS_BH_Bias_HAS_SAV_UserArgs_MT64x64x64_MI16x16x1_SN_LDSB1_GRVWA8_GRVWB8_GSU4_GSUAMB_GSUC0_GSUWGMRR0_K1_LBSPPA1024_LBSPPB256_LPA32_LPB16_LRVW8_MIWT2_2_NTD0_NEPBS16_NLCA1_SU0_SUM0_SUS0_SVW2_VWA2_VWB2_WG32_8_1_WGM1_WGMXCC1_WGMXCCG0
    SolutionIndex: 28
    SolutionNameMin: Cijk_Ailk_Bljk_BBS_BH_Bias_HAS_SAV_UserArgs_MT16x16x128_MI16x16x1_SN_LDSB0_GRVWA8_GRVWB8_GSU1_GSUC0_GSUWGMRR0_K1_LBSPPA256_LBSPPB256_LPA16_LPB16_LRVW8_MIWT1_1_NLCA1_SU16_SUM0_SUS256_SVW1_VWA1_VWB1_WG16_4_4_WGM8_WGMXCC8_WGMXCCG304
    SolutionIndex: 29
    SolutionNameMin: Cijk_Ailk_Bljk_BBS_BH_Bias_HAS_SAV_UserArgs_MT64x96x64_MI16x16x1_SN_LDSB1_GRVWA8_GRVWB8_GSU1_GSUC0_GSUWGMRR0_K1_LBSPPA1024_LBSPPB128_LPA32_LPB16_LRVW8_MIWT2_3_NTB0_NLCA1_SU16_SUM0_SUS128_SVW2_VWA2_VWB1_WG32_8_1_WGM8_WGMXCC8_WGMXCCG304
    SolutionIndex: 30
    SolutionNameMin: Cijk_Ailk_Bljk_BBS_BH_Bias_HAS_SAV_UserArgs_MT32x32x256_MI16x16x1_SN_LDSB1_GRVWA8_GRVWB8_GSU1_GSUAMB_GSUC0_GSUWGMRR0_K1_LBSPPA512_LBSPPB512_LPA16_LPB16_LRVW8_MIWT1_1_NTD4_NEPBS16_NLCA1_SU16_SUM0_SUS512_SVW1_VWA1_VWB1_WG32_8_1_WGM6_WGMXCC8_WGMXCCG304
    SolutionIndex: 31
    SolutionNameMin: Cijk_Ailk_Bljk_BBS_BH_Bias_AS_SAV_UserArgs_MT256x128x32_MI16x16x1_SN_LDSB1_GRVWB4_GSU1_GSUC0_GSUWGMRR0_K1_LBSPPA2048_LBSPPB256_LPB4_LRVW4_MIWT8_4_NTA0_NTB3_NTC4_NTD4_SU0_SUM0_SUS0_SPO1_SVW8_VWA8_VWB4_WG32_8_1_WGM32_WGMXCC8_WGMXCCG0
    SolutionIndex: 32
    SolutionNameMin: Cijk_Ailk_Bljk_BBS_BH_Bias_HAS_SAV_UserArgs_MT128x160x64_MI16x16x1_SN_LDSB1_GRVWA8_GRVWB8_GSU1_GSUC0_GSUWGMRR0_K1_LBSPPA2048_LBSPPB128_LPA0_LPB16_LRVW8_MIWT4_5_NLCA1_SU8_SUM1_SUS128_SVW4_VWA4_VWB1_WG32_8_1_WGM6_WGMXCC8_WGMXCCG304
    SolutionIndex: 33
    SolutionNameMin: Cijk_Ailk_Bljk_BBS_BH_Bias_AS_SAV_UserArgs_MT128x96x64_MI16x16x1_SN_LDSB1_GRVWB8_GSU1_GSUC0_GSUWGMRR0_K1_LBSPPA2048_LBSPPB128_LPB16_LRVW8_MIWT4_3_NTA0_NTB0_NTC4_NTD4_NEPBS16_SU0_SUM0_SUS0_SVW4_VWA4_VWB1_WG32_8_1_WGM32_WGMXCC1_WGMXCCG304
    SolutionIndex: 34
    SolutionNameMin: Cijk_Ailk_Bljk_BBS_BH_Bias_HAS_SAV_UserArgs_MT256x128x32_MI16x16x1_SN_LDSB1_DTVA0_GRVWA8_GRVWB4_GSU1_GSUC0_GSUWGMRR0_K1_LBSPPA2048_LBSPPB512_MIWT4_8_SU0_SUM0_SUS0_SVW4_ULSGRO0_VWA4_VWB8_WG64_4_1_WGM1_WGMXCC8_WGMXCCG304
    SolutionIndex: 35
    SolutionNameMin: Cijk_Ailk_Bljk_BBS_BH_Bias_AS_SAV_UserArgs_MT256x128x32_MI16x16x1_SN_LDSB1_GRVWB4_GSU1_GSUC0_GSUWGMRR0_K1_LBSPPA2048_LBSPPB512_LPB4_LRVW4_MIWT4_8_NTA2_NTB3_NTC0_NTD4_NEPBS0_SU16_SUM0_SUS64_SVW4_VWA4_VWB8_WG64_4_1_WGM32_WGMXCC1_WGMXCCG0
    SolutionIndex: 36
    SolutionNameMin: Cijk_Ailk_Bljk_BBS_BH_Bias_HAS_SAV_UserArgs_MT128x160x32_MI16x16x1_SN_LDSB1_GRVWA8_GRVWB4_GSU1_GSUC0_GSUWGMRR0_K1_LBSPPA1024_LBSPPB128_LPA0_LPB4_LRVW4_MIWT4_5_NLCA1_SU8_SUM1_SUS64_SVW4_VWA4_VWB1_WG32_8_1_WGM6_WGMXCC8_WGMXCCG304
    SolutionIndex: 37
    SolutionNameMin: Cijk_Ailk_Bljk_BBS_BH_Bias_HAS_SAV_UserArgs_MT128x256x64_MI16x16x1_SN_LDSB1_GRVWA8_GRVWB8_GSU1_GSUC0_GSUWGMRR0_K1_LBSPPA2048_LBSPPB512_LPA0_LPB16_LRVW8_MIWT8_4_NTB0_NLCA1_SU16_SUM0_SUS128_SVW8_VWA8_VWB4_WG16_16_1_WGM8_WGMXCC8_WGMXCCG304
    SolutionIndex: 38
    SolutionNameMin: Cijk_Ailk_Bljk_BBS_BH_Bias_AS_SAV_UserArgs_MT256x128x32_MI16x16x1_SN_LDSB1_GRVWB4_GSU1_GSUC0_GSUWGMRR0_K1_LBSPPA2048_LBSPPB256_LPB4_LRVW4_MIWT8_4_NTA2_NTB3_NTC4_NTD5_NEPBS16_SU0_SUM0_SUS0_SVW8_VWA8_VWB4_WG32_8_1_WGM1_WGMXCC8_WGMXCCG0
    SolutionIndex: 39
    SolutionNameMin: Cijk_Ailk_Bljk_BBS_BH_Bias_HAS_SAV_UserArgs_MT32x64x128_MI16x16x1_SN_LDSB1_GRVWA8_GRVWB8_GSU1_GSUAMB_GSUC0_GSUWGMRR0_K1_LBSPPA512_LBSPPB256_LPA32_LPB16_LRVW8_MIWT2_1_NTD4_NEPBS16_NLCA1_SU16_SUM0_SUS256_SVW2_VWA2_VWB1_WG16_16_1_WGM6_WGMXCC8_WGMXCCG304
    SolutionIndex: 40
    SolutionNameMin: Cijk_Ailk_Bljk_BBS_BH_Bias_HAS_SAV_UserArgs_MT16x32x64_MI16x16x1_SN_GSU1_GSUC0_GSUWGMRR0_K1_MIWT1_1_SU2_SUM1_SUS256_WGM1_WGMXCC8_WGMXCCG0
    SolutionIndex: 41
    SolutionNameMin: Cijk_Ailk_Bljk_BBS_BH_Bias_HAS_SAV_UserArgs_MT256x16x32_MI16x16x1_SN_LDSB1_GRVWA8_GRVWB2_GSU1_GSUC0_GSUWGMRR0_K1_LBSPPA2048_LBSPPB128_LPA0_LPB4_LRVW4_MIWT4_1_NLCA1_SU16_SUM0_SUS64_SVW4_VWA4_VWB1_WG64_4_1_WGM8_WGMXCC8_WGMXCCG304
    SolutionIndex: 42
    SolutionNameMin: Cijk_Ailk_Bljk_BBS_BH_Bias_HAS_SAV_UserArgs_MT64x48x128_MI16x16x1_SN_LDSB1_GRVWA8_GRVWB8_GSU1_GSUAMB_GSUC0_GSUWGMRR0_K1_LBSPPA1024_LBSPPB256_LPA16_LPB16_LRVW8_MIWT1_3_NTB0_NTD4_NEPBS16_NLCA1_SU16_SUM0_SUS256_SVW1_VWA1_VWB1_WG64_4_1_WGM6_WGMXCC8_WGMXCCG304
    SolutionIndex: 43
    SolutionNameMin: Cijk_Ailk_Bljk_BBS_BH_Bias_HAS_SAV_UserArgs_MT256x32x32_MI16x16x1_SN_LDSB1_GRVWA8_GRVWB4_GSU1_GSUAMB_GSUC0_GSUWGMRR0_K1_LBSPPA2048_LBSPPB128_LPA0_LPB4_LRVW4_MIWT4_2_NTD4_NEPBS16_NLCA1_SU16_SUM0_SUS64_SVW4_VWA4_VWB2_WG64_4_1_WGM6_WGMXCC8_WGMXCCG304
    SolutionIndex: 44
    SolutionNameMin: Cijk_Ailk_Bljk_BBS_BH_Bias_HAS_SAV_UserArgs_MT64x32x64_MI16x16x1_SN_LDSB0_GRVWA8_GRVWB8_GSU1_GSUC0_GSUWGMRR0_K1_LBSPPA1024_LBSPPB128_LPA32_LPB16_LRVW8_MIWT2_1_NLCA1_SU16_SUM0_SUS128_SVW2_VWA2_VWB1_WG32_8_1_WGM8_WGMXCC8_WGMXCCG304
    SolutionIndex: 45
    SolutionNameMin: Cijk_Ailk_Bljk_BBS_BH_Bias_HAS_SAV_UserArgs_MT128x64x64_MI16x16x1_SN_LDSB1_GRVWA8_GRVWB8_GSU1_GSUC0_GSUWGMRR0_K1_LBSPPA2048_LBSPPB256_LPA0_LWPM0p27_MIWT4_2_NTD4_SU0_SUM0_SUS0_SVW4_ULSGRO0_VWA4_VWB2_WG32_8_1_WGM1_WGMXCC8_WGMXCCG304
    SolutionIndex: 46
    SolutionNameMin: Cijk_Ailk_Bljk_BBS_BH_Bias_HAS_SAV_UserArgs_MT128x64x128_MI16x16x1_SN_LDSB1_GRVWA8_GRVWB8_GSU1_GSUC0_GSUWGMRR0_K1_LBSPPA2048_LBSPPB512_LPA0_LPB16_LRVW8_MIWT4_2_NTB0_NLCA1_SU16_SUM0_SUS256_SVW4_VWA4_VWB2_WG32_8_1_WGM8_WGMXCC8_WGMXCCG304
    SolutionIndex: 47
    SolutionNameMin: Cijk_Ailk_Bljk_BBS_BH_Bias_AS_SAV_UserArgs_MT256x128x32_MI16x16x1_SN_LDSB1_GRVWB4_GSU1_GSUC0_GSUWGMRR0_K1_LBSPPA2048_LBSPPB256_LPB4_LRVW4_MIWT8_4_NTA1_NTB3_NTC5_NTD4_NEPBS16_SU0_SUM0_SUS0_SVW8_VWA8_VWB4_WG32_8_1_WGM1_WGMXCC8_WGMXCCG0
    SolutionIndex: 48
    SolutionNameMin: Cijk_Ailk_Bljk_BBS_BH_Bias_HAS_SAV_UserArgs_MT128x128x64_MI16x16x1_SN_LDSB1_GRVWA8_GRVWB8_GSU3_GSUAMB_GSUC0_GSUWGMRR0_K1_LBSPPA2048_LBSPPB512_LPA0_LPB16_LRVW8_MIWT4_4_NTD0_NEPBS16_NLCA1_SU0_SUM0_SUS0_SVW4_VWA4_VWB4_WG32_8_1_WGM1_WGMXCC1_WGMXCCG0
    SolutionIndex: 49
    SolutionNameMin: Cijk_Ailk_Bljk_BBS_BH_Bias_HAS_SAV_UserArgs_MT32x32x128_MI16x16x1_SN_LDSB1_GRVWA8_GRVWB8_GSU1_GSUAMB_GSUC0_GSUWGMRR0_K1_LBSPPA512_LBSPPB256_LPA16_LPB16_LRVW8_MIWT1_1_NTD4_NEPBS16_NLCA1_SU16_SUM0_SUS256_SVW1_VWA1_VWB1_WG32_8_1_WGM6_WGMXCC8_WGMXCCG304
    SolutionIndex: 50
    SolutionNameMin: Cijk_Ailk_Bljk_BBS_BH_Bias_HAS_SAV_UserArgs_MT192x256x64_MI16x16x1_SN_LDSB1_GRVWA8_GRVWB8_GSU1_GSUAMB_GSUC0_GSUWGMRR0_K1_LBSPPA3072_LBSPPB1024_LPA32_LPB16_LRVW8_MIWT6_8_NTB4_NTD4_NEPBS16_NLCA3_SU16_SUM0_SUS128_SVW2_VWA2_VWB8_WG32_8_1_WGM6_WGMXCC8_WGMXCCG304
    SolutionIndex: 51
    SolutionNameMin: Cijk_Ailk_Bljk_BBS_BH_Bias_HAS_SAV_UserArgs_MT64x64x64_MI16x16x1_SN_LDSB1_GRVWA8_GRVWB8_GSU1_GSUC0_GSUWGMRR0_K1_LBSPPA1024_LBSPPB256_LPA32_LPB16_LRVW8_MIWT2_2_NLCA1_SU16_SUM0_SUS128_SVW2_VWA2_VWB2_WG32_8_1_WGM8_WGMXCC8_WGMXCCG304
    SolutionIndex: 52
    SolutionNameMin: Cijk_Ailk_Bljk_BBS_BH_Bias_HAS_SAV_UserArgs_MT64x32x128_MI16x16x1_SN_LDSB1_GRVWA8_GRVWB8_GSU1_GSUC0_GSUWGMRR0_K1_LBSPPA1024_LBSPPB256_LPA32_LPB16_LRVW8_MIWT2_1_NLCA1_SU16_SUM0_SUS256_SVW2_VWA2_VWB1_WG32_8_1_WGM8_WGMXCC8_WGMXCCG304
    SolutionIndex: 53
    SolutionNameMin: Cijk_Ailk_Bljk_BBS_BH_Bias_HAS_SAV_UserArgs_MT320x128x64_MI16x16x1_SN_LDSB1_GRVWA8_GRVWB8_GSU2_GSUAMB_GSUC0_GSUWGMRR0_K1_LBSPPA5120_LBSPPB1024_LPA16_LPB16_LRVW8_MIWT5_8_NTD0_NEPBS16_NLCA5_SU0_SUM0_SUS0_SVW1_VWA1_VWB8_WG64_4_1_WGM1_WGMXCC1_WGMXCCG0
    SolutionIndex: 54
    SolutionNameMin: Cijk_Ailk_Bljk_BBS_BH_Bias_HAS_SAV_UserArgs_MT32x32x64_MI16x16x1_SN_LDSB0_GRVWA8_GRVWB8_GSU1_GSUC0_GSUWGMRR0_K1_LBSPPA512_LBSPPB128_LPA16_LPB16_LRVW8_MIWT1_1_NLCA1_SU16_SUM0_SUS128_SVW1_VWA1_VWB1_WG32_8_1_WGM8_WGMXCC8_WGMXCCG304
    SolutionIndex: 55
    SolutionNameMin: Cijk_Ailk_Bljk_BBS_BH_Bias_HAS_SAV_UserArgs_MT128x256x32_MI16x16x1_SN_LDSB1_GRVWA8_GRVWB4_GSU1_GSUC0_GSUWGMRR0_K1_LBSPPA1024_LBSPPB256_LPA0_LPB4_LRVW4_MIWT8_4_NTB0_NLCA1_SU8_SUM1_SUS64_SVW8_VWA8_VWB4_WG16_16_1_WGM6_WGMXCC8_WGMXCCG304
    SolutionIndex: 56
    SolutionNameMin: Cijk_Ailk_Bljk_BBS_BH_Bias_HAS_SAV_UserArgs_MT256x32x32_MI16x16x1_SN_LDSB1_GRVWA8_GRVWB4_GSU1_GSUC0_GSUWGMRR0_K1_LBSPPA2048_LBSPPB128_LPA0_LPB4_LRVW4_MIWT4_2_NLCA1_SU16_SUM0_SUS64_SVW4_VWA4_VWB2_WG64_4_1_WGM8_WGMXCC8_WGMXCCG304
    SolutionIndex: 57
    SolutionNameMin: Cijk_Ailk_Bljk_BBS_BH_Bias_HAS_SAV_UserArgs_MT64x16x128_MI16x16x1_SN_LDSB1_GRVWA8_GRVWB8_GSU1_GSUC0_GSUWGMRR0_K1_LBSPPA1024_LBSPPB256_LPA16_LPB16_LRVW8_MIWT1_1_NLCA1_SU16_SUM0_SUS256_SVW1_VWA1_VWB1_WG64_4_1_WGM8_WGMXCC8_WGMXCCG304
    SolutionIndex: 58
    SolutionNameMin: Cijk_Ailk_Bljk_BBS_BH_Bias_HAS_SAV_UserArgs_MT128x16x64_MI16x16x1_SN_LDSB1_GRVWA8_GRVWB4_GSU1_GSUC0_GSUWGMRR0_K1_LBSPPA2048_LBSPPB128_LPA32_LPB16_LRVW8_MIWT2_1_NLCA1_SU16_SUM0_SUS128_SVW2_VWA2_VWB1_WG64_4_1_WGM8_WGMXCC8_WGMXCCG304
- - - [256, 32768, 1, 256]
    - [0, 0.0]
  - - [256, 512, 1, 896]
    - [1, 0.0]
  - - [256, 512, 1, 64]
    - [2, 0.0]
  - - [768, 512, 1, 1296]
    - [3, 0.0]
  - - [4096, 512, 1, 128]
    - [4, 0.0]
  - - [1312, 512, 1, 64]
    - [5, 0.0]
  - - [64, 1024, 1, 1179]
    - [6, 0.0]
  - - [768, 512, 1, 320]
    - [7, 0.0]
  - - [64, 64, 512, 64]
    - [8, 0.0]
  - - [768, 512, 1, 192]
    - [7, 0.0]
  - - [128, 512, 1, 896]
    - [9, 0.0]
  - - [768, 512, 1, 512]
    - [7, 0.0]
  - - [256, 512, 1, 1888]
    - [10, 0.0]
  - - [448, 512, 1, 448]
    - [11, 0.0]
  - - [32, 1024, 1, 32]
    - [12, 0.0]
  - - [768, 512, 1, 272]
    - [7, 0.0]
  - - [128, 1024, 1, 9775]
    - [13, 0.0]
  - - [32, 8192, 1, 82]
    - [14, 0.0]
  - - [32, 16384, 1, 128]
    - [15, 0.0]
  - - [256, 512, 1, 776]
    - [16, 0.0]
  - - [512, 512, 1, 1280]
    - [17, 0.0]
  - - [36, 1024, 1, 60]
    - [12, 0.0]
  - - [2048, 1024, 1, 1032]
    - [0, 0.0]
  - - [128, 512, 1, 64]
    - [18, 0.0]
  - - [8, 512, 1, 16]
    - [19, 0.0]
  - - [128, 512, 1, 416]
    - [9, 0.0]
  - - [128, 512, 1, 1240]
    - [20, 0.0]
  - - [64, 512, 1, 512]
    - [21, 0.0]
  - - [64, 32, 6144, 32]
    - [22, 0.0]
  - - [64, 32768, 1, 128]
    - [23, 0.0]
  - - [256, 1024, 1, 544]
    - [11, 0.0]
  - - [128, 248, 512, 248]
    - [4, 0.0]
  - - [256, 512, 1, 2968]
    - [24, 0.0]
  - - [1024, 248, 512, 248]
    - [25, 0.0]
  - - [128, 40960, 1, 256]
    - [26, 0.0]
  - - [256, 512, 1, 1312]
    - [1, 0.0]
  - - [64, 1024, 1, 1216]
    - [27, 0.0]
  - - [128, 1024, 1, 512]
    - [16, 0.0]
  - - [32, 512, 1, 128]
    - [28, 0.0]
  - - [544, 512, 1, 744]
    - [29, 0.0]
  - - [128, 512, 1, 1280]
    - [30, 0.0]
  - - [256, 32768, 1, 128]
    - [31, 0.0]
  - - [1152, 1024, 1, 512]
    - [32, 0.0]
  - - [128, 126976, 1, 512]
    - [33, 0.0]
  - - [768, 512, 1, 128]
    - [7, 0.0]
  - - [1792, 1024, 1, 792]
    - [34, 0.0]
  - - [768, 16384, 1, 768]
    - [35, 0.0]
  - - [128, 51200, 1, 168]
    - [36, 0.0]
  - - [128, 16384, 1, 256]
    - [37, 0.0]
  - - [512, 15360, 1, 196]
    - [38, 0.0]
  - - [16, 512, 1, 32]
    - [12, 0.0]
  - - [32, 16384, 1, 768]
    - [39, 0.0]
  - - [48, 1024, 1, 176]
    - [40, 0.0]
  - - [32, 512, 1, 32]
    - [12, 0.0]
  - - [768, 512, 1, 640]
    - [7, 0.0]
  - - [128, 512, 1, 256]
    - [6, 0.0]
  - - [128, 512, 1, 48]
    - [12, 0.0]
  - - [256, 61440, 1, 88]
    - [25, 0.0]
  - - [256, 512, 1, 640]
    - [1, 0.0]
  - - [9775, 1024, 1, 128]
    - [4, 0.0]
  - - [128, 512, 1, 16]
    - [12, 0.0]
  - - [1024, 8, 512, 248]
    - [41, 0.0]
  - - [128, 512, 1, 80]
    - [19, 0.0]
  - - [256, 512, 1, 288]
    - [16, 0.0]
  - - [32, 40960, 1, 128]
    - [22, 0.0]
  - - [64, 512, 1, 32]
    - [12, 0.0]
  - - [264, 512, 1, 1792]
    - [42, 0.0]
  - - [16, 16384, 1, 768]
    - [40, 0.0]
  - - [128, 512, 1, 160]
    - [19, 0.0]
  - - [768, 512, 1, 64]
    - [18, 0.0]
  - - [768, 32, 512, 16]
    - [43, 0.0]
  - - [128, 512, 1, 128]
    - [6, 0.0]
  - - [256, 512, 1, 3384]
    - [13, 0.0]
  - - [256, 512, 1, 128]
    - [44, 0.0]
  - - [1024, 126976, 1, 512]
    - [35, 0.0]
  - - [768, 512, 1, 256]
    - [45, 0.0]
  - - [128, 512, 1, 192]
    - [40, 0.0]
  - - [256, 512, 1, 112]
    - [16, 0.0]
  - - [768, 512, 1, 1024]
    - [46, 0.0]
  - - [128, 512, 1, 704]
    - [40, 0.0]
  - - [256, 61440, 1, 104]
    - [47, 0.0]
  - - [32, 32, 512, 32]
    - [22, 0.0]
  - - [640, 512, 1, 2672]
    - [48, 0.0]
  - - [128, 512, 1, 352]
    - [40, 0.0]
  - - [128, 512, 1, 800]
    - [9, 0.0]
  - - [512, 512, 1, 64]
    - [18, 0.0]
  - - [256, 512, 1, 544]
    - [44, 0.0]
  - - [768, 1024, 8, 3072]
    - [50, 0.0]
  - - [128, 512, 1, 112]
    - [19, 0.0]
  - - [512, 512, 1, 704]
    - [51, 0.0]
  - - [256, 40960, 1, 128]
    - [38, 0.0]
  - - [640, 512, 1, 256]
    - [7, 0.0]
  - - [256, 16384, 1, 128]
    - [38, 0.0]
  - - [192, 512, 1, 416]
    - [16, 0.0]
  - - [256, 512, 1, 1168]
    - [1, 0.0]
  - - [256, 512, 1, 256]
    - [16, 0.0]
  - - [256, 61440, 1, 192]
    - [36, 0.0]
  - - [256, 512, 1, 1824]
    - [52, 0.0]
  - - [512, 20480, 1, 200]
    - [47, 0.0]
  - - [2064, 512, 1, 6672]
    - [53, 0.0]
  - - [512, 512, 1, 1144]
    - [51, 0.0]
  - - [32, 512, 1, 24]
    - [54, 0.0]
  - - [128, 32768, 1, 256]
    - [55, 0.0]
  - - [128, 512, 1, 320]
    - [40, 0.0]
  - - [128, 1024, 1, 128]
    - [44, 0.0]
  - - [64, 1024, 1, 800]
    - [49, 0.0]
  - - [64, 512, 1, 256]
    - [40, 0.0]
  - - [768, 32, 512, 32]
    - [56, 0.0]
  - - [32, 64, 512, 32]
    - [22, 0.0]
  - - [64, 1024, 1, 128]
    - [57, 0.0]
  - - [512, 20480, 1, 98]
    - [47, 0.0]
  - - [32, 32768, 1, 128]
    - [22, 0.0]
  - - [64, 30720, 1, 32]
    - [23, 0.0]
  - - [192, 512, 1, 704]
    - [16, 0.0]
  - - [128, 512, 1, 448]
    - [40, 0.0]
  - - [128, 512, 1, 32]
    - [12, 0.0]
  - - [1024, 512, 1, 128]
    - [7, 0.0]
  - - [128, 2, 512, 248]
    - [58, 0.0]
  - - [32, 80, 512, 32]
    - [22, 0.0]
  - - [64, 512, 1, 128]
    - [19, 0.0]
- null
- null
- DeviceEfficiency
- Equality
