library/src/amd_detail/rocblaslt/src/Tensile/Logic/asm_full/aquavanjaram/gfx942_64cu/Equality/aquavanjaram_Cijk_Ailk_Bljk_SB_Bias_HA_SAV.yaml
- {MinimumRequiredVersion: 4.33.0}
- aquavanjaram
- {Architecture: gfx942, CUCount: 64}
- [Device 0049]
    SolutionIndex: 0
    SolutionNameMin: Cijk_Ailk_Bljk_SB_SAV_MT64x32x32_MI16x16x4x1_SN_1LDSB0_GRVW4_GSU7_LPB8_LRVW4_NLCA1_PLR9_TT2_16_WG32_8_1
    SolutionIndex: 1
    SolutionNameMin: Cijk_Ailk_Bljk_SB_SAV_MT32x64x16_MI16x16x4x1_SN_1LDSB0_GRVW2_GSU1_LPB2_LRVW2_NEPBS2_NLCA1_PLR5_SPO1_TT2_16_WG16_16_1
    SolutionIndex: 2
    SolutionNameMin: Cijk_Ailk_Bljk_SB_SAV_MT64x48x32_MI16x16x4x1_SN_1LDSB0_GRVW2_GSU7_LPB8_LRVW4_NLCA1_PLR9_TT1_48_WG64_4_1
    SolutionIndex: 3
    SolutionNameMin: Cijk_Ailk_Bljk_SB_SAV_MT64x32x32_MI16x16x4x1_SN_1LDSB0_GRVW4_GSU2_LPB8_LRVW4_NEPBS2_NLCA1_PLR9_SPO1_TT2_16_WG32_8_1
    SolutionIndex: 4
    SolutionNameMin: Cijk_Ailk_Bljk_SB_SAV_MT32x32x16_MI16x16x4x1_SN_1LDSB0_GRVW2_GSU1_LPB2_LRVW2_NEPBS2_NLCA1_PLR5_SPO1_TT1_16_WG32_8_1
    SolutionIndex: 5
    SolutionNameMin: Cijk_Ailk_Bljk_SB_SAV_MT64x16x16_MI16x16x4x1_SN_1LDSB0_GRVW1_GSU1_LPB2_LRVW2_NEPBS2_NLCA1_PLR5_SPO1_TT1_16_WG64_4_1
    SolutionIndex: 6
    SolutionNameMin: Cijk_Ailk_Bljk_SB_SAV_MT96x64x32_MI16x16x4x1_SN_1LDSB1_GRVW4_GSU1_LPB8_LRVW4_NEPBS2_NLCA3_PLR9_SPO1_TT6_16_WG16_16_1
    SolutionIndex: 7
    SolutionNameMin: Cijk_Ailk_Bljk_SB_SAV_MT64x32x32_MI16x16x4x1_SN_1LDSB0_GRVW4_GSU1_LPB8_LRVW4_NLCA1_PLR9_TT2_16_WG32_8_1
    SolutionIndex: 8
    SolutionNameMin: Cijk_Ailk_Bljk_SB_SAV_MT64x32x32_MI16x16x4x1_SN_1LDSB0_GRVW4_GSU7_LPB8_LRVW4_NEPBS2_NLCA1_PLR9_SPO1_TT2_16_WG32_8_1
    SolutionIndex: 9
    SolutionNameMin: Cijk_Ailk_Bljk_SB_SAV_MT64x32x32_MI16x16x4x1_SN_1LDSB0_GRVW4_GSU5_LPB8_LRVW4_NEPBS2_NLCA1_PLR9_SPO1_TT2_16_WG32_8_1
    SolutionIndex: 10
    SolutionNameMin: Cijk_Ailk_Bljk_SB_SAV_MT32x32x32_MI16x16x4x1_SN_1LDSB0_GRVW4_GSU15_LPB8_LRVW4_NLCA1_PLR9_TT1_16_WG32_8_1
    SolutionIndex: 11
    SolutionNameMin: Cijk_Ailk_Bljk_SB_SAV_MT128x16x32_MI16x16x4x1_SN_1LDSB0_GRVW2_GSU5_LPB8_LRVW4_NLCA1_PLR9_TT2_16_WG64_4_1
    SolutionIndex: 12
    SolutionNameMin: Cijk_Ailk_Bljk_SB_SAV_MT32x32x32_MI16x16x4x1_SN_1LDSB0_GRVW4_GSU1_LPB8_LRVW4_NEPBS2_NLCA1_PLR9_SPO1_TT1_16_WG32_8_1
    SolutionIndex: 13
    SolutionNameMin: Cijk_Ailk_Bljk_SB_SAV_MT128x32x32_MI32x32x2x1_SN_1LDSB0_GRVW4_GSU2_LPB4_LRVW4_NLCA1_PLR17_TT1_32_WG128_2_1
    SolutionIndex: 14
    SolutionNameMin: Cijk_Ailk_Bljk_SB_SAV_MT160x32x32_MI16x16x4x1_SN_1LDSB1_GRVW4_GSU2_LPB8_LRVW4_NEPBS2_NLCA5_PLR9_SPO1_TT5_16_WG32_8_1
    SolutionIndex: 15
    SolutionNameMin: Cijk_Ailk_Bljk_SB_SAV_MT64x16x16_MI16x16x4x1_SN_1LDSB0_GRVW1_GSU7_LPB2_LRVW2_NEPBS2_NLCA1_PLR5_SPO1_TT1_16_WG64_4_1
    SolutionIndex: 16
    SolutionNameMin: Cijk_Ailk_Bljk_SB_SAV_MT128x256x16_MI32x32x2x1_SN_1LDSB1_GRVW4_GSU1_LPB4_LRVW4_NEPBS2_NLCA1_PLR9_SPO1_TT2_128_WG64_4_1
    SolutionIndex: 17
    SolutionNameMin: Cijk_Ailk_Bljk_SB_SAV_MT64x16x32_MI16x16x4x1_SN_1LDSB0_GRVW2_GSU7_LPB8_LRVW4_NLCA1_PLR9_TT1_16_WG64_4_1
    SolutionIndex: 18
    SolutionNameMin: Cijk_Ailk_Bljk_SB_SAV_MT64x32x32_MI16x16x4x1_SN_1LDSB0_GRVW4_GSU3_LPB8_LRVW4_NEPBS2_NLCA1_PLR9_SPO1_TT2_16_WG32_8_1
    SolutionIndex: 19
    SolutionNameMin: Cijk_Ailk_Bljk_SB_SAV_MT192x64x32_MI32x32x2x1_SN_1LDSB1_GRVW4_GSU1_LPB4_LRVW4_NLCA3_PLR17_TT3_32_WG64_4_1
    SolutionIndex: 20
    SolutionNameMin: Cijk_Ailk_Bljk_SB_SAV_MT64x48x32_MI16x16x4x1_SN_1LDSB0_GRVW2_GSU2_LPB8_LRVW4_NLCA1_PLR9_TT1_48_WG64_4_1
    SolutionIndex: 21
    SolutionNameMin: Cijk_Ailk_Bljk_SB_SAV_MT128x144x16_MI16x16x4x1_SN_1LDSB1_GRVW1_GSU1_LPB2_LRVW2_NEPBS2_NLCA1_PLR5_SPO1_TT2_144_WG64_4_1
    SolutionIndex: 22
    SolutionNameMin: Cijk_Ailk_Bljk_SB_SAV_MT128x32x32_MI32x32x2x1_SN_1LDSB0_GRVW4_GSU2_LPB4_LRVW4_NEPBS0_NLCA1_PLR17_SPO0_TT1_32_WG128_2_1
    SolutionIndex: 23
    SolutionNameMin: Cijk_Ailk_Bljk_SB_SAV_MT16x64x16_MI16x16x4x1_SN_1LDSB0_GRVW1_GSU1_LPB2_LRVW2_NEPBS2_NLCA1_PLR5_SPO1_TT1_16_WG16_16_1
    SolutionIndex: 24
    SolutionNameMin: Cijk_Ailk_Bljk_SB_SAV_MT128x128x16_MI32x32x2x1_SN_1LDSB1_GRVW4_GSU1_LPB4_LRVW4_NEPBS2_NLCA1_PLR9_SPO1_TT2_64_WG64_4_1
    SolutionIndex: 25
    SolutionNameMin: Cijk_Ailk_Bljk_SB_SAV_MT32x96x32_MI16x16x4x1_SN_1LDSB1_GRVW4_GSU1_LPB8_LRVW4_NEPBS2_NLCA1_PLR9_SPO1_TT1_48_WG32_8_1
    SolutionIndex: 26
    SolutionNameMin: Cijk_Ailk_Bljk_SB_SAV_MT128x48x16_MI16x16x4x1_SN_1LDSB0_GRVW1_GSU7_LPB2_LRVW2_NEPBS2_NLCA1_PLR5_SPO1_TT2_48_WG64_4_1
    SolutionIndex: 27
    SolutionNameMin: Cijk_Ailk_Bljk_SB_SAV_MT96x32x32_MI16x16x4x1_SN_1LDSB1_GRVW4_GSU1_LPB8_LRVW4_NEPBS2_NLCA3_PLR9_SPO1_TT3_16_WG32_8_1
    SolutionIndex: 28
    SolutionNameMin: Cijk_Ailk_Bljk_SB_SAV_MT96x32x32_MI16x16x4x1_SN_1LDSB1_GRVW4_GSU3_LPB8_LRVW4_NEPBS2_NLCA3_PLR9_SPO1_TT3_16_WG32_8_1
    SolutionIndex: 29
    SolutionNameMin: Cijk_Ailk_Bljk_SB_SAV_MT256x64x16_MI32x32x2x1_SN_1LDSB1_AMAS3_GRVW4_GSU1_LPA0_LPB4_NLCA1_SVW2_TT2_64_VW2_WG128_2_1
    SolutionIndex: 30
    SolutionNameMin: Cijk_Ailk_Bljk_SB_SAV_MT144x64x32_MI16x16x4x1_SN_1LDSB0_GRVW2_GSU2_LPB8_LRVW4_NLCA9_PLR9_TT9_16_WG16_16_1
    SolutionIndex: 31
    SolutionNameMin: Cijk_Ailk_Bljk_SB_SAV_MT64x32x32_MI16x16x4x1_SN_1LDSB0_GRVW4_GSU1_LPB8_LRVW4_NEPBS2_NLCA1_PLR9_SPO1_TT2_16_WG32_8_1
    SolutionIndex: 32
    SolutionNameMin: Cijk_Ailk_Bljk_SB_SAV_MT64x16x32_MI16x16x4x1_SN_1LDSB0_GRVW2_GSU3_LPB8_LRVW4_NEPBS2_NLCA1_PLR9_SPO1_TT1_16_WG64_4_1
    SolutionIndex: 33
    SolutionNameMin: Cijk_Ailk_Bljk_SB_SAV_MT32x64x32_MI16x16x4x1_SN_1LDSB0_GRVW4_GSU1_LPB8_LRVW4_NEPBS2_NLCA1_PLR9_SPO1_TT2_16_WG16_16_1
    SolutionIndex: 34
    SolutionNameMin: Cijk_Ailk_Bljk_SB_SAV_MT32x32x32_MI16x16x4x1_SN_1LDSB0_GRVW4_GSU7_LPB8_LRVW4_NEPBS2_NLCA1_PLR9_SPO1_TT1_16_WG32_8_1
    SolutionIndex: 35
    SolutionNameMin: Cijk_Ailk_Bljk_SB_SAV_MT64x48x16_MI16x16x4x1_SN_1LDSB0_GRVW1_GSU7_LPB2_LRVW2_NEPBS2_NLCA1_PLR5_SPO1_TT1_48_WG64_4_1
    SolutionIndex: 36
    SolutionNameMin: Cijk_Ailk_Bljk_SB_SAV_MT96x32x32_MI16x16x4x1_SN_1LDSB0_GRVW4_GSU1_LPB8_LRVW4_NLCA3_PLR9_TT3_16_WG32_8_1
    SolutionIndex: 37
    SolutionNameMin: Cijk_Ailk_Bljk_SB_SAV_MT32x160x32_MI16x16x4x1_SN_1LDSB1_GRVW4_GSU1_LPB8_LRVW4_NEPBS2_NLCA1_PLR9_SPO1_TT1_80_WG32_8_1
    SolutionIndex: 38
    SolutionNameMin: Cijk_Ailk_Bljk_SB_SAV_MT160x32x32_MI16x16x4x1_SN_1LDSB1_GRVW4_GSU1_LPB8_LRVW4_NEPBS2_NLCA5_PLR9_SPO1_TT5_16_WG32_8_1
    SolutionIndex: 39
    SolutionNameMin: Cijk_Ailk_Bljk_SB_SAV_MT128x16x16_MI16x16x4x1_SN_1LDSB0_GRVW1_GSU7_LPB2_LRVW2_NEPBS2_NLCA1_PLR5_SPO1_TT2_16_WG64_4_1
    SolutionIndex: 40
    SolutionNameMin: Cijk_Ailk_Bljk_SB_SAV_MT64x64x32_MI32x32x2x1_SN_1LDSB0_GRVW4_GSU2_LPB4_LRVW4_NLCA1_PLR17_TT1_32_WG64_4_1
    SolutionIndex: 41
    SolutionNameMin: Cijk_Ailk_Bljk_SB_SAV_MT192x32x32_MI16x16x4x1_SN_1LDSB1_GRVW4_GSU1_LPB8_LRVW4_NEPBS2_NLCA3_PLR9_SPO1_TT6_16_WG32_8_1
    SolutionIndex: 42
    SolutionNameMin: Cijk_Ailk_Bljk_SB_SAV_MT128x32x32_MI32x32x2x1_SN_1LDSB0_GRVW4_GSU1_LPB4_LRVW4_NEPBS0_NLCA1_PLR17_SPO0_TT1_32_WG128_2_1
    SolutionIndex: 43
    SolutionNameMin: Cijk_Ailk_Bljk_SB_SAV_MT96x32x32_MI16x16x4x1_SN_1LDSB0_GRVW4_GSU3_LPB8_LRVW4_NLCA3_PLR9_TT3_16_WG32_8_1
    SolutionIndex: 44
    SolutionNameMin: Cijk_Ailk_Bljk_SB_SAV_MT32x32x32_MI16x16x4x1_SN_1LDSB0_GRVW4_GSU15_LPB8_LRVW4_NEPBS2_NLCA1_PLR9_SPO1_TT1_16_WG32_8_1
    SolutionIndex: 45
    SolutionNameMin: Cijk_Ailk_Bljk_SB_SAV_MT256x128x16_MI32x32x2x1_SN_1LDSB1_GRVW4_GSU1_LPB4_LRVW4_NEPBS2_NLCA1_PLR9_SPO1_TT4_64_WG64_4_1
- - - [512, 31, 1, 1128]
    - [0, 0.0]
  - - [32, 64, 512, 32]
    - [1, 0.0]
  - - [512, 44, 1, 1128]
    - [2, 0.0]
  - - [512, 125, 1, 1128]
    - [3, 0.0]
  - - [32, 32, 512, 32]
    - [4, 0.0]
  - - [1, 203, 1, 256]
    - [5, 0.0]
  - - [768, 512, 1, 1293]
    - [6, 0.0]
  - - [256, 512, 1, 540]
    - [7, 0.0]
  - - [512, 57, 1, 1128]
    - [8, 0.0]
  - - [512, 85, 1, 1128]
    - [9, 0.0]
  - - [32, 19, 1, 1302]
    - [10, 0.0]
  - - [512, 73, 1, 1128]
    - [9, 0.0]
  - - [256, 73, 1, 512]
    - [9, 0.0]
  - - [256, 91, 1, 512]
    - [11, 0.0]
  - - [1, 1, 16, 256]
    - [5, 0.0]
  - - [1, 1, 84, 256]
    - [5, 0.0]
  - - [256, 512, 1, 288]
    - [7, 0.0]
  - - [512, 60, 1, 1128]
    - [8, 0.0]
  - - [256, 203, 1, 512]
    - [12, 0.0]
  - - [256, 217, 1, 512]
    - [12, 0.0]
  - - [256, 512, 1, 1824]
    - [13, 0.0]
  - - [257, 512, 1, 1792]
    - [14, 0.0]
  - - [256, 31, 1, 512]
    - [15, 0.0]
  - - [128, 32768, 1, 256]
    - [16, 0.0]
  - - [1, 190, 1, 256]
    - [15, 0.0]
  - - [256, 41, 1, 512]
    - [8, 0.0]
  - - [512, 14, 1, 1128]
    - [17, 0.0]
  - - [256, 101, 1, 512]
    - [18, 0.0]
  - - [1520, 512, 1, 5897]
    - [19, 0.0]
  - - [512, 187, 1, 1128]
    - [20, 0.0]
  - - [256, 251, 1, 512]
    - [12, 0.0]
  - - [256, 40960, 1, 128]
    - [21, 0.0]
  - - [512, 251, 1, 1128]
    - [22, 0.0]
  - - [1, 1, 20, 256]
    - [23, 0.0]
  - - [256, 92, 1, 512]
    - [9, 0.0]
  - - [256, 81, 1, 512]
    - [9, 0.0]
  - - [512, 101, 1, 1128]
    - [3, 0.0]
  - - [32, 23, 1, 1302]
    - [10, 0.0]
  - - [256, 252, 1, 512]
    - [12, 0.0]
  - - [512, 51, 1, 1128]
    - [8, 0.0]
  - - [512, 20, 1, 1128]
    - [0, 0.0]
  - - [1, 1, 125, 256]
    - [5, 0.0]
  - - [512, 41, 1, 1128]
    - [8, 0.0]
  - - [256, 25, 1, 512]
    - [17, 0.0]
  - - [512, 37, 1, 1128]
    - [8, 0.0]
  - - [128, 40960, 1, 256]
    - [24, 0.0]
  - - [512, 83, 1, 1128]
    - [9, 0.0]
  - - [256, 50, 1, 512]
    - [0, 0.0]
  - - [1, 1, 98, 256]
    - [5, 0.0]
  - - [32, 16384, 1, 128]
    - [25, 0.0]
  - - [256, 27, 1, 512]
    - [17, 0.0]
  - - [256, 512, 1, 776]
    - [7, 0.0]
  - - [256, 23, 1, 512]
    - [17, 0.0]
  - - [512, 50, 1, 1128]
    - [8, 0.0]
  - - [512, 84, 1, 1128]
    - [26, 0.0]
  - - [256, 227, 1, 512]
    - [12, 0.0]
  - - [256, 190, 1, 512]
    - [12, 0.0]
  - - [256, 512, 1, 1168]
    - [22, 0.0]
  - - [256, 62, 1, 512]
    - [0, 0.0]
  - - [768, 512, 1, 320]
    - [27, 0.0]
  - - [256, 47, 1, 512]
    - [8, 0.0]
  - - [512, 62, 1, 1128]
    - [8, 0.0]
  - - [32, 32768, 1, 128]
    - [25, 0.0]
  - - [256, 20, 1, 512]
    - [17, 0.0]
  - - [256, 76, 1, 512]
    - [9, 0.0]
  - - [1, 1, 85, 256]
    - [23, 0.0]
  - - [256, 44, 1, 512]
    - [8, 0.0]
  - - [512, 82, 1, 1128]
    - [28, 0.0]
  - - [256, 32768, 1, 128]
    - [29, 0.0]
  - - [512, 91, 1, 1128]
    - [9, 0.0]
  - - [540, 512, 1, 5897]
    - [30, 0.0]
  - - [512, 92, 1, 1128]
    - [26, 0.0]
  - - [512, 49, 1, 1128]
    - [8, 0.0]
  - - [444, 512, 1, 444]
    - [31, 0.0]
  - - [256, 46, 1, 512]
    - [8, 0.0]
  - - [512, 235, 1, 1128]
    - [13, 0.0]
  - - [256, 125, 1, 512]
    - [12, 0.0]
  - - [512, 75, 1, 1128]
    - [32, 0.0]
  - - [256, 15, 1, 512]
    - [0, 0.0]
  - - [256, 71, 1, 512]
    - [32, 0.0]
  - - [1, 1, 31, 256]
    - [23, 0.0]
  - - [1, 1, 47, 256]
    - [5, 0.0]
  - - [160, 512, 1, 416]
    - [33, 0.0]
  - - [256, 512, 1, 1888]
    - [13, 0.0]
  - - [256, 512, 1, 1312]
    - [13, 0.0]
  - - [512, 86, 1, 1128]
    - [28, 0.0]
  - - [512, 71, 1, 1128]
    - [9, 0.0]
  - - [256, 60, 1, 512]
    - [0, 0.0]
  - - [256, 57, 1, 512]
    - [8, 0.0]
  - - [512, 252, 1, 1128]
    - [13, 0.0]
  - - [32, 24, 1, 1302]
    - [10, 0.0]
  - - [512, 23, 1, 1128]
    - [34, 0.0]
  - - [256, 74, 1, 512]
    - [9, 0.0]
  - - [256, 13, 1, 512]
    - [34, 0.0]
  - - [256, 187, 1, 512]
    - [12, 0.0]
  - - [256, 19, 1, 512]
    - [17, 0.0]
  - - [1, 252, 1, 256]
    - [35, 0.0]
  - - [1, 1, 37, 256]
    - [23, 0.0]
  - - [1, 25, 1, 16]
    - [5, 0.0]
  - - [352, 512, 1, 352]
    - [36, 0.0]
  - - [256, 512, 1, 3384]
    - [22, 0.0]
  - - [512, 47, 1, 1128]
    - [8, 0.0]
  - - [256, 235, 1, 512]
    - [12, 0.0]
  - - [512, 64, 1, 1128]
    - [8, 0.0]
  - - [1, 251, 1, 256]
    - [35, 0.0]
  - - [256, 85, 1, 512]
    - [9, 0.0]
  - - [128, 512, 1, 444]
    - [12, 0.0]
  - - [256, 49, 1, 512]
    - [8, 0.0]
  - - [32, 40960, 1, 128]
    - [37, 0.0]
  - - [512, 256, 1, 1128]
    - [13, 0.0]
  - - [540, 512, 1, 740]
    - [38, 0.0]
  - - [256, 82, 1, 512]
    - [9, 0.0]
  - - [512, 93, 1, 1128]
    - [9, 0.0]
  - - [1, 101, 1, 256]
    - [39, 0.0]
  - - [512, 203, 1, 1128]
    - [40, 0.0]
  - - [512, 16, 1, 1128]
    - [17, 0.0]
  - - [256, 65, 1, 512]
    - [9, 0.0]
  - - [256, 86, 1, 512]
    - [9, 0.0]
  - - [512, 15, 1, 1128]
    - [17, 0.0]
  - - [640, 512, 1, 2668]
    - [38, 0.0]
  - - [512, 74, 1, 1128]
    - [32, 0.0]
  - - [512, 81, 1, 1128]
    - [9, 0.0]
  - - [256, 512, 1, 2968]
    - [22, 0.0]
  - - [512, 98, 1, 1128]
    - [3, 0.0]
  - - [512, 217, 1, 1128]
    - [3, 0.0]
  - - [32, 27, 1, 1302]
    - [10, 0.0]
  - - [512, 72, 1, 1128]
    - [9, 0.0]
  - - [1, 256, 1, 256]
    - [15, 0.0]
  - - [768, 512, 1, 512]
    - [41, 0.0]
  - - [256, 83, 1, 512]
    - [11, 0.0]
  - - [512, 512, 1, 1144]
    - [42, 0.0]
  - - [512, 96, 1, 1128]
    - [43, 0.0]
  - - [32, 34, 1, 1302]
    - [44, 0.0]
  - - [256, 100, 1, 512]
    - [12, 0.0]
  - - [256, 51, 1, 512]
    - [0, 0.0]
  - - [512, 100, 1, 1128]
    - [3, 0.0]
  - - [256, 75, 1, 512]
    - [12, 0.0]
  - - [32, 25, 1, 1302]
    - [10, 0.0]
  - - [32, 35, 1, 1302]
    - [10, 0.0]
  - - [512, 76, 1, 1128]
    - [32, 0.0]
  - - [32, 20, 1, 1302]
    - [10, 0.0]
  - - [256, 43, 1, 512]
    - [0, 0.0]
  - - [256, 14, 1, 512]
    - [15, 0.0]
  - - [256, 93, 1, 512]
    - [11, 0.0]
  - - [128, 512, 1, 160]
    - [12, 0.0]
  - - [256, 37, 1, 512]
    - [0, 0.0]
  - - [512, 43, 1, 1128]
    - [8, 0.0]
  - - [768, 512, 1, 640]
    - [6, 0.0]
  - - [32, 17, 1, 1302]
    - [10, 0.0]
  - - [512, 19, 1, 1128]
    - [0, 0.0]
  - - [256, 16384, 1, 128]
    - [45, 0.0]
  - - [1, 1, 93, 256]
    - [5, 0.0]
  - - [1, 1, 92, 256]
    - [5, 0.0]
  - - [512, 27, 1, 1128]
    - [34, 0.0]
  - - [1, 217, 1, 256]
    - [5, 0.0]
  - - [256, 98, 1, 512]
    - [12, 0.0]
  - - [512, 227, 1, 1128]
    - [22, 0.0]
  - - [256, 84, 1, 512]
    - [9, 0.0]
  - - [32, 80, 512, 32]
    - [25, 0.0]
  - - [1, 227, 1, 256]
    - [5, 0.0]
  - - [128, 512, 1, 1236]
    - [3, 0.0]
  - - [512, 25, 1, 1128]
    - [34, 0.0]
  - - [32, 22, 1, 1302]
    - [10, 0.0]
  - - [1, 1, 41, 256]
    - [23, 0.0]
  - - [1, 1, 27, 256]
    - [5, 0.0]
  - - [1, 235, 1, 256]
    - [35, 0.0]
  - - [512, 65, 1, 1128]
    - [32, 0.0]
  - - [1, 1, 51, 256]
    - [5, 0.0]
  - - [512, 46, 1, 1128]
    - [8, 0.0]
  - - [1, 1, 19, 256]
    - [23, 0.0]
  - - [1, 1, 60, 256]
    - [5, 0.0]
  - - [512, 48, 1, 1128]
    - [2, 0.0]
  - - [512, 13, 1, 1128]
    - [17, 0.0]
  - - [512, 190, 1, 1128]
    - [20, 0.0]
  - - [1, 1, 23, 256]
    - [23, 0.0]
- null
- null
- DeviceEfficiency
- Equality
