library/src/amd_detail/rocblaslt/src/Tensile/Logic/asm_full/aquavanjaram/gfx942_64cu/Equality/aquavanjaram_Cijk_Ailk_Bjlk_SB_UserArgs.yaml
- {MinimumRequiredVersion: 4.33.0}
- aquavanjaram
- {Architecture: gfx942, CUCount: 64}
- [Device 0049, Device 0050]
    SolutionIndex: 0
    SolutionNameMin: Cijk_Ailk_Bjlk_SB_UserArgs_MT32x32x64_MI16x16x1_SN_GRVWA4_GRVWB4_GSU1_LBSPPA128_LBSPPB128_LPA16_LPB16_MIWT1_1_NLCA1_NLCB1_SU0_SUM0_SUS0_SVW1_VWA1_VWB1_WG32_8_1_WGM0
    SolutionIndex: 1
    SolutionNameMin: Cijk_Ailk_Bjlk_SB_UserArgs_MT64x64x32_MI16x16x1_SN_GRVWA4_GRVWB4_GSU1_LBSPPA256_LBSPPB256_LPA0_LPB0_MIWT2_2_NLCA1_NLCB1_SU4_SUM0_SUS256_SVW2_VWA2_VWB2_WG32_8_1_WGM40
    SolutionIndex: 2
    SolutionNameMin: Cijk_Ailk_Bjlk_SB_UserArgs_MT128x112x32_MI16x16x1_SN_GRVWA4_GRVWB2_GSU1_LBSPPA512_LBSPPB448_LPA0_LPB0_MIWT2_7_NLCA1_NLCB7_SU0_SUM0_SUS0_SVW2_VWA2_VWB1_WG64_4_1_WGM0
- - - [128, 112, 1, 512]
    - [0, 0.0]
  - - [256, 2968, 1, 512]
    - [1, 0.0]
  - - [160, 416, 1, 512]
    - [0, 0.0]
  - - [64, 704, 1, 512]
    - [0, 0.0]
  - - [512, 1128, 1, 64]
    - [1, 0.0]
  - - [256, 288, 1, 512]
    - [0, 0.0]
  - - [32, 32, 1, 512]
    - [0, 0.0]
  - - [512, 1128, 1, 96]
    - [1, 0.0]
  - - [768, 640, 1, 512]
    - [1, 0.0]
  - - [256, 1824, 1, 512]
    - [1, 0.0]
  - - [256, 256, 1, 512]
    - [0, 0.0]
  - - [64, 32, 1, 512]
    - [0, 0.0]
  - - [256, 64, 1, 512]
    - [0, 0.0]
  - - [32, 128, 1, 512]
    - [0, 0.0]
  - - [768, 128, 1, 512]
    - [0, 0.0]
  - - [128, 320, 1, 512]
    - [0, 0.0]
  - - [64, 512, 1, 512]
    - [0, 0.0]
  - - [256, 128, 1, 512]
    - [0, 0.0]
  - - [128, 48, 1, 512]
    - [0, 0.0]
  - - [64, 32, 1, 32]
    - [0, 0.0]
  - - [256, 1888, 1, 512]
    - [1, 0.0]
  - - [160, 64, 1, 512]
    - [0, 0.0]
  - - [128, 16, 1, 512]
    - [0, 0.0]
  - - [768, 64, 1, 512]
    - [0, 0.0]
  - - [64, 416, 1, 512]
    - [0, 0.0]
  - - [768, 320, 1, 512]
    - [1, 0.0]
  - - [256, 512, 1, 64]
    - [0, 0.0]
  - - [128, 352, 1, 512]
    - [0, 0.0]
  - - [256, 896, 1, 512]
    - [1, 0.0]
  - - [128, 416, 1, 512]
    - [0, 0.0]
  - - [128, 80, 1, 512]
    - [0, 0.0]
  - - [16, 32, 1, 512]
    - [0, 0.0]
  - - [256, 776, 1, 512]
    - [1, 0.0]
  - - [128, 160, 1, 512]
    - [0, 0.0]
  - - [64, 128, 1, 512]
    - [0, 0.0]
  - - [128, 128, 1, 512]
    - [0, 0.0]
  - - [256, 3384, 1, 512]
    - [2, 0.0]
  - - [128, 192, 1, 512]
    - [0, 0.0]
  - - [128, 64, 1, 512]
    - [0, 0.0]
  - - [1312, 64, 1, 512]
    - [0, 0.0]
  - - [128, 1792, 1, 512]
    - [1, 0.0]
  - - [160, 704, 1, 512]
    - [0, 0.0]
  - - [128, 256, 1, 512]
    - [0, 0.0]
  - - [1024, 128, 1, 512]
    - [0, 0.0]
  - - [64, 256, 1, 512]
    - [0, 0.0]
  - - [8, 16, 1, 512]
    - [0, 0.0]
  - - [32, 64, 1, 512]
    - [0, 0.0]
  - - [768, 272, 1, 512]
    - [1, 0.0]
  - - [352, 352, 1, 512]
    - [0, 0.0]
- null
- null
- DeviceEfficiency
- Equality
