library/src/amd_detail/rocblaslt/src/Tensile/Logic/asm_full/aquavanjaram/gfx942_64cu/Equality/aquavanjaram_Cijk_Alik_Bljk_BBS_BH_Bias_HAS_SAV_UserArgs.yaml
- {MinimumRequiredVersion: 4.33.0}
- aquavanjaram
- {Architecture: gfx942, CUCount: 64}
- [Device 0049, Device 0050]
    SolutionIndex: 0
    SolutionNameMin: Cijk_Alik_Bljk_BBS_BH_Bias_HAS_SAV_UserArgs_MT128x128x32_MI16x16x1_SN_GRVWA4_GRVWB4_GSU1_GSUC0_GSUWGMRR0_K1_LPA4_LPB4_LRVW4_MIWT4_4_SU2_SUM2_SUS2048_WG32_8_1_WGM1_WGMXCC32_WGMXCCG0
    SolutionIndex: 1
    SolutionNameMin: Cijk_Alik_Bljk_BBS_BH_Bias_HAS_SAV_UserArgs_MT32x32x128_MI16x16x1_SN_GSU1_GSUC0_GSUWGMRR0_K1_MIWT1_1_SU8_SUM1_SUS512_WGM1_WGMXCC1_WGMXCCGn1
    SolutionIndex: 2
    SolutionNameMin: Cijk_Alik_Bljk_BBS_BH_Bias_HAS_SAV_UserArgs_MT16x64x64_MI16x16x1_SN_GSU1_GSUC0_GSUWGMRR1_K1_MIWT1_1_SU2_SUM1_SUS256_WGM1_WGMXCC8_WGMXCCG0
    SolutionIndex: 3
    SolutionNameMin: Cijk_Alik_Bljk_BBS_BH_Bias_HAS_SAV_UserArgs_MT128x32x32_MI16x16x1_SN_GRVWA4_GRVWB4_GSU1_GSUC0_GSUWGMRR1_K1_LPA4_LPB4_LRVW4_MIWT4_1_SU2_SUM2_SUS64_WG32_8_1_WGM0_WGMXCC8_WGMXCCG0
    SolutionIndex: 4
    SolutionNameMin: Cijk_Alik_Bljk_BBS_BH_Bias_HAS_SAV_UserArgs_MT16x32x128_MI16x16x1_SN_GSU1_GSUC0_GSUWGMRR0_K1_MIWT1_1_SU2_SUM4_SUS256_WGM1_WGMXCC1_WGMXCCG190
    SolutionIndex: 5
    SolutionNameMin: Cijk_Alik_Bljk_BBS_BH_Bias_AS_SAV_UserArgs_MT256x160x32_MI16x16x1_SN_GRVWA4_GRVWB4_GSU1_GSUC0_GSUWGMRR0_K1_LBSPPA512_LBSPPB128_LPA4_LPB4_LRVW4_MIWT8_5_NTC0_NEPBS0_SU8_SUM0_SUS64_SPO0_SVW8_ULSGRO0_VWA8_VWB1_WGM32_WGMXCC1_WGMXCCG304
    SolutionIndex: 6
    SolutionNameMin: Cijk_Alik_Bljk_BBS_BH_Bias_HAS_SAV_UserArgs_MT192x256x64_MI16x16x1_SN_LDSB1_GRVWA8_GRVWB8_GSU1_GSUC0_GSUWGMRR0_K1_LBSPPA512_LBSPPB512_LPA16_LPB16_LRVW8_MIWT12_4_NTB4_SU8_SUM1_SUS128_SVW4_VWA4_VWB4_WG16_16_1_WGM6_WGMXCC8_WGMXCCG304
    SolutionIndex: 7
    SolutionNameMin: Cijk_Alik_Bljk_BBS_BH_Bias_HAS_SAV_UserArgs_MT32x32x64_MI16x16x1_SN_GSU1_GSUC0_GSUWGMRR1_K1_MIWT2_1_SU0_SUM0_SUS0_WGM0_WGMXCC1_WGMXCCG171
    SolutionIndex: 8
    SolutionNameMin: Cijk_Alik_Bljk_BBS_BH_Bias_HAS_SAV_UserArgs_MT96x128x128_MI16x16x1_SN_LDSB1_GRVWA8_GRVWB8_GSU1_GSUAMB_GSUC0_GSUWGMRR0_K1_LBSPPA256_LBSPPB1024_LPA16_LPB16_LRVW8_MIWT3_4_NTD4_NEPBS16_SU16_SUM0_SUS256_SVW1_VWA1_VWB4_WG32_8_1_WGM6_WGMXCC8_WGMXCCG304
    SolutionIndex: 9
    SolutionNameMin: Cijk_Alik_Bljk_BBS_BH_Bias_HAS_SAV_UserArgs_MT96x64x64_MI16x16x1_SN_LDSB1_GRVWA8_GRVWB8_GSU1_GSUC0_GSUWGMRR0_K1_LBSPPA128_LBSPPB256_LPA16_LPB16_LRVW8_MIWT3_2_SU16_SUM0_SUS128_SVW1_VWA1_VWB2_WG32_8_1_WGM8_WGMXCC8_WGMXCCG304
    SolutionIndex: 10
    SolutionNameMin: Cijk_Alik_Bljk_BBS_BH_Bias_HAS_SAV_UserArgs_MT256x128x32_MI16x16x1_SN_LDSB1_GRVWA2_GRVWB2_GSU1_GSUC0_GSUWGMRR0_K1_LBSPPA512_LBSPPB256_LPA4_LPB4_LRVW4_MIWT8_4_NTB0_SU16_SUM0_SUS64_SVW8_VWA8_VWB4_WG32_8_1_WGM8_WGMXCC8_WGMXCCG304
    SolutionIndex: 11
    SolutionNameMin: Cijk_Alik_Bljk_BBS_BH_Bias_HAS_SAV_UserArgs_MT128x32x32_MI16x16x1_SN_GRVWA4_GRVWB4_GSU1_GSUC0_GSUWGMRR0_K1_LPA4_LPB4_LRVW4_MIWT4_1_SU0_SUM0_SUS0_WG32_8_1_WGM1_WGMXCC4_WGMXCCG0
    SolutionIndex: 12
    SolutionNameMin: Cijk_Alik_Bljk_BBS_BH_Bias_HAS_SAV_UserArgs_MT32x64x64_MI16x16x1_SN_GSU1_GSUC0_GSUWGMRR0_K1_MIWT2_1_SU0_SUM0_SUS0_WGM0_WGMXCC1_WGMXCCG190
    SolutionIndex: 13
    SolutionNameMin: Cijk_Alik_Bljk_BBS_BH_Bias_HAS_SAV_UserArgs_MT32x16x128_MI16x16x1_SN_GSU1_GSUC0_GSUWGMRR1_K1_MIWT1_1_SU4_SUM1_SUS256_WGM1_WGMXCC8_WGMXCCG0
    SolutionIndex: 14
    SolutionNameMin: Cijk_Alik_Bljk_BBS_BH_Bias_HAS_SAV_UserArgs_MT32x96x64_MI16x16x1_SN_LDSB1_GRVWA8_GRVWB8_GSU1_LBSPPA128_LBSPPB128_LPA16_LPB16_LRVW8_MIWT1_3_SU0_SUM0_SUS0_SVW1_VWA1_WG32_8_1_WGM1
    SolutionIndex: 15
    SolutionNameMin: Cijk_Alik_Bljk_BBS_BH_Bias_HAS_SAV_UserArgs_MT128x320x64_MI16x16x1_SN_LDSB1_GRVWA8_GRVWB8_GSU1_GSUC0_GSUWGMRR0_K1_LBSPPA512_LBSPPB256_LPA16_LPB16_LRVW8_MIWT4_10_NTB0_SU16_SUM0_SUS128_SVW4_VWA4_VWB2_WG32_8_1_WGM8_WGMXCC8_WGMXCCG304
    SolutionIndex: 16
    SolutionNameMin: Cijk_Alik_Bljk_BBS_BH_Bias_HAS_SAV_UserArgs_MT128x128x64_MI16x16x1_SN_LDSB1_GRVWA8_GRVWB8_GSU8_GSUAMB_GSUC0_GSUWGMRR0_K1_LBSPPA512_LBSPPB512_LPA16_LPB16_LRVW8_MIWT4_4_NTD0_NEPBS16_SU0_SUM0_SUS0_SVW4_VWA4_VWB4_WG32_8_1_WGM1_WGMXCC1_WGMXCCG0
- - - [9775, 1024, 1, 128]
    - [0, 0.0]
  - - [48, 512, 1, 128]
    - [1, 0.0]
  - - [128, 512, 1, 64]
    - [2, 0.0]
  - - [32, 512, 1, 16]
    - [2, 0.0]
  - - [1179, 1024, 1, 64]
    - [3, 0.0]
  - - [64, 512, 1, 128]
    - [4, 0.0]
  - - [128, 40960, 1, 32]
    - [0, 0.0]
  - - [1024, 126976, 1, 512]
    - [5, 0.0]
  - - [768, 1024, 8, 3072]
    - [6, 0.0]
  - - [32, 32, 6144, 64]
    - [7, 0.0]
  - - [1296, 512, 1, 768]
    - [8, 0.0]
  - - [88, 8192, 1, 16]
    - [9, 0.0]
  - - [256, 16384, 1, 128]
    - [10, 0.0]
  - - [88, 16, 512, 16]
    - [11, 0.0]
  - - [32, 64, 512, 32]
    - [12, 0.0]
  - - [248, 8, 512, 1024]
    - [13, 0.0]
  - - [768, 1024, 28, 1536]
    - [6, 0.0]
  - - [32, 80, 512, 32]
    - [14, 0.0]
  - - [768, 1024, 28, 3072]
    - [6, 0.0]
  - - [128, 40960, 1, 256]
    - [15, 0.0]
  - - [768, 1024, 16, 3072]
    - [6, 0.0]
  - - [128, 1024, 1, 9775]
    - [16, 0.0]
  - - [512, 126976, 1, 128]
    - [5, 0.0]
- null
- null
- DeviceEfficiency
- Equality
