library/src/amd_detail/rocblaslt/src/Tensile/Logic/asm_full/aquavanjaram/gfx942_64cu/Equality/aquavanjaram_Cijk_Ailk_Bjlk_BBS_BH_Bias_HAS_SAV_UserArgs.yaml
- {MinimumRequiredVersion: 4.33.0}
- aquavanjaram
- {Architecture: gfx942, CUCount: 64}
- [Device 0049, Device 0050]
    SolutionIndex: 0
    SolutionNameMin: Cijk_Ailk_Bjlk_BBS_BH_Bias_HAS_SAV_UserArgs_MT16x16x128_MI16x16x1_SN_LDSB0_CLR1_GRVWA8_GRVWB8_GSU1_GSUC0_GSUWGMRR0_K1_LBSPPA128_LBSPPB128_LPA16_LPB16_MIWT1_1_NLCA1_NLCB1_PLR1_SU16_SUM0_SUS256_SVW1_VWA1_VWB1_WG16_4_4_WGM8_WGMXCC8_WGMXCCG304
    SolutionIndex: 1
    SolutionNameMin: Cijk_Ailk_Bjlk_BBS_BH_Bias_HAS_SAV_UserArgs_MT32x32x128_MI16x16x1_SN_GSU1_GSUC0_GSUWGMRR1_K1_LBSPPA256_LBSPPB256_LPA16_LPB16_MIWT1_1_SU2_SUM2_SUS256_WG32_8_1_WGM1_WGMXCC1_WGMXCCG285
    SolutionIndex: 2
    SolutionNameMin: Cijk_Ailk_Bjlk_BBS_BH_Bias_HAS_SAV_UserArgs_MT64x32x128_MI16x16x1_SN_LDSB1_CLR1_GRVWA8_GRVWB8_GSU1_GSUC0_GSUWGMRR0_K1_LBSPPA512_LBSPPB256_LPA32_LPB16_MIWT2_1_NLCA1_NLCB1_PLR1_SU16_SUM0_SUS256_SVW2_VWA2_VWB1_WG32_8_1_WGM8_WGMXCC8_WGMXCCG304
    SolutionIndex: 3
    SolutionNameMin: Cijk_Ailk_Bjlk_BBS_BH_Bias_HAS_SAV_UserArgs_MT128x64x64_MI16x16x1_SN_LDSB1_CLR1_GRVWA8_GRVWB8_GSU1_GSUC0_GSUWGMRR0_K1_LBSPPA1024_LBSPPB512_LPA0_LPB32_MIWT4_2_NLCA1_NLCB1_PLR1_SU16_SUM0_SUS128_SVW4_VWA4_VWB2_WG32_8_1_WGM8_WGMXCC8_WGMXCCG304
    SolutionIndex: 4
    SolutionNameMin: Cijk_Ailk_Bjlk_BBS_BH_Bias_AS_SAV_UserArgs_MT128x128x64_MI16x16x1_SN_LDSB1_GRVWA8_GRVWB8_GSU32_GSUC0_GSUWGMRR1_K1_LBSPPA1024_LBSPPB1024_LPA0_LPB0_MIWT4_4_NTD4_NEPBS16_NLCA1_NLCB1_SU8_SUM0_SUS256_SVW4_ULSGRO0_VWA4_VWB4_WSGRA2_WG32_8_1_WGM1_WGMXCC8_WGMXCCG0
    SolutionIndex: 5
    SolutionNameMin: Cijk_Ailk_Bjlk_BBS_BH_Bias_HAS_SAV_UserArgs_MT32x32x256_MI16x16x1_SN_LDSB1_CLR1_GRVWA8_GRVWB8_GSU16_GSUAMB_GSUC0_GSUWGMRR0_K1_LBSPPA256_LBSPPB256_LPA16_LPB16_MIWT1_1_NTD0_NEPBS16_NLCA1_NLCB1_PLR1_SU0_SUM0_SUS0_SVW1_VWA1_VWB1_WG32_8_1_WGM1_WGMXCC1_WGMXCCG0
    SolutionIndex: 6
    SolutionNameMin: Cijk_Ailk_Bjlk_BBS_BH_Bias_HAS_SAV_UserArgs_MT128x256x32_MI16x16x1_SN_LDSB1_CLR1_GRVWA8_GRVWB8_GSU8_GSUAMB_GSUC0_GSUWGMRR0_K1_LBSPPA1024_LBSPPB2048_LPA0_LPB0_MIWT4_8_NTD0_NEPBS16_NLCA1_NLCB1_PLR1_SU0_SUM0_SUS0_SVW4_VWA4_VWB8_WG32_8_1_WGM1_WGMXCC1_WGMXCCG0
    SolutionIndex: 7
    SolutionNameMin: Cijk_Ailk_Bjlk_BBS_BH_Bias_HAS_SAV_UserArgs_MT64x64x64_MI16x16x1_SN_LDSB1_CLR1_GRVWA8_GRVWB8_GSU1_GSUC0_GSUWGMRR0_K1_LBSPPA512_LBSPPB512_LPA32_LPB32_MIWT2_2_NTB0_NLCA1_NLCB1_PLR1_SU16_SUM0_SUS128_SVW2_VWA2_VWB2_WG32_8_1_WGM8_WGMXCC8_WGMXCCG304
    SolutionIndex: 8
    SolutionNameMin: Cijk_Ailk_Bjlk_BBS_BH_Bias_HAS_SAV_UserArgs_MT16x16x256_MI16x16x1_SN_LDSB1_CLR1_GRVWA8_GRVWB8_GSU1_GSUAMB_GSUC0_GSUWGMRR0_K1_LBSPPA128_LBSPPB128_LPA16_LPB16_MIWT1_1_NTD4_NEPBS16_NLCA1_NLCB1_PLR1_SU16_SUM0_SUS512_SVW1_VWA1_VWB1_WG16_4_4_WGM6_WGMXCC8_WGMXCCG304
    SolutionIndex: 9
    SolutionNameMin: Cijk_Ailk_Bjlk_BBS_BH_Bias_HAS_SAV_UserArgs_MT16x16x128_MI16x16x1_SN_LDSB0_CLR1_GRVWA8_GRVWB8_GSU1_GSUAMB_GSUC0_GSUWGMRR0_K1_LBSPPA128_LBSPPB128_LPA16_LPB16_MIWT1_1_NTD4_NEPBS16_NLCA1_NLCB1_PLR1_SU16_SUM0_SUS256_SVW1_VWA1_VWB1_WG16_4_4_WGM6_WGMXCC8_WGMXCCG304
    SolutionIndex: 10
    SolutionNameMin: Cijk_Ailk_Bjlk_BBS_BH_Bias_HAS_SAV_UserArgs_MT16x32x64_MI16x16x1_SN_GSU1_GSUC0_GSUWGMRR1_K1_MIWT1_1_SU4_SUM2_SUS128_WGM0_WGMXCC16_WGMXCCG0
    SolutionIndex: 11
    SolutionNameMin: Cijk_Ailk_Bjlk_BBS_BH_Bias_HAS_SAV_UserArgs_MT64x64x64_MI16x16x1_SN_LDSB1_CLR1_GRVWA8_GRVWB8_GSU1_GSUC0_GSUWGMRR0_K1_LBSPPA512_LBSPPB512_LPA32_LPB32_MIWT2_2_NLCA1_NLCB1_PLR1_SU16_SUM0_SUS128_SVW2_VWA2_VWB2_WG32_8_1_WGM8_WGMXCC8_WGMXCCG304
    SolutionIndex: 12
    SolutionNameMin: Cijk_Ailk_Bjlk_BBS_BH_Bias_HAS_SAV_UserArgs_MT128x32x64_MI16x16x1_SN_LDSB1_CLR1_GRVWA8_GRVWB8_GSU1_GSUC0_GSUWGMRR0_K1_LBSPPA1024_LBSPPB256_LPA32_LPB32_MIWT2_2_NTB0_NLCA1_NLCB1_PLR1_SU16_SUM0_SUS128_SVW2_VWA2_VWB2_WG64_4_1_WGM8_WGMXCC8_WGMXCCG304
    SolutionIndex: 13
    SolutionNameMin: Cijk_Ailk_Bjlk_BBS_BH_Bias_HAS_SAV_UserArgs_MT32x64x128_MI16x16x1_SN_LDSB1_CLR1_GRVWA8_GRVWB8_GSU1_GSUAMB_GSUC0_GSUWGMRR0_K1_LBSPPA256_LBSPPB512_LPA32_LPB16_MIWT2_1_NTD4_NEPBS16_NLCA1_NLCB1_PLR1_SU16_SUM0_SUS256_SVW2_VWA2_VWB1_WG16_16_1_WGM6_WGMXCC8_WGMXCCG304
    SolutionIndex: 14
    SolutionNameMin: Cijk_Ailk_Bjlk_BBS_BH_Bias_HAS_SAV_UserArgs_MT32x64x64_MI16x16x1_SN_GSU1_GSUC0_GSUWGMRR1_K1_MIWT2_1_SU8_SUM4_SUS128_WGM0_WGMXCC16_WGMXCCG0
    SolutionIndex: 15
    SolutionNameMin: Cijk_Ailk_Bjlk_BBS_BH_Bias_HAS_SAV_UserArgs_MT256x32x32_MI16x16x1_SN_LDSB1_CLR1_GRVWA8_GRVWB4_GSU1_GSUC0_GSUWGMRR0_K1_LBSPPA2048_LBSPPB256_LPA0_LPB32_MIWT4_2_NTB0_NLCA1_NLCB1_PLR1_SU16_SUM0_SUS64_SVW4_VWA4_VWB2_WG64_4_1_WGM8_WGMXCC8_WGMXCCG304
    SolutionIndex: 16
    SolutionNameMin: Cijk_Ailk_Bjlk_BBS_BH_Bias_HAS_SAV_UserArgs_MT32x16x32_MI16x16x1_SN_GSU1_GSUC0_GSUWGMRR0_K1_MIWT1_1_SU4_SUM4_SUS64_WGM1_WGMXCC8_WGMXCCG0
    SolutionIndex: 17
    SolutionNameMin: Cijk_Ailk_Bjlk_BBS_BH_Bias_HAS_SAV_UserArgs_MT32x32x256_MI16x16x1_SN_LDSB1_CLR1_GRVWA8_GRVWB8_GSU1_GSUAMB_GSUC0_GSUWGMRR0_K1_LBSPPA256_LBSPPB256_LPA16_LPB16_MIWT1_1_NTD4_NEPBS16_NLCA1_NLCB1_PLR1_SU16_SUM0_SUS512_SVW1_VWA1_VWB1_WG32_8_1_WGM6_WGMXCC8_WGMXCCG304
    SolutionIndex: 18
    SolutionNameMin: Cijk_Ailk_Bjlk_BBS_BH_Bias_HAS_SAV_UserArgs_MT256x160x32_MI16x16x1_SN_LDSB0_CLR1_GRVWA8_GRVWB4_GSU1_GSUC0_GSUWGMRR0_K1_LBSPPA2048_LBSPPB1280_LPA0_LPB16_MIWT8_5_NTB0_NLCA1_NLCB5_PLR1_SU8_SUM1_SUS64_SVW8_VWA8_VWB1_WG32_8_1_WGM6_WGMXCC8_WGMXCCG304
    SolutionIndex: 19
    SolutionNameMin: Cijk_Ailk_Bjlk_BBS_BH_Bias_HAS_SAV_UserArgs_MT16x16x256_MI16x16x1_SN_LDSB1_CLR1_GRVWA8_GRVWB8_GSU3_GSUAMBSK_GSUC0_GSUWGMRR0_K1_LBSPPA128_LBSPPB128_LPA16_LPB16_MIWT1_1_NTD0_NEPBS0_NLCA1_NLCB1_PLR1_SU0_SUM0_SUS0_SVW1_VWA1_VWB1_WG16_4_4_WGM1_WGMXCC1_WGMXCCG0
    SolutionIndex: 20
    SolutionNameMin: Cijk_Ailk_Bjlk_BBS_BH_Bias_HAS_SAV_UserArgs_MT256x64x64_MI16x16x1_SN_LDSB1_CLR1_GRVWA8_GRVWB8_GSU1_GSUC0_GSUWGMRR0_K1_LBSPPA2048_LBSPPB512_LPA0_LPB0_MIWT4_4_NTB0_NLCA1_NLCB1_PLR1_SU16_SUM0_SUS128_SVW4_VWA4_VWB4_WG64_4_1_WGM8_WGMXCC8_WGMXCCG304
    SolutionIndex: 21
    SolutionNameMin: Cijk_Ailk_Bjlk_BBS_BH_Bias_HAS_SAV_UserArgs_MT64x128x64_MI16x16x1_SN_LDSB1_CLR1_GRVWA8_GRVWB8_GSU1_GSUC0_GSUWGMRR0_K1_LBSPPA512_LBSPPB1024_LPA0_LPB32_MIWT4_2_NTB0_NLCA1_NLCB1_PLR1_SU16_SUM0_SUS128_SVW4_VWA4_VWB2_WG16_16_1_WGM8_WGMXCC8_WGMXCCG304
    SolutionIndex: 22
    SolutionNameMin: Cijk_Ailk_Bjlk_BBS_BH_Bias_AS_SAV_UserArgs_MT128x192x32_MI16x16x1_SN_LDSB1_GRVWA8_GRVWB8_GSU32_GSUC0_GSUWGMRR0_K1_LBSPPA1024_LBSPPB1536_LPA0_LPB32_MIWT4_6_NEPBS0_NLCA1_NLCB3_SU8_SUM0_SUS256_SVW4_VWA4_VWB2_WG32_8_1_WGM1_WGMXCC8_WGMXCCG304
    SolutionIndex: 23
    SolutionNameMin: Cijk_Ailk_Bjlk_BBS_BH_Bias_AS_SAV_UserArgs_MT128x256x32_MI16x16x1_SN_LDSB1_GRVWA8_GRVWB8_GSU32_GSUC0_GSUWGMRR1_K1_LBSPPA1024_LBSPPB2048_LPA0_LPB0_MIWT4_8_NTD4_NEPBS0_NLCA1_NLCB1_SU8_SUM0_SUS256_SVW4_ULSGRO1_VWA4_VWB8_WSGRA2_WG32_8_1_WGM1_WGMXCC8_WGMXCCG0
    SolutionIndex: 24
    SolutionNameMin: Cijk_Ailk_Bjlk_BBS_BH_Bias_AS_SAV_UserArgs_MT128x256x32_MI16x16x1_SN_LDSB1_GRVWA8_GRVWB8_GSU32_GSUC1_GSUWGMRR1_K1_LBSPPA1024_LBSPPB2048_LPA0_LPB0_MIWT4_8_NTD4_NEPBS0_NLCA1_NLCB1_SU8_SUM0_SUS256_SVW4_ULSGRO0_VWA4_VWB8_WSGRA2_WG32_8_1_WGM1_WGMXCC8_WGMXCCG0
    SolutionIndex: 25
    SolutionNameMin: Cijk_Ailk_Bjlk_BBS_BH_Bias_HAS_SAV_UserArgs_MT80x128x64_MI16x16x1_SN_LDSB1_CLR1_GRVWA4_GRVWB8_GSU1_GSUC0_GSUWGMRR0_K1_LBSPPA640_LBSPPB1024_LPA16_LPB32_MIWT5_2_NTB0_NLCA5_NLCB1_PLR1_SU16_SUM0_SUS128_SVW1_VWA1_VWB2_WG16_16_1_WGM8_WGMXCC8_WGMXCCG304
    SolutionIndex: 26
    SolutionNameMin: Cijk_Ailk_Bjlk_BBS_BH_Bias_HAS_SAV_UserArgs_MT128x128x64_MI16x16x1_SN_LDSB1_CLR1_GRVWA8_GRVWB8_GSU8_GSUAMB_GSUC0_GSUWGMRR0_K1_LBSPPA1024_LBSPPB1024_LPA0_LPB0_MIWT4_4_NTD0_NEPBS16_NLCA1_NLCB1_PLR1_SU0_SUM0_SUS0_SVW4_VWA4_VWB4_WG32_8_1_WGM1_WGMXCC1_WGMXCCG0
    SolutionIndex: 27
    SolutionNameMin: Cijk_Ailk_Bjlk_BBS_BH_Bias_HAS_SAV_UserArgs_MT64x32x64_MI16x16x1_SN_GSU1_GSUC0_GSUWGMRR1_K1_LBSPPA512_LBSPPB256_LPA32_LPB16_MIWT2_1_SU2_SUM3_SUS128_WG32_8_1_WGM0_WGMXCC2_WGMXCCG0
    SolutionIndex: 28
    SolutionNameMin: Cijk_Ailk_Bjlk_BBS_BH_Bias_HAS_SAV_UserArgs_MT256x96x64_MI16x16x1_SN_LDSB1_CLR1_GRVWA8_GRVWB8_GSU1_GSUC0_GSUWGMRR0_K1_LBSPPA2048_LBSPPB768_LPA0_LPB32_MIWT4_6_NTB0_NLCA1_NLCB3_PLR1_SU16_SUM0_SUS128_SVW4_VWA4_VWB2_WG64_4_1_WGM8_WGMXCC8_WGMXCCG304
    SolutionIndex: 29
    SolutionNameMin: Cijk_Ailk_Bjlk_BBS_BH_Bias_HAS_SAV_UserArgs_MT16x16x256_MI16x16x1_SN_LDSB1_CLR1_GRVWA8_GRVWB8_GSU5_GSUAMBSK_GSUC0_GSUWGMRR0_K1_LBSPPA128_LBSPPB128_LPA16_LPB16_MIWT1_1_NTD0_NEPBS0_NLCA1_NLCB1_PLR1_SU0_SUM0_SUS0_SVW1_VWA1_VWB1_WG16_4_4_WGM1_WGMXCC1_WGMXCCG0
    SolutionIndex: 30
    SolutionNameMin: Cijk_Ailk_Bjlk_BBS_BH_Bias_HAS_SAV_UserArgs_MT64x32x128_MI16x16x1_SN_LDSB1_CLR1_GRVWA8_GRVWB8_GSU16_GSUAMB_GSUC0_GSUWGMRR0_K1_LBSPPA512_LBSPPB256_LPA32_LPB16_MIWT2_1_NTD0_NEPBS16_NLCA1_NLCB1_PLR1_SU0_SUM0_SUS0_SVW2_VWA2_VWB1_WG32_8_1_WGM1_WGMXCC1_WGMXCCG0
    SolutionIndex: 31
    SolutionNameMin: Cijk_Ailk_Bjlk_BBS_BH_Bias_HAS_SAV_UserArgs_MT256x16x32_MI16x16x1_SN_LDSB1_CLR1_GRVWA8_GRVWB2_GSU1_GSUC0_GSUWGMRR0_K1_LBSPPA2048_LBSPPB128_LPA0_LPB16_MIWT4_1_NLCA1_NLCB1_PLR1_SU16_SUM0_SUS64_SVW4_VWA4_VWB1_WG64_4_1_WGM8_WGMXCC8_WGMXCCG304
    SolutionIndex: 32
    SolutionNameMin: Cijk_Ailk_Bjlk_BBS_BH_Bias_HAS_SAV_UserArgs_MT16x128x128_MI16x16x1_SN_LDSB1_CLR1_GRVWA8_GRVWB8_GSU8_GSUAMB_GSUC0_GSUWGMRR0_K1_LBSPPA128_LBSPPB1024_LPA16_LPB32_MIWT1_2_NTD0_NEPBS16_NLCA1_NLCB1_PLR1_SU0_SUM0_SUS0_SVW1_VWA1_VWB2_WG16_16_1_WGM1_WGMXCC1_WGMXCCG0
    SolutionIndex: 33
    SolutionNameMin: Cijk_Ailk_Bjlk_BBS_BH_Bias_HAS_SAV_UserArgs_MT32x128x128_MI16x16x1_SN_LDSB1_CLR1_GRVWA8_GRVWB8_GSU8_GSUAMB_GSUC0_GSUWGMRR0_K1_LBSPPA256_LBSPPB1024_LPA32_LPB32_MIWT2_2_NTD0_NEPBS16_NLCA1_NLCB1_PLR1_SU0_SUM0_SUS0_SVW2_VWA2_VWB2_WG16_16_1_WGM1_WGMXCC1_WGMXCCG0
    SolutionIndex: 34
    SolutionNameMin: Cijk_Ailk_Bjlk_BBS_BH_Bias_HAS_SAV_UserArgs_MT16x16x256_MI16x16x1_SN_LDSB1_CLR1_GRVWA8_GRVWB8_GSU2_GSUAMBSK_GSUC0_GSUWGMRR0_K1_LBSPPA128_LBSPPB128_LPA16_LPB16_MIWT1_1_NTD0_NEPBS0_NLCA1_NLCB1_PLR1_SU0_SUM0_SUS0_SVW1_VWA1_VWB1_WG16_4_4_WGM1_WGMXCC1_WGMXCCG0
    SolutionIndex: 35
    SolutionNameMin: Cijk_Ailk_Bjlk_BBS_BH_Bias_HAS_SAV_UserArgs_MT64x64x64_MI16x16x1_SN_LDSB1_CLR1_GRVWA8_GRVWB8_GSU1_GSUC0_GSUWGMRR0_K1_LBSPPA512_LBSPPB512_LPA0_LPB16_MIWT4_1_NTB0_NLCA1_NLCB1_PLR1_SU16_SUM0_SUS128_SVW4_VWA4_VWB1_WG16_16_1_WGM8_WGMXCC8_WGMXCCG304
    SolutionIndex: 36
    SolutionNameMin: Cijk_Ailk_Bjlk_BBS_BH_Bias_HAS_SAV_UserArgs_MT32x32x64_MI16x16x1_SN_LDSB0_CLR1_GRVWA8_GRVWB8_GSU1_GSUC0_GSUWGMRR0_K1_LBSPPA256_LBSPPB256_LPA16_LPB16_MIWT1_1_NLCA1_NLCB1_PLR1_SU16_SUM0_SUS128_SVW1_VWA1_VWB1_WG32_8_1_WGM8_WGMXCC8_WGMXCCG304
    SolutionIndex: 37
    SolutionNameMin: Cijk_Ailk_Bjlk_BBS_BH_Bias_HAS_SAV_UserArgs_MT256x128x32_MI16x16x1_SN_LDSB1_CLR1_GRVWA8_GRVWB8_GSU8_GSUAMB_GSUC0_GSUWGMRR0_K1_LBSPPA2048_LBSPPB1024_LPA0_LPB0_MIWT4_8_NTD0_NEPBS16_NLCA1_NLCB1_PLR1_SU0_SUM0_SUS0_SVW4_VWA4_VWB8_WG64_4_1_WGM1_WGMXCC1_WGMXCCG0
    SolutionIndex: 38
    SolutionNameMin: Cijk_Ailk_Bjlk_BBS_BH_Bias_AS_SAV_UserArgs_MT128x128x64_MI16x16x1_SN_LDSB1_GRVWA8_GRVWB8_GSU16_GSUC1_GSUWGMRR1_K1_LBSPPA1024_LBSPPB1024_LPA0_LPB0_MIWT4_4_NTD4_NEPBS0_NLCA1_NLCB1_SU8_SUM0_SUS256_SVW4_ULSGRO1_VWA4_VWB4_WSGRA2_WG32_8_1_WGM1_WGMXCC8_WGMXCCG304
    SolutionIndex: 39
    SolutionNameMin: Cijk_Ailk_Bjlk_BBS_BH_Bias_HAS_SAV_UserArgs_MT128x192x64_MI16x16x1_SN_LDSB1_CLR1_GRVWA8_GRVWB8_GSU1_GSUC0_GSUWGMRR0_K1_LBSPPA1024_LBSPPB1536_LPA0_LPB32_MIWT4_6_NLCA1_NLCB3_PLR1_SU8_SUM1_SUS128_SVW4_VWA4_VWB2_WG32_8_1_WGM6_WGMXCC8_WGMXCCG304
    SolutionIndex: 40
    SolutionNameMin: Cijk_Ailk_Bjlk_BBS_BH_Bias_HAS_SAV_UserArgs_MT128x256x32_MI16x16x1_SN_LDSB1_CLR1_GRVWA8_GRVWB8_GSU7_GSUAMB_GSUC0_GSUWGMRR0_K1_LBSPPA1024_LBSPPB2048_LPA0_LPB0_MIWT4_8_NTD0_NEPBS16_NLCA1_NLCB1_PLR1_SU0_SUM0_SUS0_SVW4_VWA4_VWB8_WG32_8_1_WGM1_WGMXCC1_WGMXCCG0
    SolutionIndex: 41
    SolutionNameMin: Cijk_Ailk_Bjlk_BBS_BH_Bias_HAS_SAV_UserArgs_MT32x32x128_MI16x16x1_SN_LDSB1_CLR1_GRVWA8_GRVWB8_GSU1_GSUC0_GSUWGMRR0_K1_LBSPPA256_LBSPPB256_LPA16_LPB16_MIWT1_1_NLCA1_NLCB1_PLR1_SU16_SUM0_SUS256_SVW1_VWA1_VWB1_WG32_8_1_WGM8_WGMXCC8_WGMXCCG304
    SolutionIndex: 42
    SolutionNameMin: Cijk_Ailk_Bjlk_BBS_BH_Bias_HAS_SAV_UserArgs_MT128x64x64_MI16x16x1_SN_LDSB1_CLR1_GRVWA8_GRVWB8_GSU1_GSUC0_GSUWGMRR0_K1_LBSPPA1024_LBSPPB512_LPA0_LPB32_MIWT4_2_NTB0_NLCA1_NLCB1_PLR1_SU16_SUM0_SUS128_SVW4_VWA4_VWB2_WG32_8_1_WGM8_WGMXCC8_WGMXCCG304
    SolutionIndex: 43
    SolutionNameMin: Cijk_Ailk_Bjlk_BBS_BH_Bias_HAS_SAV_UserArgs_MT16x16x256_MI16x16x1_SN_LDSB1_CLR1_GRVWA8_GRVWB8_GSU16_GSUAMBSK_GSUC0_GSUWGMRR0_K1_LBSPPA128_LBSPPB128_LPA16_LPB16_MIWT1_1_NTD0_NEPBS0_NLCA1_NLCB1_PLR1_SU0_SUM0_SUS0_SVW1_VWA1_VWB1_WG16_4_4_WGM1_WGMXCC1_WGMXCCG0
- - - [128, 112, 1, 512]
    - [0, 0.0]
  - - [128, 448, 1, 512]
    - [1, 0.0]
  - - [1024, 128, 1, 512]
    - [2, 0.0]
  - - [256, 112, 1, 512]
    - [0, 0.0]
  - - [256, 1312, 1, 512]
    - [3, 0.0]
  - - [256, 128, 1, 16384]
    - [4, 0.0]
  - - [32, 128, 1, 32768]
    - [5, 0.0]
  - - [1024, 512, 1, 126976]
    - [6, 0.0]
  - - [256, 1888, 1, 512]
    - [3, 0.0]
  - - [192, 704, 1, 512]
    - [7, 0.0]
  - - [40, 64, 1, 1024]
    - [8, 0.0]
  - - [768, 192, 1, 512]
    - [7, 0.0]
  - - [64, 1184, 1, 1024]
    - [2, 0.0]
  - - [32, 128, 1, 16384]
    - [5, 0.0]
  - - [128, 48, 1, 512]
    - [9, 0.0]
  - - [128, 160, 1, 512]
    - [0, 0.0]
  - - [128, 256, 1, 512]
    - [10, 0.0]
  - - [768, 320, 1, 512]
    - [11, 0.0]
  - - [32, 32, 1, 512]
    - [8, 0.0]
  - - [48, 176, 1, 1024]
    - [8, 0.0]
  - - [256, 544, 1, 512]
    - [12, 0.0]
  - - [768, 64, 1, 512]
    - [1, 0.0]
  - - [128, 896, 1, 512]
    - [13, 0.0]
  - - [768, 256, 1, 512]
    - [11, 0.0]
  - - [128, 800, 1, 512]
    - [2, 0.0]
  - - [32, 32, 512, 80]
    - [14, 0.0]
  - - [256, 1168, 1, 512]
    - [3, 0.0]
  - - [768, 32, 512, 32]
    - [15, 0.0]
  - - [128, 320, 1, 512]
    - [1, 0.0]
  - - [16, 16, 512, 82]
    - [16, 0.0]
  - - [64, 256, 1, 512]
    - [9, 0.0]
  - - [256, 640, 1, 512]
    - [7, 0.0]
  - - [128, 80, 1, 512]
    - [9, 0.0]
  - - [256, 288, 1, 512]
    - [2, 0.0]
  - - [64, 800, 1, 1024]
    - [17, 0.0]
  - - [64, 128, 1, 512]
    - [0, 0.0]
  - - [2048, 1032, 1, 1024]
    - [18, 0.0]
  - - [64, 64, 1, 1024]
    - [19, 0.0]
  - - [32, 32, 512, 32]
    - [16, 0.0]
  - - [128, 704, 1, 512]
    - [13, 0.0]
  - - [512, 64, 1, 512]
    - [10, 0.0]
  - - [256, 1824, 1, 512]
    - [3, 0.0]
  - - [768, 1296, 1, 512]
    - [20, 0.0]
  - - [64, 512, 1, 512]
    - [10, 0.0]
  - - [192, 416, 1, 512]
    - [2, 0.0]
  - - [4096, 128, 1, 512]
    - [21, 0.0]
  - - [32, 24, 1, 512]
    - [8, 0.0]
  - - [16, 32, 1, 512]
    - [8, 0.0]
  - - [64, 1216, 1, 1024]
    - [2, 0.0]
  - - [256, 192, 1, 61440]
    - [22, 0.0]
  - - [128, 416, 1, 512]
    - [1, 0.0]
  - - [16, 16, 512, 88]
    - [16, 0.0]
  - - [640, 704, 1, 512]
    - [3, 0.0]
  - - [32, 128, 1, 40960]
    - [5, 0.0]
  - - [128, 512, 1, 126976]
    - [23, 0.0]
  - - [1312, 64, 1, 512]
    - [13, 0.0]
  - - [128, 352, 1, 512]
    - [1, 0.0]
  - - [256, 256, 1, 32768]
    - [24, 0.0]
  - - [9775, 128, 1, 1024]
    - [25, 0.0]
  - - [512, 196, 1, 15360]
    - [26, 0.0]
  - - [768, 640, 1, 512]
    - [3, 0.0]
  - - [64, 32, 6144, 32]
    - [27, 0.0]
  - - [1792, 792, 1, 1024]
    - [28, 0.0]
  - - [64, 32, 1, 512]
    - [8, 0.0]
  - - [32, 88, 1, 8192]
    - [29, 0.0]
  - - [64, 128, 1, 32768]
    - [30, 0.0]
  - - [128, 256, 1, 16384]
    - [4, 0.0]
  - - [768, 16, 512, 32]
    - [31, 0.0]
  - - [16, 768, 1, 16384]
    - [32, 0.0]
  - - [128, 64, 1, 512]
    - [0, 0.0]
  - - [128, 128, 1, 512]
    - [0, 0.0]
  - - [32, 768, 1, 16384]
    - [33, 0.0]
  - - [256, 128, 1, 512]
    - [10, 0.0]
  - - [256, 104, 1, 61440]
    - [4, 0.0]
  - - [64, 128, 1, 1024]
    - [34, 0.0]
  - - [64, 64, 512, 64]
    - [35, 0.0]
  - - [32, 32, 1, 1024]
    - [8, 0.0]
  - - [256, 256, 1, 512]
    - [36, 0.0]
  - - [512, 200, 1, 20480]
    - [26, 0.0]
  - - [512, 1024, 1, 126976]
    - [37, 0.0]
  - - [512, 98, 1, 20480]
    - [38, 0.0]
  - - [32, 128, 1, 512]
    - [9, 0.0]
  - - [768, 512, 1, 512]
    - [3, 0.0]
  - - [8, 16, 1, 512]
    - [9, 0.0]
  - - [256, 64, 1, 512]
    - [0, 0.0]
  - - [128, 9776, 1, 1024]
    - [39, 0.0]
  - - [768, 768, 1, 16384]
    - [40, 0.0]
  - - [256, 896, 1, 512]
    - [7, 0.0]
  - - [256, 88, 1, 61440]
    - [4, 0.0]
  - - [640, 256, 1, 512]
    - [7, 0.0]
  - - [32, 64, 1, 512]
    - [0, 0.0]
  - - [128, 192, 1, 512]
    - [9, 0.0]
  - - [128, 16, 1, 512]
    - [0, 0.0]
  - - [128, 512, 1, 1024]
    - [41, 0.0]
  - - [128, 32, 1, 512]
    - [8, 0.0]
  - - [448, 448, 1, 512]
    - [7, 0.0]
  - - [512, 1024, 1, 1024]
    - [42, 0.0]
  - - [768, 128, 1, 512]
    - [2, 0.0]
  - - [128, 128, 1, 1024]
    - [8, 0.0]
  - - [64, 32, 1, 30720]
    - [43, 0.0]
  - - [128, 256, 1, 32768]
    - [4, 0.0]
  - - [352, 352, 1, 512]
    - [41, 0.0]
  - - [32, 32, 512, 64]
    - [16, 0.0]
- null
- null
- DeviceEfficiency
- Equality
