library/src/amd_detail/rocblaslt/src/Tensile/Logic/asm_full/aquavanjaram/gfx942_64cu/Equality/aquavanjaram_Cijk_Ailk_Bljk_SB_UserArgs.yaml
- {MinimumRequiredVersion: 4.33.0}
- aquavanjaram
- {Architecture: gfx942, CUCount: 64}
- [Device 0049, Device 0050]
    SolutionIndex: 0
    SolutionNameMin: Cijk_Ailk_Bljk_SB_UserArgs_MT16x256x16_MI16x16x1_SN_GSU1_GSUC0_GSUWGMRR1_K1_MIWT1_4_SU4_SUM0_SUS256_WGM8_WGMXCC1_WGMXCCGn1
    SolutionIndex: 1
    SolutionNameMin: Cijk_Ailk_Bljk_SB_UserArgs_MT32x32x64_MI16x16x1_SN_GRVWA4_GRVWB4_GSU1_LBSPPA512_LBSPPB256_LPA16_LPB8_LRVW4_MIWT1_1_NLCA1_SU0_SUM0_SUS0_SVW1_VWA1_WG32_8_1_WGM0
    SolutionIndex: 2
    SolutionNameMin: Cijk_Ailk_Bljk_SB_UserArgs_MT16x64x16_MI16x16x1_SN_GSU1_GSUC0_GSUWGMRR0_K1_MIWT1_1_NTA0_NTB0_NTD0_NEPBS16_SU0_SUM0_SUS0_WGM1_WGMXCC1_WGMXCCG0
    SolutionIndex: 3
    SolutionNameMin: Cijk_Ailk_Bljk_SB_UserArgs_MT48x64x16_MI16x16x1_SN_GSU1_GSUC0_GSUWGMRR0_K1_MIWT3_1_SU4_SUM0_SUS256_WGM8_WGMXCC1_WGMXCCGn1
    SolutionIndex: 4
    SolutionNameMin: Cijk_Ailk_Bljk_SB_UserArgs_MT16x64x16_MI16x16x1_SN_GRVWA1_GRVWB2_GSU1_GSUC0_GSUWGMRR0_K1_LBSPPA128_LPB2_LRVW2_MIWT1_1_NTA0_NTB0_NTD0_NEPBS0_SU8_SUM0_SUS64_WGM1_WGMXCC8_WGMXCCG0
    SolutionIndex: 5
    SolutionNameMin: Cijk_Ailk_Bljk_SB_UserArgs_MT64x32x16_MI16x16x1_SN_GRVWB2_GSU1_GSUC0_GSUWGMRR0_K1_LBSPPA512_LPB2_LRVW2_MIWT2_1_SU4_SUM0_SUS256_WG32_8_1_WGM8_WGMXCC1_WGMXCCGn1
    SolutionIndex: 6
    SolutionNameMin: Cijk_Ailk_Bljk_SB_UserArgs_MT64x32x16_MI16x16x1_SN_GRVWB2_GSU1_GSUC1_GSUWGMRR0_K1_LBSPPA512_LPB2_LRVW2_MIWT2_1_SU4_SUM0_SUS256_WG32_8_1_WGM8_WGMXCC1_WGMXCCGn1
    SolutionIndex: 7
    SolutionNameMin: Cijk_Ailk_Bljk_SB_UserArgs_MT128x256x32_MI16x16x1_SN_GRVWA4_GRVWB4_GSU1_LBSPPA2048_LBSPPB128_LPA0_LPB8_LRVW4_MIWT4_8_NLCA1_SU0_SUM0_SUS0_SVW4_VWA4_WG32_8_1_WGM40
- - - [16, 82, 512, 16]
    - [0, 0.0]
  - - [128, 512, 1, 256]
    - [1, 0.0]
  - - [1, 1, 76, 256]
    - [2, 0.0]
  - - [1, 1, 13, 256]
    - [2, 0.0]
  - - [768, 512, 1, 64]
    - [3, 0.0]
  - - [1, 1, 100, 256]
    - [2, 0.0]
  - - [1312, 512, 1, 64]
    - [3, 0.0]
  - - [128, 512, 1, 192]
    - [1, 0.0]
  - - [256, 512, 1, 896]
    - [1, 0.0]
  - - [128, 512, 1, 80]
    - [2, 0.0]
  - - [1, 1, 62, 256]
    - [4, 0.0]
  - - [1, 1, 64, 256]
    - [4, 0.0]
  - - [1, 1, 74, 256]
    - [2, 0.0]
  - - [1, 1, 49, 256]
    - [2, 0.0]
  - - [16, 34, 1, 32]
    - [2, 0.0]
  - - [1, 1, 75, 256]
    - [2, 0.0]
  - - [256, 48, 1, 512]
    - [1, 0.0]
  - - [3, 512, 1, 32]
    - [2, 0.0]
  - - [1, 1, 14, 256]
    - [2, 0.0]
  - - [16, 512, 1, 32]
    - [2, 0.0]
  - - [768, 512, 1, 272]
    - [5, 0.0]
  - - [1, 1, 65, 256]
    - [2, 0.0]
  - - [64, 32, 1, 32]
    - [4, 0.0]
  - - [256, 512, 1, 128]
    - [1, 0.0]
  - - [768, 512, 1, 128]
    - [5, 0.0]
  - - [32, 512, 1, 128]
    - [1, 0.0]
  - - [1, 1, 82, 256]
    - [2, 0.0]
  - - [64, 512, 1, 416]
    - [1, 0.0]
  - - [64, 512, 1, 32]
    - [2, 0.0]
  - - [128, 512, 1, 48]
    - [2, 0.0]
  - - [1, 1, 86, 256]
    - [2, 0.0]
  - - [16, 8192, 1, 82]
    - [2, 0.0]
  - - [1, 1, 73, 256]
    - [2, 0.0]
  - - [1, 35, 1, 16]
    - [2, 0.0]
  - - [1, 187, 1, 256]
    - [4, 0.0]
  - - [1, 1, 43, 256]
    - [2, 0.0]
  - - [64, 512, 1, 704]
    - [1, 0.0]
  - - [256, 512, 1, 640]
    - [1, 0.0]
  - - [1, 22, 1, 16]
    - [2, 0.0]
  - - [128, 512, 1, 16]
    - [5, 0.0]
  - - [256, 72, 1, 512]
    - [1, 0.0]
  - - [1, 1, 15, 256]
    - [2, 0.0]
  - - [1, 1, 96, 256]
    - [4, 0.0]
  - - [128, 512, 1, 704]
    - [1, 0.0]
  - - [1, 1, 25, 256]
    - [2, 0.0]
  - - [1024, 512, 1, 128]
    - [5, 0.0]
  - - [128, 512, 1, 416]
    - [1, 0.0]
  - - [1, 1, 83, 256]
    - [2, 0.0]
  - - [128, 512, 1, 128]
    - [1, 0.0]
  - - [256, 512, 1, 256]
    - [1, 0.0]
  - - [256, 96, 1, 512]
    - [1, 0.0]
  - - [32, 512, 1, 64]
    - [2, 0.0]
  - - [128, 512, 1, 896]
    - [1, 0.0]
  - - [1, 512, 1, 16]
    - [3, 0.0]
  - - [1, 19, 1, 16]
    - [2, 0.0]
  - - [1, 23, 1, 16]
    - [2, 0.0]
  - - [16, 25, 1, 32]
    - [6, 0.0]
  - - [128, 16384, 1, 256]
    - [7, 0.0]
  - - [1, 34, 1, 16]
    - [2, 0.0]
  - - [128, 512, 1, 1792]
    - [1, 0.0]
  - - [16, 20, 1, 32]
    - [6, 0.0]
  - - [1, 17, 1, 16]
    - [3, 0.0]
  - - [1, 1, 91, 256]
    - [4, 0.0]
  - - [256, 16, 1, 512]
    - [1, 0.0]
  - - [128, 512, 1, 64]
    - [1, 0.0]
  - - [128, 512, 1, 112]
    - [2, 0.0]
  - - [1, 1, 44, 256]
    - [4, 0.0]
  - - [16, 24, 1, 32]
    - [2, 0.0]
  - - [8, 512, 1, 16]
    - [2, 0.0]
  - - [256, 512, 1, 64]
    - [1, 0.0]
  - - [64, 512, 1, 512]
    - [1, 0.0]
  - - [1, 1, 57, 256]
    - [2, 0.0]
  - - [64, 512, 1, 256]
    - [1, 0.0]
  - - [768, 512, 1, 256]
    - [5, 0.0]
  - - [1, 1, 81, 256]
    - [2, 0.0]
  - - [256, 64, 1, 512]
    - [1, 0.0]
  - - [16, 27, 1, 32]
    - [3, 0.0]
  - - [64, 512, 1, 128]
    - [1, 0.0]
  - - [128, 512, 1, 320]
    - [1, 0.0]
  - - [16, 23, 1, 32]
    - [5, 0.0]
  - - [1, 1, 101, 256]
    - [2, 0.0]
  - - [1, 1, 71, 256]
    - [2, 0.0]
  - - [1, 20, 1, 16]
    - [2, 0.0]
  - - [1, 1, 46, 256]
    - [2, 0.0]
  - - [160, 512, 1, 704]
    - [1, 0.0]
  - - [16, 22, 1, 32]
    - [2, 0.0]
  - - [16, 19, 1, 32]
    - [3, 0.0]
  - - [256, 256, 1, 512]
    - [1, 0.0]
  - - [1, 1, 48, 256]
    - [2, 0.0]
  - - [16, 35, 1, 32]
    - [2, 0.0]
  - - [128, 512, 1, 352]
    - [1, 0.0]
  - - [1, 1, 50, 256]
    - [2, 0.0]
  - - [1, 24, 1, 16]
    - [2, 0.0]
  - - [32, 512, 1, 32]
    - [1, 0.0]
  - - [16, 17, 1, 32]
    - [2, 0.0]
  - - [1, 1, 72, 256]
    - [2, 0.0]
  - - [160, 512, 1, 64]
    - [1, 0.0]
  - - [32, 512, 1, 20]
    - [4, 0.0]
  - - [128, 512, 1, 800]
    - [1, 0.0]
  - - [1, 27, 1, 16]
    - [2, 0.0]
- null
- null
- DeviceEfficiency
- Equality
