library/src/amd_detail/rocblaslt/src/Tensile/Logic/asm_full/aquavanjaram/gfx942_64cu/Equality/aquavanjaram_Cijk_Alik_Bljk_BBS_BH_UserArgs.yaml
- {MinimumRequiredVersion: 4.33.0}
- aquavanjaram
- {Architecture: gfx942, CUCount: 64}
- [Device 0049, Device 0050]
    SolutionIndex: 0
    SolutionNameMin: Cijk_Alik_Bljk_BBS_BH_UserArgs_MT64x64x128_MI16x16x1_SN_LDSB1_GRVWA8_GRVWB8_GSU1_LBSPPA512_LBSPPB256_LPA16_LPB16_LRVW8_MIWT2_2_SS0_SU8_SUM1_SUS1024_SVW8_VWA2_WG32_8_1_WGM0
    SolutionIndex: 1
    SolutionNameMin: Cijk_Alik_Bljk_BBS_BH_UserArgs_MT128x96x64_MI16x16x1_SN_LDSB0_GRVWA8_GRVWB8_GSU1_LBSPPA512_LBSPPB128_LPA16_LPB16_LRVW8_MIWT4_3_SS1_SU8_SUM1_SUS256_SVW4_VWA4_WG32_8_1_WGM8
    SolutionIndex: 2
    SolutionNameMin: Cijk_Alik_Bljk_BBS_BH_UserArgs_MT128x96x64_MI16x16x1_SN_LDSB0_GRVWA8_GRVWB8_GSU1_LBSPPA512_LBSPPB128_LPA16_LPB16_LRVW8_MIWT4_3_SS1_SU32_SUM1_SUS1024_SVW4_VWA4_WG32_8_1_WGM0
    SolutionIndex: 3
    SolutionNameMin: Cijk_Alik_Bljk_BBS_BH_UserArgs_MT32x32x128_MI16x16x1_SN_LDSB0_GRVWA8_GRVWB8_GSU1_LBSPPA256_LBSPPB256_LPA16_LPB16_LRVW8_MIWT1_1_SS1_SU8_SUM1_SUS256_SVW1_VWA1_WG32_8_1_WGM0
    SolutionIndex: 4
    SolutionNameMin: Cijk_Alik_Bljk_BBS_BH_UserArgs_MT32x16x512_MI16x16x1_SN_LDSB1_GRVWA8_GRVWB8_GSU1_LBSPPA1024_LBSPPB1024_LPA16_LPB16_LRVW8_MIWT1_1_SU0_SUM0_SUS0_SVW1_VWA1_WG32_4_1_WGM0
    SolutionIndex: 5
    SolutionNameMin: Cijk_Alik_Bljk_BBS_BH_UserArgs_MT64x128x128_MI16x16x1_SN_LDSB1_GRVWA8_GRVWB8_GSU1_LBSPPA1024_LBSPPB256_LPA16_LPB16_LRVW8_MIWT4_2_SS1_SU8_SUM1_SUS256_SVW4_VWA4_WG16_16_1_WGM0
    SolutionIndex: 6
    SolutionNameMin: Cijk_Alik_Bljk_BBS_BH_UserArgs_MT224x256x64_MI16x16x1_SN_GRVWA4_GRVWB4_GSU1_LBSPPA256_LBSPPB128_LPA4_LPB4_LRVW4_MIWT14_4_SU8_SUM0_SUS256_SVW2_VWA2_WG16_16_1_WGM0
    SolutionIndex: 7
    SolutionNameMin: Cijk_Alik_Bljk_BBS_BH_UserArgs_MT64x48x128_MI16x16x1_SN_LDSB0_GRVWA8_GRVWB8_GSU1_LBSPPA256_LBSPPB256_LPA16_LPB16_LRVW8_MIWT1_3_SS1_SU8_SUM1_SUS512_SVW1_VWA1_WG64_4_1_WGM0
    SolutionIndex: 8
    SolutionNameMin: Cijk_Alik_Bljk_BBS_BH_UserArgs_MT128x128x64_MI16x16x1_SN_LDSB1_GRVWA8_GRVWB8_GSU1_LBSPPA512_LPA16_LPB16_LRVW8_MIWT4_4_SS1_SU8_SUM1_SUS512_SVW4_VWA4_WG32_8_1_WGM8
    SolutionIndex: 9
    SolutionNameMin: Cijk_Alik_Bljk_BBS_BH_UserArgs_MT32x64x128_MI16x16x1_SN_LDSB0_GRVWA8_GRVWB8_GSU1_LBSPPA512_LBSPPB256_LPA16_LPB16_LRVW8_MIWT2_1_SS1_SU8_SUM1_SUS256_SVW2_VWA2_WG16_16_1_WGM0
    SolutionIndex: 10
    SolutionNameMin: Cijk_Alik_Bljk_BBS_BH_UserArgs_MT128x256x64_MI16x16x1_SN_LDSB1_GRVWA8_GRVWB8_GSU1_LBSPPA1024_LPA16_LPB16_LRVW8_MIWT8_4_SS1_SU8_SUM1_SUS512_SVW8_VWA8_WG16_16_1_WGM0
    SolutionIndex: 11
    SolutionNameMin: Cijk_Alik_Bljk_BBS_BH_UserArgs_MT64x16x64_MI16x16x1_SN_GRVWA8_GRVWB2_GSU1_GSUC0_GSUWGMRR0_K1_LBSPPA128_LBSPPB128_LPA16_LPB16_LRVW8_MIWT1_1_NTA4_NTC0_NTD0_SU0_SUM0_SUS0_SVW1_VWA1_WGM1_WGMXCC1_WGMXCCGn1
    SolutionIndex: 12
    SolutionNameMin: Cijk_Alik_Bljk_BBS_BH_UserArgs_MT32x32x128_MI16x16x1_SN_LDSB1_GRVWA8_GRVWB8_GSU1_LBSPPA256_LBSPPB256_LPA16_LPB16_LRVW8_MIWT1_1_SS1_SU8_SUM1_SUS256_SVW1_VWA1_WG32_8_1_WGM8
    SolutionIndex: 13
    SolutionNameMin: Cijk_Alik_Bljk_BBS_BH_UserArgs_MT160x128x64_MI16x16x1_SN_LDSB1_GRVWA8_GRVWB8_GSU1_LBSPPA256_LPA16_LPB16_LRVW8_MIWT10_2_SS1_SU0_SUM0_SUS0_SVW2_VWA2_WG16_16_1_WGM0
    SolutionIndex: 14
    SolutionNameMin: Cijk_Alik_Bljk_BBS_BH_UserArgs_MT256x192x64_MI16x16x1_SN_GRVWA8_GRVWB8_GSU1_K1_LBSPPA256_LBSPPB256_LPA16_LPB16_LRVW8_MIAV0_MIWT8_6_NTA3_NTB1_NTC4_NTD4_SS1_SU8_SUM0_SUS256_SPO0_SVW2_ULSGRO0_VWA2_VWB2_WSGRA1_WSGRB1_WG32_8_1_WGM0
    SolutionIndex: 15
    SolutionNameMin: Cijk_Alik_Bljk_BBS_BH_UserArgs_MT32x16x256_MI16x16x1_SN_LDSB0_GRVWA8_GRVWB8_GSU1_LBSPPA512_LBSPPB512_LPA16_LPB16_LRVW8_MIWT1_1_SS1_SU0_SUM0_SUS0_SVW1_VWA1_WG32_4_1_WGM0
    SolutionIndex: 16
    SolutionNameMin: Cijk_Alik_Bljk_BBS_BH_UserArgs_MT192x288x64_MI16x16x1_SN_LDSB1_GRVWA4_GRVWB4_GSU1_LBSPPA256_MIWT6_9_SS0_SU8_SUM1_SUS1024_SVW8_VWA2_WG32_8_1_WGM8
    SolutionIndex: 17
    SolutionNameMin: Cijk_Alik_Bljk_BBS_BH_UserArgs_MT256x192x64_MI16x16x1_SN_GRVWB8_GSU1_GSUC0_GSUWGMRR0_K1_LBSPPA1024_LBSPPB256_MIWT8_6_SU32_SUM0_SUS256_SVW8_VWA8_VWB2_WG32_8_1_WGM16_WGMXCC1_WGMXCCGn1
    SolutionIndex: 18
    SolutionNameMin: Cijk_Alik_Bljk_BBS_BH_UserArgs_MT256x224x64_MI16x16x1_SN_LDSB1_CLR1_GRVWA2_GRVWB2_GSU1_GSUC0_GSUWGMRR0_K1_LBSPPA1024_LBSPPB128_LPA4_LPB4_LRVW4_MIWT8_7_PLR1_SU8_SUM1_SUS128_SVW8_VWA8_VWB1_WG32_8_1_WGM1_WGMXCC1_WGMXCCG0
    SolutionIndex: 19
    SolutionNameMin: Cijk_Alik_Bljk_BBS_BH_UserArgs_MT32x16x256_MI16x16x1_SN_LDSB0_GRVWA8_GRVWB8_GSU1_LBSPPA512_LBSPPB512_LPA16_LPB16_LRVW8_MIWT1_1_SU0_SUM0_SUS0_SVW1_VWA1_WG32_4_1_WGM0
    SolutionIndex: 20
    SolutionNameMin: Cijk_Alik_Bljk_BBS_BH_UserArgs_MT64x64x128_MI16x16x1_SN_LDSB1_GRVWA8_GRVWB8_GSU1_LBSPPA512_LBSPPB256_LPA16_LPB16_LRVW8_MIWT2_2_SS1_SU8_SUM1_SUS256_SVW2_VWA2_WG32_8_1_WGM0
    SolutionIndex: 21
    SolutionNameMin: Cijk_Alik_Bljk_BBS_BH_UserArgs_MT128x64x128_MI16x16x1_SN_LDSB1_GRVWA8_GRVWB8_GSU1_LBSPPA512_LBSPPB256_LPA16_LPB16_LRVW8_MIWT2_4_SS0_SU0_SUM0_SUS0_SVW8_VWA2_WG64_4_1_WGM8
    SolutionIndex: 22
    SolutionNameMin: Cijk_Alik_Bljk_BBS_BH_UserArgs_MT128x128x64_MI16x16x1_SN_LDSB1_GRVWA8_GRVWB8_GSU1_GSUC0_GSUWGMRR0_K1_LBSPPA512_LBSPPB512_LSU1_MIWT4_4_NTD7_SU16_SUM1_SUS256_SVW4_VWA4_VWB4_WG32_8_1_WGM1_WGMXCC8_WGMXCCG304
    SolutionIndex: 23
    SolutionNameMin: Cijk_Alik_Bljk_BBS_BH_UserArgs_MT64x64x64_MI16x16x1_SN_LDSB1_GRVWA8_GRVWB8_GSU1_GSUC0_GSUWGMRR0_K1_LBSPPA256_LBSPPB256_LSU1_MIWT2_2_NTD7_SU16_SUM1_SUS128_SVW2_VWA2_VWB2_WG32_8_1_WGM4_WGMXCC8_WGMXCCG304
    SolutionIndex: 24
    SolutionNameMin: Cijk_Alik_Bljk_BBS_BH_UserArgs_MT256x128x64_MI16x16x1_SN_GRVWA8_GRVWB8_GSU1_LBSPPA1024_LBSPPB128_LPA16_LPB16_LRVW8_MIWT8_4_SU8_SUM0_SUS256_SVW8_VWA8_WG32_8_1_WGM40
    SolutionIndex: 25
    SolutionNameMin: Cijk_Alik_Bljk_BBS_BH_UserArgs_MT64x32x128_MI16x16x1_SN_LDSB0_GRVWA8_GRVWB8_GSU1_LBSPPA512_LBSPPB256_LPA16_LPB16_LRVW8_MIWT2_1_SS1_SU8_SUM1_SUS256_SVW2_VWA2_WG32_8_1_WGM0
    SolutionIndex: 26
    SolutionNameMin: Cijk_Alik_Bljk_BBS_BH_UserArgs_MT128x128x64_MI16x16x1_SN_LDSB1_GRVWA8_GRVWB8_GSU1_LBSPPA512_LPA16_LPB16_LRVW8_MIWT4_4_SS1_SU8_SUM1_SUS256_SVW4_VWA4_WG32_8_1_WGM8
    SolutionIndex: 27
    SolutionNameMin: Cijk_Alik_Bljk_BBS_BH_UserArgs_MT224x256x64_MI16x16x1_SN_GRVWA2_GRVWB2_GSU1_K1_LBSPPA128_LBSPPB256_LPA4_LPB4_LRVW4_MIAV0_MIWT7_8_NTA1_NTB1_NTC4_NTD4_SS1_SU32_SUM0_SUS2048_SPO0_SVW1_ULSGRO0_VWA1_VWB2_WSGRA2_WSGRB2_WG32_8_1_WGMn16
    SolutionIndex: 28
    SolutionNameMin: Cijk_Alik_Bljk_BBS_BH_UserArgs_MT128x64x128_MI16x16x1_SN_LDSB1_GRVWA8_GRVWB8_GSU1_GSUC0_GSUWGMRR0_K1_LBSPPA1024_LBSPPB1024_LSU2_MIWT4_4_NTD7_SU16_SUM0_SUS256_SVW4_VWA4_VWB4_WG32_4_2_WGM1_WGMXCC1_WGMXCCG304
    SolutionIndex: 29
    SolutionNameMin: Cijk_Alik_Bljk_BBS_BH_UserArgs_MT128x192x64_MI16x16x1_SN_LDSB1_GRVWA8_GRVWB8_GSU1_LBSPPA512_LPA16_LPB16_LRVW8_MIWT4_6_SS1_SU8_SUM1_SUS512_SVW4_VWA4_WG32_8_1_WGM0
    SolutionIndex: 30
    SolutionNameMin: Cijk_Alik_Bljk_BBS_BH_UserArgs_MT64x96x128_MI16x16x1_SN_LDSB1_GRVWA8_GRVWB8_GSU1_LBSPPA512_LBSPPB256_LPA16_LPB16_LRVW8_MIWT2_3_SS1_SU8_SUM1_SUS1024_SVW2_VWA2_WG32_8_1_WGM0
    SolutionIndex: 31
    SolutionNameMin: Cijk_Alik_Bljk_BBS_BH_UserArgs_MT256x160x64_MI16x16x1_SN_LDSB1_CLR1_GRVWA8_GRVWB8_GSU1_GSUC0_GSUWGMRR0_K1_LBSPPA1024_LBSPPB128_LPA16_LPB16_LRVW8_MIWT8_5_PLR1_SU16_SUM0_SUS128_SVW8_VWA8_VWB1_WG32_8_1_WGM1_WGMXCC1_WGMXCCG0
    SolutionIndex: 32
    SolutionNameMin: Cijk_Alik_Bljk_BBS_BH_UserArgs_MT192x192x64_MI16x16x1_SN_LDSB1_GRVWA8_GRVWB8_GSU1_LBSPPA256_LPA16_LPB16_LRVW8_MIWT6_6_SS0_SU0_SUM0_SUS0_SVW8_VWA2_WG32_8_1_WGM8
    SolutionIndex: 33
    SolutionNameMin: Cijk_Alik_Bljk_BBS_BH_UserArgs_MT64x16x128_MI16x16x1_SN_LDSB0_GRVWA8_GRVWB8_GSU1_LBSPPA256_LBSPPB256_LPA16_LPB16_LRVW8_MIWT1_1_SS0_SU8_SUM1_SUS1024_SVW4_VWA1_WG64_4_1_WGM0
    SolutionIndex: 34
    SolutionNameMin: Cijk_Alik_Bljk_BBS_BH_UserArgs_MT128x96x128_MI16x16x1_SN_LDSB1_CLR1_GRVWA8_GRVWB8_GSU1_GSUC0_GSUWGMRR0_K1_LBSPPA1024_LBSPPB256_LPA16_LPB16_LRVW8_MIWT4_3_PLR1_SU16_SUM0_SUS256_SVW4_VWA4_VWB1_WG32_8_1_WGM8_WGMXCC8_WGMXCCG304
- - - [352, 512, 1, 128]
    - [0, 0.0]
  - - [1168, 512, 1, 256]
    - [1, 0.0]
  - - [1240, 512, 1, 128]
    - [2, 0.0]
  - - [128, 512, 1, 128]
    - [3, 0.0]
  - - [1144, 512, 1, 512]
    - [1, 0.0]
  - - [32, 512, 1, 64]
    - [4, 0.0]
  - - [896, 512, 1, 128]
    - [5, 0.0]
  - - [200, 15360, 1, 256]
    - [6, 0.0]
  - - [320, 512, 1, 768]
    - [7, 0.0]
  - - [792, 1024, 1, 256]
    - [8, 0.0]
  - - [160, 512, 1, 128]
    - [9, 0.0]
  - - [1824, 512, 1, 256]
    - [8, 0.0]
  - - [256, 512, 1, 128]
    - [9, 0.0]
  - - [2968, 512, 1, 256]
    - [10, 0.0]
  - - [60, 1024, 1, 36]
    - [11, 0.0]
  - - [128, 1024, 1, 128]
    - [9, 0.0]
  - - [32, 32, 512, 768]
    - [12, 0.0]
  - - [704, 512, 1, 128]
    - [5, 0.0]
  - - [112, 512, 1, 128]
    - [12, 0.0]
  - - [192, 512, 1, 128]
    - [9, 0.0]
  - - [544, 1024, 1, 256]
    - [1, 0.0]
  - - [1032, 1024, 1, 128]
    - [13, 0.0]
  - - [512, 126976, 1, 1024]
    - [14, 0.0]
  - - [64, 512, 1, 256]
    - [15, 0.0]
  - - [128, 512, 1, 768]
    - [3, 0.0]
  - - [1280, 512, 1, 128]
    - [1, 0.0]
  - - [168, 51200, 1, 64]
    - [16, 0.0]
  - - [200, 20480, 1, 256]
    - [17, 0.0]
  - - [3072, 1024, 32, 1024]
    - [18, 0.0]
  - - [64, 512, 1, 32]
    - [19, 0.0]
  - - [512, 512, 1, 768]
    - [20, 0.0]
  - - [272, 512, 1, 768]
    - [7, 0.0]
  - - [776, 512, 1, 256]
    - [21, 0.0]
  - - [128, 512, 1, 256]
    - [3, 0.0]
  - - [16, 512, 1, 8]
    - [11, 0.0]
  - - [800, 512, 1, 128]
    - [21, 0.0]
  - - [64, 512, 1, 512]
    - [15, 0.0]
  - - [1792, 512, 1, 128]
    - [22, 0.0]
  - - [128, 32768, 1, 256]
    - [10, 0.0]
  - - [64, 1024, 1, 64]
    - [11, 0.0]
  - - [3072, 1024, 16, 768]
    - [18, 0.0]
  - - [416, 512, 1, 128]
    - [0, 0.0]
  - - [448, 512, 1, 448]
    - [23, 0.0]
  - - [3384, 512, 1, 256]
    - [24, 0.0]
  - - [1536, 1024, 28, 1024]
    - [10, 0.0]
  - - [1216, 1024, 1, 64]
    - [13, 0.0]
  - - [248, 248, 512, 1024]
    - [10, 0.0]
  - - [256, 512, 1, 256]
    - [25, 0.0]
  - - [1312, 512, 1, 256]
    - [26, 0.0]
  - - [896, 1024, 32, 1536]
    - [27, 0.0]
  - - [104, 61440, 1, 256]
    - [10, 0.0]
  - - [1024, 512, 1, 768]
    - [28, 0.0]
  - - [2672, 512, 1, 640]
    - [29, 0.0]
  - - [64, 512, 1, 768]
    - [19, 0.0]
  - - [512, 512, 1, 64]
    - [23, 0.0]
  - - [176, 1024, 1, 48]
    - [23, 0.0]
  - - [544, 512, 1, 256]
    - [30, 0.0]
  - - [352, 512, 1, 352]
    - [0, 0.0]
  - - [32, 1024, 1, 32]
    - [19, 0.0]
  - - [128, 512, 1, 1024]
    - [3, 0.0]
  - - [256, 512, 1, 768]
    - [9, 0.0]
  - - [128, 16384, 1, 256]
    - [10, 0.0]
  - - [248, 248, 512, 128]
    - [24, 0.0]
  - - [768, 16384, 1, 768]
    - [31, 0.0]
  - - [896, 1024, 32, 3072]
    - [27, 0.0]
  - - [1792, 512, 1, 264]
    - [22, 0.0]
  - - [248, 2, 512, 128]
    - [11, 0.0]
  - - [192, 61440, 1, 256]
    - [32, 0.0]
  - - [32, 512, 1, 32]
    - [19, 0.0]
  - - [448, 512, 1, 128]
    - [20, 0.0]
  - - [80, 512, 1, 128]
    - [33, 0.0]
  - - [320, 512, 1, 128]
    - [20, 0.0]
  - - [512, 1024, 1, 1024]
    - [28, 0.0]
  - - [416, 512, 1, 64]
    - [23, 0.0]
  - - [88, 61440, 1, 256]
    - [10, 0.0]
  - - [1024, 1024, 1, 512]
    - [22, 0.0]
  - - [192, 512, 1, 768]
    - [9, 0.0]
  - - [24, 512, 1, 32]
    - [19, 0.0]
  - - [704, 512, 1, 512]
    - [5, 0.0]
  - - [16, 512, 1, 128]
    - [12, 0.0]
  - - [744, 512, 1, 544]
    - [5, 0.0]
  - - [896, 512, 1, 256]
    - [5, 0.0]
  - - [104, 20480, 1, 256]
    - [29, 0.0]
  - - [256, 512, 1, 64]
    - [11, 0.0]
  - - [64, 64, 512, 64]
    - [23, 0.0]
  - - [64, 512, 1, 1312]
    - [19, 0.0]
  - - [288, 512, 1, 256]
    - [0, 0.0]
  - - [3072, 1024, 28, 1024]
    - [18, 0.0]
  - - [640, 512, 1, 768]
    - [30, 0.0]
  - - [128, 512, 1, 32]
    - [12, 0.0]
  - - [704, 512, 1, 64]
    - [23, 0.0]
  - - [512, 1024, 1, 128]
    - [5, 0.0]
  - - [1888, 512, 1, 256]
    - [26, 0.0]
  - - [1280, 512, 1, 512]
    - [34, 0.0]
- null
- null
- DeviceEfficiency
- Equality
