library/src/amd_detail/rocblaslt/src/Tensile/Logic/asm_full/aquavanjaram/gfx942_80cu/Equality/aquavanjaram_Cijk_Ailk_Bljk_HHS_BH_Bias_HAS_SAV_UserArgs.yaml
- {MinimumRequiredVersion: 4.33.0}
- aquavanjaram
- {Architecture: gfx942, CUCount: 80}
- [Device 0049, Device 0050]
    SolutionIndex: 0
    SolutionNameMin: Cijk_Ailk_Bljk_HHS_BH_Bias_HAS_SAV_UserArgs_MT16x16x256_MI16x16x1_SN_LDSB0_GRVWB8_GSU1_LBSPPA256_LBSPPB512_LPA16_LPB16_MIWT1_1_NLCA1_NLCB1_SU0_SUM0_SUS0_SVW1_VWA1_WG16_4_4_WGM1
    SolutionIndex: 1
    SolutionNameMin: Cijk_Ailk_Bljk_HHS_BH_Bias_HAS_SAV_UserArgs_MT192x256x64_MI16x16x1_SN_GRVWA8_GRVWB8_GSU1_GSUC0_GSUWGMRR0_K1_LBSPPA3072_LBSPPB512_LPA0_LPB16_LRVW8_MIWT12_4_NTA4_NTB7_NLCA3_SU0_SUM0_SUS0_SVW4_VWA4_VWB4_WG16_16_1_WGM1_WGMXCC1_WGMXCCG80
    SolutionIndex: 2
    SolutionNameMin: Cijk_Ailk_Bljk_HHS_BH_Bias_HAS_SAV_UserArgs_MT192x256x64_MI16x16x1_SN_GRVWA8_GRVWB8_GSU1_GSUC0_GSUWGMRR0_K1_LBSPPA3072_LBSPPB1024_LPA32_LPB16_LRVW8_MIWT6_8_NTA4_NTB4_NLCA3_SU0_SUM0_SUS0_SVW2_VWA2_VWB8_WG32_8_1_WGM1_WGMXCC1_WGMXCCG80
    SolutionIndex: 3
    SolutionNameMin: Cijk_Ailk_Bljk_HHS_BH_Bias_HAS_SAV_UserArgs_MT16x128x64_MI16x16x1_SN_GRVWA4_GRVWB8_GSU1_GSUC0_GSUWGMRR0_K1_LBSPPA256_LBSPPB256_LPA16_LPB16_LRVW8_MIWT1_2_NTA7_NTB4_NLCA1_SU0_SUM0_SUS0_SVW1_VWA1_VWB2_WG16_16_1_WGM1_WGMXCC1_WGMXCCG80
    SolutionIndex: 4
    SolutionNameMin: Cijk_Ailk_Bljk_HHS_BH_Bias_HAS_SAV_UserArgs_MT32x32x64_MI16x16x1_SN_GRVWA8_GRVWB8_GSU1_GSUC0_GSUWGMRR0_K1_LBSPPA512_LBSPPB128_LPA16_LPB16_LRVW8_MIWT1_1_NTA7_NTB4_NLCA1_SU0_SUM0_SUS0_SVW1_VWA1_VWB1_WG32_8_1_WGM1_WGMXCC1_WGMXCCG80
    SolutionIndex: 5
    SolutionNameMin: Cijk_Ailk_Bljk_HHS_BH_Bias_HAS_SAV_UserArgs_MT192x256x64_MI16x16x1_SN_GRVWA8_GRVWB8_GSU1_GSUC0_GSUWGMRR0_K1_LBSPPA3072_LBSPPB512_LPA0_LPB16_LRVW8_MIWT12_4_NTA7_NTB4_NLCA3_SU0_SUM0_SUS0_SVW4_VWA4_VWB4_WG16_16_1_WGM1_WGMXCC1_WGMXCCG80
    SolutionIndex: 6
    SolutionNameMin: Cijk_Ailk_Bljk_HHS_BH_Bias_HAS_SAV_UserArgs_MT256x192x64_MI16x16x1_SN_GRVWA8_GRVWB8_GSU1_GSUC0_GSUWGMRR0_K1_LBSPPA4096_LBSPPB512_LPA0_LPB16_LRVW8_MIWT4_12_NTA4_NTB4_NLCA1_SU0_SUM0_SUS0_SVW4_VWA4_VWB4_WG64_4_1_WGM4_WGMXCC1_WGMXCCG80
    SolutionIndex: 7
    SolutionNameMin: Cijk_Ailk_Bljk_HHS_BH_Bias_HAS_SAV_UserArgs_MT64x16x64_MI16x16x1_SN_GRVWA8_GRVWB4_GSU1_GSUC0_GSUWGMRR0_K1_LBSPPA1024_LBSPPB128_LPA16_LPB16_LRVW8_MIWT1_1_NTA7_NTB4_NLCA1_SU0_SUM0_SUS0_SVW1_VWA1_VWB1_WG64_4_1_WGM1_WGMXCC1_WGMXCCG80
    SolutionIndex: 8
    SolutionNameMin: Cijk_Ailk_Bljk_HHS_BH_Bias_HAS_SAV_UserArgs_MT64x16x64_MI16x16x1_SN_GRVWA8_GRVWB4_GSU1_GSUC0_GSUWGMRR0_K1_LBSPPA1024_LBSPPB128_LPA16_LPB16_LRVW8_MIWT1_1_NTA4_NTB4_NLCA1_SU0_SUM0_SUS0_SVW1_VWA1_VWB1_WG64_4_1_WGM1_WGMXCC1_WGMXCCG80
    SolutionIndex: 9
    SolutionNameMin: Cijk_Ailk_Bljk_HHS_BH_Bias_HAS_SAV_UserArgs_MT64x32x64_MI16x16x1_SN_GRVWA8_GRVWB8_GSU1_GSUC0_GSUWGMRR0_K1_LBSPPA1024_LBSPPB128_LPA32_LPB16_LRVW8_MIWT2_1_NTA7_NTB7_NLCA1_SU0_SUM0_SUS0_SVW2_VWA2_VWB1_WG32_8_1_WGM1_WGMXCC1_WGMXCCG80
    SolutionIndex: 10
    SolutionNameMin: Cijk_Ailk_Bljk_HHS_BH_Bias_HAS_SAV_UserArgs_MT256x128x64_MI16x16x1_SN_GRVWA8_GRVWB8_GSU1_GSUC0_GSUWGMRR0_K1_LBSPPA4096_LBSPPB512_LPA0_LPB16_LRVW8_MIWT8_4_NTA7_NTB4_NLCA1_SU0_SUM0_SUS0_SVW8_VWA8_VWB4_WG32_8_1_WGM1_WGMXCC1_WGMXCCG80
    SolutionIndex: 11
    SolutionNameMin: Cijk_Ailk_Bljk_HHS_BH_Bias_AS_SAV_UserArgs_MT16x16x64_MI16x16x1_SN_LDSB0_GRVWB8_GSU1_GSUC0_GSUWGMRR0_K1_LBSPPB128_MIWT1_1_NLCB1_SU0_SUM0_SUS0_WG16_4_1_WGM1_WGMXCC1_WGMXCCGn1
    SolutionIndex: 12
    SolutionNameMin: Cijk_Ailk_Bljk_HHS_BH_Bias_AS_SAV_UserArgs_MT16x32x64_MI16x16x1_SN_LDSB1_GRVWB8_GSU1_GSUC0_GSUWGMRR0_K1_LBSPPA256_LBSPPB128_LPA16_LPB16_LRVW8_MIWT1_1_NLCB1_SU0_SUM0_SUS0_SVW1_VWA1_VWB1_WG16_8_1_WGM1_WGMXCC1_WGMXCCGn1
    SolutionIndex: 13
    SolutionNameMin: Cijk_Ailk_Bljk_HHS_BH_Bias_AS_SAV_UserArgs_MT16x16x64_MI16x16x1_SN_LDSB0_GRVWB8_GSU1_GSUC0_GSUWGMRR0_K1_LBSPPA256_LBSPPB128_LPA16_LPB16_LRVW8_MIWT1_1_NLCB1_SU0_SUM0_SUS0_SVW1_VWA1_VWB1_WG16_4_1_WGM1_WGMXCC1_WGMXCCGn1
    SolutionIndex: 14
    SolutionNameMin: Cijk_Ailk_Bljk_HHS_BH_Bias_AS_SAV_UserArgs_MT16x16x128_MI16x16x1_SN_LDSB1_GRVWB8_GSU1_GSUC0_GSUWGMRR0_K1_LBSPPA256_LBSPPB256_LPA16_LPB16_LRVW8_MIWT1_1_NLCB1_SU0_SUM0_SUS0_SVW1_VWA1_VWB1_WG16_4_4_WGM1_WGMXCC1_WGMXCCGn1
    SolutionIndex: 15
    SolutionNameMin: Cijk_Ailk_Bljk_HHS_BH_Bias_AS_SAV_UserArgs_MT32x16x128_MI16x16x1_SN_LDSB1_GRVWB8_GSU1_GSUC0_GSUWGMRR0_K1_LBSPPA512_LBSPPB256_LPA32_LPB16_LRVW8_MIWT2_1_NLCB1_SU0_SUM0_SUS0_SVW2_VWA2_VWB1_WG16_4_4_WGM1_WGMXCC1_WGMXCCGn1
    SolutionIndex: 16
    SolutionNameMin: Cijk_Ailk_Bljk_HHS_BH_Bias_AS_SAV_UserArgs_MT32x32x64_MI16x16x1_SN_LDSB0_GRVWB8_GSU1_GSUC0_GSUWGMRR0_K1_LBSPPA512_LBSPPB128_LPA16_LPB16_LRVW8_MIWT1_1_NLCB1_SU0_SUM0_SUS0_SVW1_VWA1_VWB1_WG32_8_1_WGM1_WGMXCC1_WGMXCCGn1
    SolutionIndex: 17
    SolutionNameMin: Cijk_Ailk_Bljk_HHS_BH_Bias_AS_SAV_UserArgs_MT16x16x64_MI16x16x1_SN_LDSB1_GRVWB8_GSU1_GSUC0_GSUWGMRR0_K1_LBSPPA256_LBSPPB128_LPA16_LPB16_LRVW8_MIWT1_1_NLCB1_SU0_SUM0_SUS0_SVW1_VWA1_VWB1_WG16_4_1_WGM1_WGMXCC1_WGMXCCGn1
    SolutionIndex: 18
    SolutionNameMin: Cijk_Ailk_Bljk_HHS_BH_Bias_AS_SAV_UserArgs_MT32x32x64_MI16x16x1_SN_LDSB1_GRVWB8_GSU1_GSUC0_GSUWGMRR0_K1_LBSPPA512_LBSPPB128_LPA16_LPB16_LRVW8_MIWT1_1_NLCB1_SU0_SUM0_SUS0_SVW1_VWA1_VWB1_WG32_8_1_WGM1_WGMXCC1_WGMXCCGn1
    SolutionIndex: 19
    SolutionNameMin: Cijk_Ailk_Bljk_HHS_BH_Bias_AS_SAV_UserArgs_MT64x16x128_MI16x16x1_SN_LDSB0_GRVWB8_GSU1_GSUC0_GSUWGMRR0_K1_LBSPPA1024_LBSPPB256_LPA16_LPB16_LRVW8_MIWT1_1_NLCB1_SU0_SUM0_SUS0_SVW1_VWA1_VWB1_WG64_4_1_WGM1_WGMXCC1_WGMXCCGn1
    SolutionIndex: 20
    SolutionNameMin: Cijk_Ailk_Bljk_HHS_BH_Bias_AS_SAV_UserArgs_MT32x64x64_MI16x16x1_SN_LDSB1_GRVWB8_GSU1_GSUC0_GSUWGMRR0_K1_LBSPPA512_LBSPPB128_LPA32_LPB16_LRVW8_MIWT2_1_NLCB1_SU0_SUM0_SUS0_SVW2_VWA2_VWB1_WG16_16_1_WGM1_WGMXCC1_WGMXCCGn1
    SolutionIndex: 21
    SolutionNameMin: Cijk_Ailk_Bljk_HHS_BH_Bias_AS_SAV_UserArgs_MT16x32x64_MI16x16x1_SN_GRVWB8_GSU1_GSUC0_GSUWGMRR0_K1_LBSPPA256_LBSPPB128_LPA16_LPB16_LRVW8_MIWT1_1_NLCA1_NLCB1_SU0_SUM0_SUS0_SVW1_VWA1_VWB1_WG16_8_1_WGM1_WGMXCC1_WGMXCCGn1
    SolutionIndex: 22
    SolutionNameMin: Cijk_Ailk_Bljk_HHS_BH_Bias_AS_SAV_UserArgs_MT32x32x64_MI16x16x1_SN_GRVWB8_GSU1_GSUC0_GSUWGMRR0_K1_LBSPPA512_LBSPPB128_LPA16_LPB16_LRVW8_MIWT1_1_NLCA1_NLCB1_SU0_SUM0_SUS0_SVW1_VWA1_VWB1_WG32_8_1_WGM1_WGMXCC1_WGMXCCGn1
    SolutionIndex: 23
    SolutionNameMin: Cijk_Ailk_Bljk_HHS_BH_Bias_AS_SAV_UserArgs_MT32x32x128_MI16x16x1_SN_GRVWB8_GSU1_GSUC0_GSUWGMRR0_K1_LBSPPA512_LBSPPB512_LPA32_LPB16_LRVW8_MIWT2_2_NLCA1_NLCB1_SU0_SUM0_SUS0_SVW2_VWA2_VWB2_WG16_4_4_WGM1_WGMXCC1_WGMXCCGn1
    SolutionIndex: 24
    SolutionNameMin: Cijk_Ailk_Bljk_HHS_BH_Bias_AS_SAV_UserArgs_MT64x32x64_MI16x16x1_SN_GRVWB8_GSU1_GSUC0_GSUWGMRR0_K1_LBSPPA1024_LBSPPB128_LPA32_LPB16_LRVW8_MIWT2_1_NLCA1_NLCB1_SU0_SUM0_SUS0_SVW2_VWA2_VWB1_WG32_8_1_WGM1_WGMXCC1_WGMXCCGn1
    SolutionIndex: 25
    SolutionNameMin: Cijk_Ailk_Bljk_HHS_BH_Bias_AS_SAV_UserArgs_MT64x64x64_MI16x16x1_SN_GRVWB8_GSU1_GSUC0_GSUWGMRR0_K1_LBSPPA1024_LBSPPB256_LPA32_LPB16_LRVW8_MIWT2_2_NLCA1_NLCB1_SU0_SUM0_SUS0_SVW2_VWA2_VWB2_WG32_8_1_WGM1_WGMXCC1_WGMXCCGn1
    SolutionIndex: 26
    SolutionNameMin: Cijk_Ailk_Bljk_HHS_BH_Bias_AS_SAV_UserArgs_MT32x16x64_MI16x16x1_SN_GRVWB8_GSU1_GSUC0_GSUWGMRR0_K1_LBSPPA512_LBSPPB128_LPA16_LPB16_LRVW8_MIWT1_1_NLCA1_NLCB1_SU0_SUM0_SUS0_SVW1_VWA1_VWB1_WG32_4_1_WGM1_WGMXCC1_WGMXCCGn1
    SolutionIndex: 27
    SolutionNameMin: Cijk_Ailk_Bljk_HHS_BH_Bias_AS_SAV_UserArgs_MT32x48x128_MI16x16x1_SN_GRVWB8_GSU1_GSUC0_GSUWGMRR0_K1_LBSPPA512_LBSPPB256_LPA32_LPB16_LRVW8_MIWT2_3_NLCA1_NLCB1_SU0_SUM0_SUS0_SVW2_VWA2_VWB1_WG16_4_4_WGM1_WGMXCC1_WGMXCCGn1
    SolutionIndex: 28
    SolutionNameMin: Cijk_Ailk_Bljk_HHS_BH_Bias_AS_SAV_UserArgs_MT64x96x64_MI16x16x1_SN_GRVWB8_GSU1_GSUC0_GSUWGMRR0_K1_LBSPPA1024_LBSPPB128_LPA32_LPB16_LRVW8_MIWT2_3_NLCA1_NLCB1_SU0_SUM0_SUS0_SVW2_VWA2_VWB1_WG32_8_1_WGM1_WGMXCC1_WGMXCCGn1
    SolutionIndex: 29
    SolutionNameMin: Cijk_Ailk_Bljk_HHS_BH_Bias_AS_SAV_UserArgs_MT16x32x64_MI16x16x1_SN_GRVWB8_GSU1_GSUC0_GSUWGMRR0_K1_LBSPPA256_LBSPPB128_LPA16_LPB16_LRVW8_MIAV1_MIWT1_1_NLCA1_SU0_SUM0_SUS0_SVW1_VWA1_VWB1_WG16_8_1_WGM1_WGMXCC1_WGMXCCGn1
    SolutionIndex: 30
    SolutionNameMin: Cijk_Ailk_Bljk_HHS_BH_Bias_AS_SAV_UserArgs_MT32x64x64_MI16x16x1_SN_GRVWB8_GSU1_GSUC0_GSUWGMRR0_K1_LBSPPA512_LBSPPB128_LPA32_LPB16_LRVW8_MIAV1_MIWT2_1_NLCA1_SU0_SUM0_SUS0_SVW2_VWA2_VWB1_WG16_16_1_WGM1_WGMXCC1_WGMXCCGn1
    SolutionIndex: 31
    SolutionNameMin: Cijk_Ailk_Bljk_HHS_BH_Bias_AS_SAV_UserArgs_MT64x48x128_MI16x16x1_SN_GRVWB8_GSU1_GSUC0_GSUWGMRR0_K1_LBSPPA1024_LBSPPB256_LPA32_LPB16_LRVW8_MIAV1_MIWT2_3_NLCA1_SU0_SUM0_SUS0_SVW2_VWA2_VWB1_WG32_4_2_WGM1_WGMXCC1_WGMXCCGn1
    SolutionIndex: 32
    SolutionNameMin: Cijk_Ailk_Bljk_HHS_BH_Bias_AS_SAV_UserArgs_MT64x96x64_MI16x16x1_SN_GRVWB8_GSU1_GSUC0_GSUWGMRR0_K1_LBSPPA1024_LBSPPB128_LPA32_LPB16_LRVW8_MIAV1_MIWT2_3_NLCA1_SU0_SUM0_SUS0_SVW2_VWA2_VWB1_WG32_8_1_WGM1_WGMXCC1_WGMXCCGn1
    SolutionIndex: 33
    SolutionNameMin: Cijk_Ailk_Bljk_HHS_BH_Bias_AS_SAV_UserArgs_MT64x64x128_MI16x16x1_SN_GRVWB8_GSU1_GSUC0_GSUWGMRR0_K1_LBSPPA1024_LBSPPB512_LPA32_LPB16_LRVW8_MIAV1_MIWT2_2_NLCA1_SU0_SUM0_SUS0_SVW2_VWA2_VWB2_WG32_8_1_WGM1_WGMXCC1_WGMXCCGn1
    SolutionIndex: 34
    SolutionNameMin: Cijk_Ailk_Bljk_HHS_BH_Bias_AS_SAV_UserArgs_MT32x64x32_MI32x32x1_SN_CLR1_GRVWB8_GSU1_GSUC0_GSUWGMRR0_K1_LBSPPA0_LBSPPB128_LPA0_LPB8_LRVW8_MIAV1_MIWT1_1_NTB0_NLCA1_PLR1_SU0_SUM0_SUS0_SVW1_VWA1_VWB1_WG32_4_1_WGM1_WGMXCC1_WGMXCCGn1
    SolutionIndex: 35
    SolutionNameMin: Cijk_Ailk_Bljk_HHS_BH_Bias_AS_SAV_UserArgs_MT256x64x32_MI32x32x1_SN_CLR1_GRVWB8_GSU1_GSUC0_GSUWGMRR0_K1_LBSPPA0_LBSPPB128_LPA0_LPB8_LRVW8_MIAV1_MIWT2_2_NTB0_NLCA1_PLR1_SU0_SUM0_SUS0_SVW2_VWA2_VWB2_WG128_2_1_WGM1_WGMXCC1_WGMXCCGn1
    SolutionIndex: 36
    SolutionNameMin: Cijk_Ailk_Bljk_HHS_BH_Bias_AS_SAV_UserArgs_MT32x64x32_MI32x32x1_SN_CLR1_GRVWB2_GSU1_GSUC0_GSUWGMRR0_K1_LBSPPA0_LBSPPB128_LPA0_LPB8_LRVW8_MIAV1_MIWT1_1_NTB0_NLCA1_PLR1_SU0_SUM0_SUS0_SVW1_VWA1_VWB1_WG32_4_1_WGM1_WGMXCC1_WGMXCCGn1
    SolutionIndex: 37
    SolutionNameMin: Cijk_Ailk_Bljk_HHS_BH_Bias_AS_SAV_UserArgs_MT32x64x32_MI32x32x1_SN_CLR1_GRVWB8_GSU1_GSUC0_GSUWGMRR0_K1_LBSPPA0_LBSPPB128_LPA0_LPB8_LRVW8_MIAV1_MIWT1_1_NTB4_NLCA1_PLR1_SU0_SUM0_SUS0_SVW1_VWA1_VWB1_WG32_4_1_WGM1_WGMXCC1_WGMXCCGn1
    SolutionIndex: 38
    SolutionNameMin: Cijk_Ailk_Bljk_HHS_BH_Bias_AS_SAV_UserArgs_MT16x192x128_MI16x16x1_SN_GRVWB8_GSU1_GSUC0_GSUWGMRR0_K1_LBSPPA256_LBSPPB256_LPB16_LRVW8_MIWT1_3_NTB0_NTC3_NTD3_SU0_SUM0_SUS0_VWB1_WG16_16_1_WGM1_WGMXCC1_WGMXCCGn1
    SolutionIndex: 39
    SolutionNameMin: Cijk_Ailk_Bljk_HHS_BH_Bias_AS_SAV_UserArgs_MT16x16x64_MI16x16x1_SN_LDSB1_GRVWB8_GSU1_GSUC0_GSUWGMRR0_K1_LBSPPA256_LBSPPB128_LPA16_MIWT1_1_NLCB1_SU0_SUM0_SUS0_SVW1_VWA1_WG16_4_1_WGM1_WGMXCC1_WGMXCCGn1
    SolutionIndex: 40
    SolutionNameMin: Cijk_Ailk_Bljk_HHS_BH_Bias_AS_SAV_UserArgs_MT32x192x64_MI16x16x1_SN_GRVWB8_GSU1_GSUC0_GSUWGMRR0_K1_LBSPPA512_LBSPPB128_LPA32_LPB16_MIWT2_3_NTB0_NTC3_NTD3_SU0_SUM0_SUS0_SVW2_VWA2_VWB1_WG16_16_1_WGM1_WGMXCC1_WGMXCCGn1
    SolutionIndex: 41
    SolutionNameMin: Cijk_Ailk_Bljk_HHS_BH_Bias_AS_SAV_UserArgs_MT64x192x64_MI16x16x1_SN_GRVWB8_GSU1_GSUC0_GSUWGMRR0_K1_LBSPPA1024_LBSPPB128_LPA0_LPB16_LRVW8_MIWT4_3_NTB4_NTC3_NTD3_NLCA1_SU0_SUM0_SUS0_SVW4_VWA4_VWB1_WG16_16_1_WGM1_WGMXCC1_WGMXCCGn1
    SolutionIndex: 42
    SolutionNameMin: Cijk_Ailk_Bljk_HHS_BH_Bias_AS_SAV_UserArgs_MT128x96x64_MI16x16x1_SN_GRVWB8_GSU1_GSUC0_GSUWGMRR0_K1_LBSPPA2048_LBSPPB128_LPA0_LPB16_LRVW8_MIAV1_MIWT4_3_NTB4_NTC3_NTD3_NLCA1_SU0_SUM0_SUS0_SVW4_VWA4_VWB1_WG32_8_1_WGM1_WGMXCC1_WGMXCCGn1
    SolutionIndex: 43
    SolutionNameMin: Cijk_Ailk_Bljk_HHS_BH_Bias_AS_SAV_UserArgs_MT128x192x32_MI16x16x1_SN_GRVWB8_GSU1_GSUC0_GSUWGMRR0_K1_LBSPPA1024_LBSPPB128_LPA0_LPB8_LRVW4_MIAV0_MIWT8_3_NTB0_NTC3_NTD3_NLCA1_SU0_SUM0_SUS0_SVW8_VWA8_VWB1_WG16_16_1_WGM1_WGMXCC1_WGMXCCGn1
    SolutionIndex: 44
    SolutionNameMin: Cijk_Ailk_Bljk_HHS_BH_Bias_AS_SAV_UserArgs_MT128x192x32_MI32x32x1_SN_GRVWB8_GSU1_GSUC0_GSUWGMRR0_K1_LBSPPA0_LBSPPB128_LPA0_LPB8_LRVW8_MIAV0_MIWT2_3_NTB0_NTC3_NTD3_NLCA1_SU0_SUM0_SUS0_SVW2_VWA2_VWB1_WG64_4_1_WGM1_WGMXCC1_WGMXCCGn1
- - - [976, 1, 1, 560]
    - [0, 0.0]
  - - [15360, 512, 1, 36]
    - [1, 0.0]
  - - [15360, 512, 1, 4608]
    - [2, 0.0]
  - - [16, 3840, 20, 64]
    - [3, 0.0]
  - - [16, 960, 40, 64]
    - [3, 0.0]
  - - [17, 16, 40, 64]
    - [4, 0.0]
  - - [245760, 256, 1, 512]
    - [5, 0.0]
  - - [512, 15360, 1, 15360]
    - [6, 0.0]
  - - [64, 16, 40, 17]
    - [7, 0.0]
  - - [64, 77, 12, 77]
    - [8, 0.0]
  - - [64, 77, 20, 77]
    - [9, 0.0]
  - - [983040, 128, 1, 256]
    - [10, 0.0]
  - - [16, 30, 1, 32]
    - [11, 0.0]
  - - [16, 200, 1, 32]
    - [12, 0.0]
  - - [32, 200, 1, 16]
    - [13, 0.0]
  - - [64, 200, 1, 384]
    - [14, 0.0]
  - - [128, 200, 1, 256]
    - [15, 0.0]
  - - [256, 200, 1, 230]
    - [16, 0.0]
  - - [16, 400, 1, 32]
    - [17, 0.0]
  - - [32, 400, 1, 16]
    - [18, 0.0]
  - - [64, 400, 1, 384]
    - [15, 0.0]
  - - [128, 400, 1, 256]
    - [19, 0.0]
  - - [256, 400, 1, 230]
    - [20, 0.0]
  - - [16, 800, 1, 32]
    - [21, 0.0]
  - - [32, 800, 1, 16]
    - [22, 0.0]
  - - [64, 800, 1, 384]
    - [23, 0.0]
  - - [128, 800, 1, 256]
    - [24, 0.0]
  - - [256, 800, 1, 230]
    - [25, 0.0]
  - - [16, 1600, 1, 32]
    - [21, 0.0]
  - - [32, 1600, 1, 16]
    - [26, 0.0]
  - - [64, 1600, 1, 384]
    - [27, 0.0]
  - - [128, 1600, 1, 256]
    - [25, 0.0]
  - - [256, 1600, 1, 230]
    - [28, 0.0]
  - - [16, 3200, 1, 32]
    - [29, 0.0]
  - - [32, 3200, 1, 16]
    - [30, 0.0]
  - - [64, 3200, 1, 384]
    - [31, 0.0]
  - - [128, 3200, 1, 256]
    - [32, 0.0]
  - - [16, 4800, 1, 32]
    - [29, 0.0]
  - - [32, 4800, 1, 16]
    - [30, 0.0]
  - - [64, 4800, 1, 384]
    - [33, 0.0]
  - - [16, 9600, 1, 32]
    - [34, 0.0]
  - - [32, 9600, 1, 16]
    - [34, 0.0]
  - - [256, 9600, 1, 230]
    - [35, 0.0]
  - - [16, 28800, 1, 32]
    - [36, 0.0]
  - - [32, 28800, 1, 16]
    - [37, 0.0]
  - - [16, 14400, 1, 32]
    - [38, 0.0]
  - - [32, 30, 1, 16]
    - [39, 0.0]
  - - [32, 14400, 1, 16]
    - [40, 0.0]
  - - [64, 14400, 1, 384]
    - [41, 0.0]
  - - [128, 14400, 1, 256]
    - [42, 0.0]
  - - [128, 28800, 1, 256]
    - [43, 0.0]
  - - [256, 14400, 1, 230]
    - [44, 0.0]
- null
- null
- DeviceEfficiency
- Equality
