library/src/amd_detail/rocblaslt/src/Tensile/Logic/asm_full/aquavanjaram/gfx942/Equality/aquavanjaram_Cijk_Ailk_Bljk_F8NF8NS_BH_BiasSH_HAS_SAB_SCD_SAV_UserArgs.yaml
- {MinimumRequiredVersion: 4.33.0}
- aquavanjaram
- gfx942
- [Device 0049, Device 0050]
    SolutionIndex: 0
    SolutionNameMin: Cijk_Ailk_Bljk_F8NF8NS_BH_BiasSH_HAS_SAB_SCD_SAV_UserArgs_MT256x256x64_MI16x16x1_SN_AFEM1_AFEM1_ASEM1_GSU1_GSUC0_GSUWGMRR0_K1_MIWT8_8_SU2_SUM0_SUS64_WGM304_WGMXCC8_WGMXCCGn1
    SolutionIndex: 1
    SolutionNameMin: Cijk_Ailk_Bljk_F8NF8NS_BH_BiasSH_HAS_SAB_SCD_SAV_UserArgs_MT128x128x128_MI16x16x1_SN_AFEM8_AFEM1_ASEM1_GSU1_GSUC0_GSUWGMRR1_K1_MIWT4_4_SU64_SUM0_SUS2048_WGM1_WGMXCC2_WGMXCCGn1
    SolutionIndex: 2
    SolutionNameMin: Cijk_Ailk_Bljk_F8NF8NS_BH_BiasSH_HAS_SAB_SCD_SAV_UserArgs_MT256x128x64_MI16x16x1_SN_AFEM16_AFEM8_ASEM32_GSU1_GSUC0_GSUWGMRR0_K1_MIWT4_8_SU8_SUM0_SUS64_WGM1_WGMXCC8_WGMXCCGn1
    SolutionIndex: 3
    SolutionNameMin: Cijk_Ailk_Bljk_F8NF8NS_BH_BiasSH_HAS_SAB_SCD_SAV_UserArgs_MT256x256x64_MI16x16x1_SN_AFEM1_AFEM1_ASEM8_GSU1_GSUC0_GSUWGMRR0_K1_MIWT8_8_SU0_SUM0_SUS0_WGM76_WGMXCC8_WGMXCCGn1
    SolutionIndex: 4
    SolutionNameMin: Cijk_Ailk_Bljk_F8NF8NS_BH_BiasSH_HAS_SAB_SCD_SAV_UserArgs_MT256x224x128_MI16x16x1_SN_AFEM8_AFEM8_ASEM32_GSU1_GSUC0_GSUWGMRR0_K1_MIWT4_14_SU2_SUM0_SUS128_WGM1_WGMXCC2_WGMXCCGn1
    SolutionIndex: 5
    SolutionNameMin: Cijk_Ailk_Bljk_F8NF8NS_BH_BiasSH_HAS_SAB_SCD_SAV_UserArgs_MT128x192x32_MI16x16x1_SN_AFEM16_AFEM8_ASEM1_GSU1_GSUC0_GSUWGMRR1_K1_LBSPPA1024_LPA64_MIWT4_6_SU2_SUM2_SUS64_WG32_8_1_WGM0_WGMXCC8_WGMXCCG0
    SolutionIndex: 6
    SolutionNameMin: Cijk_Ailk_Bljk_F8NF8NS_BH_BiasSH_HAS_SAB_SCD_SAV_UserArgs_MT64x48x256_MI16x16x1_SN_AFEM16_AFEM16_ASEM16_GSU1_GSUC1_GSUWGMRR0_K1_MIWT1_3_SU4_SUM0_SUS512_WGM16_WGMXCC16_WGMXCCG304
    SolutionIndex: 7
    SolutionNameMin: Cijk_Ailk_Bljk_F8NF8NS_BH_BiasSH_HAS_SAB_SCD_SAV_UserArgs_MT256x128x64_MI16x16x1_SN_AFEM16_AFEM1_ASEM16_GSU1_GSUC0_GSUWGMRR1_K1_MIWT4_8_SU4_SUM1_SUS128_WGM19_WGMXCC16_WGMXCCGn1
    SolutionIndex: 8
    SolutionNameMin: Cijk_Ailk_Bljk_F8NF8NS_BH_BiasSH_HAS_SAB_SCD_SAV_UserArgs_MT256x256x64_MI16x16x1_SN_AFEM1_AFEM1_ASEM16_GSU1_GSUC0_GSUWGMRR0_K1_MIWT8_8_SU4_SUM1_SUS128_WGM8_WGMXCC4_WGMXCCG152
    SolutionIndex: 9
    SolutionNameMin: Cijk_Ailk_Bljk_F8NF8NS_BH_BiasSH_HAS_SAB_SCD_SAV_UserArgs_MT256x128x64_MI16x16x1_SN_AFEM16_AFEM8_ASEM8_GSU1_GSUC0_GSUWGMRR0_K1_MIWT4_8_SU0_SUM0_SUS0_WGM8_WGMXCC4_WGMXCCG304
    SolutionIndex: 10
    SolutionNameMin: Cijk_Ailk_Bljk_F8NF8NS_BH_BiasSH_HAS_SAB_SCD_SAV_UserArgs_MT256x96x128_MI16x16x1_SN_AFEM16_AFEM16_ASEM1_GSU1_GSUC0_GSUWGMRR0_K1_MIWT4_6_SU32_SUM0_SUS256_WGM4_WGMXCC8_WGMXCCGn1
    SolutionIndex: 11
    SolutionNameMin: Cijk_Ailk_Bljk_F8NF8NS_BH_BiasSH_HAS_SAB_SCD_SAV_UserArgs_MT256x64x32_MI16x16x1_SN_AFEM1_AFEM1_ASEM1_GSU1_GSUC0_GSUWGMRR0_K1_MIWT4_4_SU4_SUM0_SUS32_WGM0_WGMXCC1_WGMXCCGn1
    SolutionIndex: 12
    SolutionNameMin: Cijk_Ailk_Bljk_F8NF8NS_BH_BiasSH_HAS_SAB_SCD_SAV_UserArgs_MT64x48x256_MI16x16x1_SN_AFEM8_AFEM1_ASEM32_GSU1_GSUC0_GSUWGMRR0_K1_MIWT1_3_SU0_SUM0_SUS0_WGM8_WGMXCC8_WGMXCCGn1
    SolutionIndex: 13
    SolutionNameMin: Cijk_Ailk_Bljk_F8NF8NS_BH_BiasSH_HAS_SAB_SCD_SAV_UserArgs_MT256x128x64_MI16x16x1_SN_AFEM16_AFEM1_ASEM32_GSU1_GSUC0_GSUWGMRR0_K1_MIWT4_8_SU0_SUM0_SUS0_WGM8_WGMXCC4_WGMXCCGn1
    SolutionIndex: 14
    SolutionNameMin: Cijk_Ailk_Bljk_F8NF8NS_BH_BiasSH_HAS_SAB_SCD_SAV_UserArgs_MT256x176x32_MI16x16x1_SN_AFEM16_AFEM16_ASEM32_GSU1_GSUC0_GSUWGMRR1_K1_MIWT4_11_SU8_SUM0_SUS512_WGM152_WGMXCC8_WGMXCCG152
    SolutionIndex: 15
    SolutionNameMin: Cijk_Ailk_Bljk_F8NF8NS_BH_BiasSH_HAS_SAB_SCD_SAV_UserArgs_MT256x128x64_MI16x16x1_SN_AFEM8_AFEM1_ASEM1_GSU1_GSUC0_GSUWGMRR0_K1_MIWT4_8_SU2_SUM0_SUS64_WGM4_WGMXCC8_WGMXCCG0
    SolutionIndex: 16
    SolutionNameMin: Cijk_Ailk_Bljk_F8NF8NS_BH_BiasSH_HAS_SAB_SCD_SAV_UserArgs_MT256x176x128_MI16x16x1_SN_AFEM16_AFEM16_ASEM16_GSU1_GSUC0_GSUWGMRR1_K1_MIWT4_11_SU16_SUM0_SUS1024_WGM304_WGMXCC4_WGMXCCG304
    SolutionIndex: 17
    SolutionNameMin: Cijk_Ailk_Bljk_F8NF8NS_BH_BiasSH_HAS_SAB_SCD_SAV_UserArgs_MT64x64x256_MI16x16x1_SN_AFEM1_AFEM1_ASEM16_GSU1_GSUC0_GSUWGMRR0_K1_MIWT2_2_SU4_SUM0_SUS256_WGM304_WGMXCC8_WGMXCCGn1
    SolutionIndex: 18
    SolutionNameMin: Cijk_Ailk_Bljk_F8NF8NS_BH_BiasSH_HAS_SAB_SCD_SAV_UserArgs_MT256x256x64_MI16x16x1_SN_AFEM1_AFEM8_ASEM8_GSU1_GSUC0_GSUWGMRR0_K1_MIWT8_8_SU2_SUM1_SUS512_WGM0_WGMXCC1_WGMXCCG0
    SolutionIndex: 19
    SolutionNameMin: Cijk_Ailk_Bljk_F8NF8NS_BH_BiasSH_HAS_SAB_SCD_SAV_UserArgs_MT16x128x256_MI16x16x1_SN_AFEM1_AFEM1_ASEM8_GSU1_GSUC0_GSUWGMRR1_K1_MIWT1_2_SU4_SUM0_SUS256_WGM4_WGMXCC16_WGMXCCG0
    SolutionIndex: 20
    SolutionNameMin: Cijk_Ailk_Bljk_F8NF8NS_BH_BiasSH_HAS_SAB_SCD_SAV_UserArgs_MT256x128x64_MI16x16x1_SN_AFEM1_AFEM8_ASEM1_GSU1_GSUC0_GSUWGMRR0_K1_MIWT4_8_SU2_SUM0_SUS256_WGM0_WGMXCC16_WGMXCCG0
    SolutionIndex: 21
    SolutionNameMin: Cijk_Ailk_Bljk_F8NF8NS_BH_BiasSH_HAS_SAB_SCD_SAV_UserArgs_MT256x176x128_MI16x16x1_SN_AFEM16_AFEM8_ASEM1_GSU1_GSUC0_GSUWGMRR0_K1_MIWT4_11_SU32_SUM2_SUS512_WGM152_WGMXCC4_WGMXCCGn1
    SolutionIndex: 22
    SolutionNameMin: Cijk_Ailk_Bljk_F8NF8NS_BH_BiasSH_HAS_SAB_SCD_SAV_UserArgs_MT256x128x64_MI16x16x1_SN_AFEM16_AFEM1_ASEM8_GSU1_GSUC0_GSUWGMRR0_K1_MIWT4_8_SU8_SUM1_SUS128_WGM16_WGMXCC16_WGMXCCG0
    SolutionIndex: 23
    SolutionNameMin: Cijk_Ailk_Bljk_F8NF8NS_BH_BiasSH_HAS_SAB_SCD_SAV_UserArgs_MT256x128x64_MI16x16x1_SN_AFEM16_AFEM1_ASEM16_GSU1_GSUC0_GSUWGMRR0_K1_MIWT4_8_SU8_SUM3_SUS256_WGM8_WGMXCC4_WGMXCCG0
    SolutionIndex: 24
    SolutionNameMin: Cijk_Ailk_Bljk_F8NF8NS_BH_BiasSH_HAS_SAB_SCD_SAV_UserArgs_MT16x64x256_MI16x16x1_SN_AFEM1_AFEM1_ASEM16_GSU1_GSUC0_GSUWGMRR1_K1_MIWT1_1_SU4_SUM0_SUS2048_WGM0_WGMXCC16_WGMXCCG304
    SolutionIndex: 25
    SolutionNameMin: Cijk_Ailk_Bljk_F8NF8NS_BH_BiasSH_HAS_SAB_SCD_SAV_UserArgs_MT256x128x64_MI16x16x1_SN_AFEM16_AFEM8_ASEM1_GSU1_GSUC0_GSUWGMRR0_K1_MIWT4_8_SU4_SUM0_SUS64_WGM1_WGMXCC1_WGMXCCG152
    SolutionIndex: 26
    SolutionNameMin: Cijk_Ailk_Bljk_F8NF8NS_BH_BiasSH_HAS_SAB_SCD_SAV_UserArgs_MT256x128x64_MI16x16x1_SN_AFEM16_AFEM16_ASEM1_GSU1_GSUC0_GSUWGMRR0_K1_MIWT4_8_SU4_SUM0_SUS64_WGM38_WGMXCC4_WGMXCCG0
    SolutionIndex: 27
    SolutionNameMin: Cijk_Ailk_Bljk_F8NF8NS_BH_BiasSH_HAS_SAB_SCD_SAV_UserArgs_MT256x256x64_MI16x16x1_SN_AFEM8_AFEM8_ASEM16_GSU1_GSUC0_GSUWGMRR0_K1_MIWT8_8_SU8_SUM2_SUS512_WGM16_WGMXCC4_WGMXCCG0
    SolutionIndex: 28
    SolutionNameMin: Cijk_Ailk_Bljk_F8NF8NS_BH_BiasSH_HAS_SAB_SCD_SAV_UserArgs_MT256x128x64_MI16x16x1_SN_AFEM1_AFEM1_ASEM1_GSU1_GSUC0_GSUWGMRR0_K1_MIWT4_8_SU2_SUM0_SUS64_WGM304_WGMXCC4_WGMXCCG0
    SolutionIndex: 29
    SolutionNameMin: Cijk_Ailk_Bljk_F8NF8NS_BH_BiasSH_HAS_SAB_SCD_SAV_UserArgs_MT256x176x128_MI16x16x1_SN_AFEM16_AFEM8_ASEM32_GSU1_GSUC0_GSUWGMRR0_K1_MIWT4_11_SU2_SUM1_SUS128_WGM16_WGMXCC8_WGMXCCGn1
    SolutionIndex: 30
    SolutionNameMin: Cijk_Ailk_Bljk_F8NF8NS_BH_BiasSH_HAS_SAB_SCD_SAV_UserArgs_MT256x128x64_MI16x16x1_SN_AFEM16_AFEM1_ASEM1_GSU1_GSUC0_GSUWGMRR1_K1_MIWT4_8_SU8_SUM0_SUS128_WGM76_WGMXCC2_WGMXCCG0
    SolutionIndex: 31
    SolutionNameMin: Cijk_Ailk_Bljk_F8NF8NS_BH_BiasSH_HAS_SAB_SCD_SAV_UserArgs_MT256x128x64_MI16x16x1_SN_AFEM16_AFEM1_ASEM8_GSU1_GSUC1_GSUWGMRR1_K1_MIWT4_8_SU0_SUM0_SUS0_WGM1_WGMXCC8_WGMXCCGn1
    SolutionIndex: 32
    SolutionNameMin: Cijk_Ailk_Bljk_F8NF8NS_BH_BiasSH_HAS_SAB_SCD_SAV_UserArgs_MT64x48x256_MI16x16x1_SN_AFEM16_AFEM8_ASEM16_GSU1_GSUC0_GSUWGMRR0_K1_MIWT1_3_SU8_SUM0_SUS256_WGM1_WGMXCC16_WGMXCCG304
    SolutionIndex: 33
    SolutionNameMin: Cijk_Ailk_Bljk_F8NF8NS_BH_BiasSH_HAS_SAB_SCD_SAV_UserArgs_MT64x32x256_MI16x16x1_SN_AFEM1_AFEM16_ASEM1_GSU1_GSUC0_GSUWGMRR0_K1_MIWT2_1_SU4_SUM0_SUS256_WGM304_WGMXCC4_WGMXCCG304
    SolutionIndex: 34
    SolutionNameMin: Cijk_Ailk_Bljk_F8NF8NS_BH_BiasSH_HAS_SAB_SCD_SAV_UserArgs_MT64x48x256_MI16x16x1_SN_AFEM1_AFEM1_ASEM1_GSU1_GSUC0_GSUWGMRR0_K1_MIWT1_3_SU2_SUM1_SUS256_WGM4_WGMXCC8_WGMXCCG0
    SolutionIndex: 35
    SolutionNameMin: Cijk_Ailk_Bljk_F8NF8NS_BH_BiasSH_HAS_SAB_SCD_SAV_UserArgs_MT256x160x32_MI16x16x1_SN_AFEM8_AFEM16_ASEM16_GSU1_GSUC0_GSUWGMRR1_K1_MIWT4_10_SU2_SUM1_SUS64_WGM152_WGMXCC2_WGMXCCG0
    SolutionIndex: 36
    SolutionNameMin: Cijk_Ailk_Bljk_F8NF8NS_BH_BiasSH_HAS_SAB_SCD_SAV_UserArgs_MT16x64x128_MI16x16x1_SN_AFEM1_AFEM16_ASEM16_GSU1_GSUC0_GSUWGMRR1_K1_MIWT1_1_SU16_SUM0_SUS128_WGM1_WGMXCC16_WGMXCCG0
    SolutionIndex: 37
    SolutionNameMin: Cijk_Ailk_Bljk_F8NF8NS_BH_BiasSH_HAS_SAB_SCD_SAV_UserArgs_MT256x176x128_MI16x16x1_SN_AFEM1_AFEM1_ASEM1_GSU1_GSUC0_GSUWGMRR0_K1_MIWT4_11_SU0_SUM0_SUS0_WGM16_WGMXCC8_WGMXCCGn1
    SolutionIndex: 38
    SolutionNameMin: Cijk_Ailk_Bljk_F8NF8NS_BH_BiasSH_HAS_SAB_SCD_SAV_UserArgs_MT256x256x32_MI16x16x1_SN_AFEM8_AFEM16_ASEM1_GSU1_GSUC0_GSUWGMRR0_K1_MIWT8_8_SU2_SUM4_SUS64_WGM1_WGMXCC2_WGMXCCG0
    SolutionIndex: 39
    SolutionNameMin: Cijk_Ailk_Bljk_F8NF8NS_BH_BiasSH_HAS_SAB_SCD_SAV_UserArgs_MT128x128x128_MI16x16x1_SN_AFEM1_AFEM1_ASEM8_GSU1_GSUC0_GSUWGMRR0_K1_MIWT4_4_SU2_SUM3_SUS512_WGM16_WGMXCC8_WGMXCCG152
    SolutionIndex: 40
    SolutionNameMin: Cijk_Ailk_Bljk_F8NF8NS_BH_BiasSH_HAS_SAB_SCD_SAV_UserArgs_MT256x256x32_MI16x16x1_SN_AFEM16_AFEM1_ASEM32_GSU1_GSUC1_GSUWGMRR0_K1_MIWT8_8_SU16_SUM0_SUS32_WGM19_WGMXCC16_WGMXCCG0
    SolutionIndex: 41
    SolutionNameMin: Cijk_Ailk_Bljk_F8NF8NS_BH_BiasSH_HAS_SAB_SCD_SAV_UserArgs_MT256x176x32_MI16x16x1_SN_AFEM1_AFEM16_ASEM1_GSU1_GSUC0_GSUWGMRR0_K1_MIWT4_11_SU2_SUM1_SUS256_WGM8_WGMXCC8_WGMXCCG0
    SolutionIndex: 42
    SolutionNameMin: Cijk_Ailk_Bljk_F8NF8NS_BH_BiasSH_HAS_SAB_SCD_SAV_UserArgs_MT256x128x64_MI16x16x1_SN_AFEM8_AFEM16_ASEM32_GSU1_GSUC1_GSUWGMRR1_K1_MIWT4_8_SU16_SUM0_SUS64_WGM152_WGMXCC4_WGMXCCG76
    SolutionIndex: 43
    SolutionNameMin: Cijk_Ailk_Bljk_F8NF8NS_BH_BiasSH_HAS_SAB_SCD_SAV_UserArgs_MT128x128x64_MI32x32x1_SN_AFEM1_AFEM1_ASEM1_GSU1_GSUC1_GSUWGMRR1_K1_LBSPPA0_LPA0_LPB16_LRVW16_MIWT2_2_SU4_SUM4_SUS2048_WG64_4_1_WGM1_WGMXCC1_WGMXCCGn1
    SolutionIndex: 44
    SolutionNameMin: Cijk_Ailk_Bljk_F8NF8NS_BH_BiasSH_HAS_SAB_SCD_SAV_UserArgs_MT256x256x64_MI16x16x1_SN_AFEM16_AFEM1_ASEM32_GSU1_GSUC0_GSUWGMRR0_K1_MIWT8_8_SU8_SUM0_SUS64_WGM19_WGMXCC2_WGMXCCGn1
    SolutionIndex: 45
    SolutionNameMin: Cijk_Ailk_Bljk_F8NF8NS_BH_BiasSH_HAS_SAB_SCD_SAV_UserArgs_MT256x224x128_MI16x16x1_SN_AFEM16_AFEM1_ASEM1_GSU1_GSUC0_GSUWGMRR0_K1_MIWT4_14_SU16_SUM3_SUS256_WGM1_WGMXCC8_WGMXCCGn1
    SolutionIndex: 46
    SolutionNameMin: Cijk_Ailk_Bljk_F8NF8NS_BH_BiasSH_HAS_SAB_SCD_SAV_UserArgs_MT256x176x64_MI16x16x1_SN_AFEM16_AFEM1_ASEM32_GSU1_GSUC0_GSUWGMRR0_K1_MIWT4_11_SU2_SUM0_SUS1024_WGM1_WGMXCC1_WGMXCCGn1
    SolutionIndex: 47
    SolutionNameMin: Cijk_Ailk_Bljk_F8NF8NS_BH_BiasSH_HAS_SAB_SCD_SAV_UserArgs_MT256x128x64_MI16x16x1_SN_AFEM8_AFEM8_ASEM8_GSU1_GSUC0_GSUWGMRR0_K1_MIWT4_8_SU8_SUM4_SUS512_WGM152_WGMXCC1_WGMXCCGn1
    SolutionIndex: 48
    SolutionNameMin: Cijk_Ailk_Bljk_F8NF8NS_BH_BiasSH_HAS_SAB_SCD_SAV_UserArgs_MT256x256x64_MI16x16x1_SN_AFEM8_AFEM1_ASEM16_GSU1_GSUC0_GSUWGMRR0_K1_MIWT8_8_SU64_SUM0_SUS64_WGM304_WGMXCC2_WGMXCCGn1
    SolutionIndex: 49
    SolutionNameMin: Cijk_Ailk_Bljk_F8NF8NS_BH_BiasSH_HAS_SAB_SCD_SAV_UserArgs_MT256x176x64_MI16x16x1_SN_AFEM16_AFEM1_ASEM1_GSU1_GSUC0_GSUWGMRR0_K1_MIWT4_11_SU2_SUM0_SUS1024_WGM38_WGMXCC8_WGMXCCG304
    SolutionIndex: 50
    SolutionNameMin: Cijk_Ailk_Bljk_F8NF8NS_BH_BiasSH_HAS_SAB_SCD_SAV_UserArgs_MT16x64x128_MI16x16x1_SN_AFEM1_AFEM1_ASEM16_GSU1_GSUC0_GSUWGMRR1_K1_MIWT1_1_SU32_SUM0_SUS128_WGM0_WGMXCC16_WGMXCCG0
    SolutionIndex: 51
    SolutionNameMin: Cijk_Ailk_Bljk_F8NF8NS_BH_BiasSH_HAS_SAB_SCD_SAV_UserArgs_MT256x208x128_MI16x16x1_SN_AFEM8_AFEM8_ASEM32_GSU1_GSUC0_GSUWGMRR1_K1_MIWT4_13_SU8_SUM1_SUS256_WGM304_WGMXCC4_WGMXCCGn1
    SolutionIndex: 52
    SolutionNameMin: Cijk_Ailk_Bljk_F8NF8NS_BH_BiasSH_HAS_SAB_SCD_SAV_UserArgs_MT16x64x256_MI16x16x1_SN_AFEM1_AFEM1_ASEM32_GSU1_GSUC0_GSUWGMRR0_K1_MIWT1_1_SU64_SUM0_SUS512_WGM19_WGMXCC1_WGMXCCG0
    SolutionIndex: 53
    SolutionNameMin: Cijk_Ailk_Bljk_F8NF8NS_BH_BiasSH_HAS_SAB_SCD_SAV_UserArgs_MT256x256x64_MI16x16x1_SN_AFEM16_AFEM8_ASEM32_GSU1_GSUC0_GSUWGMRR0_K1_MIWT8_8_SU16_SUM0_SUS64_WGM76_WGMXCC4_WGMXCCG0
    SolutionIndex: 54
    SolutionNameMin: Cijk_Ailk_Bljk_F8NF8NS_BH_BiasSH_HAS_SAB_SCD_SAV_UserArgs_MT128x96x128_MI16x16x1_SN_AFEM1_AFEM16_ASEM8_GSU1_GSUC0_GSUWGMRR0_K1_MIWT2_6_SU16_SUM1_SUS2048_WGM1_WGMXCC1_WGMXCCG0
    SolutionIndex: 55
    SolutionNameMin: Cijk_Ailk_Bljk_F8NF8NS_BH_BiasSH_HAS_SAB_SCD_SAV_UserArgs_MT16x64x256_MI16x16x1_SN_AFEM1_AFEM1_ASEM1_GSU1_GSUC0_GSUWGMRR1_K1_MIWT1_1_SU8_SUM0_SUS1024_WGM1_WGMXCC1_WGMXCCG2
    SolutionIndex: 56
    SolutionNameMin: Cijk_Ailk_Bljk_F8NF8NS_BH_BiasSH_HAS_SAB_SCD_SAV_UserArgs_MT256x128x64_MI16x16x1_SN_AFEM16_AFEM1_ASEM32_GSU1_GSUC0_GSUWGMRR0_K1_MIWT4_8_SU2_SUM0_SUS64_WGM2_WGMXCC1_WGMXCCGn1
    SolutionIndex: 57
    SolutionNameMin: Cijk_Ailk_Bljk_F8NF8NS_BH_BiasSH_HAS_SAB_SCD_SAV_UserArgs_MT256x224x128_MI16x16x1_SN_AFEM8_AFEM8_ASEM8_GSU1_GSUC0_GSUWGMRR0_K1_MIWT4_14_SU16_SUM0_SUS128_WGM16_WGMXCC1_WGMXCCG4
    SolutionIndex: 58
    SolutionNameMin: Cijk_Ailk_Bljk_F8NF8NS_BH_BiasSH_HAS_SAB_SCD_SAV_UserArgs_MT256x128x64_MI16x16x1_SN_AFEM16_AFEM1_ASEM1_GSU1_GSUC0_GSUWGMRR0_K1_MIWT4_8_SU2_SUM0_SUS64_WGM0_WGMXCC16_WGMXCCG0
    SolutionIndex: 59
    SolutionNameMin: Cijk_Ailk_Bljk_F8NF8NS_BH_BiasSH_HAS_SAB_SCD_SAV_UserArgs_MT256x224x128_MI16x16x1_SN_AFEM16_AFEM16_ASEM16_GSU1_GSUC0_GSUWGMRR0_K1_MIWT4_14_SU16_SUM0_SUS512_WGM16_WGMXCC1_WGMXCCG76
    SolutionIndex: 60
    SolutionNameMin: Cijk_Ailk_Bljk_F8NF8NS_BH_BiasSH_HAS_SAB_SCD_SAV_UserArgs_MT256x256x64_MI16x16x1_SN_AFEM1_AFEM1_ASEM1_GSU1_GSUC0_GSUWGMRR1_K1_MIWT8_8_SU64_SUM0_SUS64_WGM4_WGMXCC8_WGMXCCGn1
    SolutionIndex: 61
    SolutionNameMin: Cijk_Ailk_Bljk_F8NF8NS_BH_BiasSH_HAS_SAB_SCD_SAV_UserArgs_MT256x256x64_MI32x32x1_SN_AFEM1_AFEM1_ASEM8_GRVWB16_GSU1_GSUC0_GSUWGMRR0_K1_LBSPPA0_LPA0_LPB16_LRVW16_MIWT4_4_SU16_SUM2_SUS2048_WG64_4_1_WGM76_WGMXCC8_WGMXCCG16
    SolutionIndex: 62
    SolutionNameMin: Cijk_Ailk_Bljk_F8NF8NS_BH_BiasSH_HAS_SAB_SCD_SAV_UserArgs_MT256x128x128_MI16x16x1_SN_AFEM8_AFEM1_ASEM1_GSU1_GSUC0_GSUWGMRR0_K1_MIWT4_8_SU32_SUM0_SUS128_WGM8_WGMXCC4_WGMXCCGn1
    SolutionIndex: 63
    SolutionNameMin: Cijk_Ailk_Bljk_F8NF8NS_BH_BiasSH_HAS_SAB_SCD_SAV_UserArgs_MT128x128x128_MI16x16x1_SN_AFEM8_AFEM8_ASEM8_GSU1_GSUC0_GSUWGMRR0_K1_MIWT4_4_SU8_SUM0_SUS128_WGM19_WGMXCC4_WGMXCCGn1
    SolutionIndex: 64
    SolutionNameMin: Cijk_Ailk_Bljk_F8NF8NS_BH_BiasSH_HAS_SAB_SCD_SAV_UserArgs_MT256x176x128_MI16x16x1_SN_AFEM1_AFEM16_ASEM16_GSU1_GSUC0_GSUWGMRR0_K1_MIWT4_11_SU0_SUM0_SUS0_WGM38_WGMXCC8_WGMXCCG304
    SolutionIndex: 65
    SolutionNameMin: Cijk_Ailk_Bljk_F8NF8NS_BH_BiasSH_HAS_SAB_SCD_SAV_UserArgs_MT256x256x64_MI16x16x1_SN_AFEM16_AFEM8_ASEM8_GSU1_GSUC0_GSUWGMRR0_K1_MIWT8_8_SU64_SUM2_SUS128_WGM4_WGMXCC8_WGMXCCG152
    SolutionIndex: 66
    SolutionNameMin: Cijk_Ailk_Bljk_F8NF8NS_BH_BiasSH_HAS_SAB_SCD_SAV_UserArgs_MT256x192x32_MI32x32x1_SN_AFEM16_AFEM16_ASEM1_GRVWB8_GSU1_GSUC0_GSUWGMRR0_K1_LBSPPA0_LPA0_MIWT4_3_SU8_SUM4_SUS32_WG64_4_1_WGM0_WGMXCC8_WGMXCCG152
    SolutionIndex: 67
    SolutionNameMin: Cijk_Ailk_Bljk_F8NF8NS_BH_BiasSH_HAS_SAB_SCD_SAV_UserArgs_MT256x112x128_MI16x16x1_SN_AFEM16_AFEM16_ASEM16_GSU1_GSUC1_GSUWGMRR1_K1_MIWT4_7_SU4_SUM2_SUS128_WGM4_WGMXCC2_WGMXCCGn1
    SolutionIndex: 68
    SolutionNameMin: Cijk_Ailk_Bljk_F8NF8NS_BH_BiasSH_HAS_SAB_SCD_SAV_UserArgs_MT256x256x64_MI16x16x1_SN_AFEM16_AFEM8_ASEM1_GSU1_GSUC0_GSUWGMRR1_K1_MIWT8_8_SU32_SUM0_SUS1024_WGM152_WGMXCC1_WGMXCCGn1
    SolutionIndex: 69
    SolutionNameMin: Cijk_Ailk_Bljk_F8NF8NS_BH_BiasSH_HAS_SAB_SCD_SAV_UserArgs_MT256x176x128_MI16x16x1_SN_AFEM1_AFEM1_ASEM1_GSU1_GSUC0_GSUWGMRR0_K1_MIWT4_11_SU0_SUM0_SUS0_WGM8_WGMXCC8_WGMXCCGn1
    SolutionIndex: 70
    SolutionNameMin: Cijk_Ailk_Bljk_F8NF8NS_BH_BiasSH_HAS_SAB_SCD_SAV_UserArgs_MT32x32x256_MI16x16x1_SN_AFEM16_AFEM1_ASEM8_GSU1_GSUC1_GSUWGMRR1_K1_LBSPPA512_LPA16_LPB32_MIWT1_1_SU4_SUM1_SUS256_WG32_8_1_WGM16_WGMXCC4_WGMXCCG0
    SolutionIndex: 71
    SolutionNameMin: Cijk_Ailk_Bljk_F8NF8NS_BH_BiasSH_HAS_SAB_SCD_SAV_UserArgs_MT256x128x64_MI16x16x1_SN_AFEM8_AFEM1_ASEM8_GSU1_GSUC0_GSUWGMRR0_K1_MIWT4_8_SU64_SUM0_SUS64_WGM16_WGMXCC2_WGMXCCGn1
    SolutionIndex: 72
    SolutionNameMin: Cijk_Ailk_Bljk_F8NF8NS_BH_BiasSH_HAS_SAB_SCD_SAV_UserArgs_MT256x128x64_MI16x16x1_SN_AFEM16_AFEM16_ASEM1_GSU1_GSUC0_GSUWGMRR1_K1_MIWT4_8_SU2_SUM4_SUS128_WGM16_WGMXCC8_WGMXCCG0
    SolutionIndex: 73
    SolutionNameMin: Cijk_Ailk_Bljk_F8NF8NS_BH_BiasSH_HAS_SAB_SCD_SAV_UserArgs_MT256x176x32_MI16x16x1_SN_AFEM16_AFEM16_ASEM1_GSU1_GSUC0_GSUWGMRR0_K1_MIWT4_11_SU2_SUM0_SUS1024_WGM1_WGMXCC8_WGMXCCG0
    SolutionIndex: 74
    SolutionNameMin: Cijk_Ailk_Bljk_F8NF8NS_BH_BiasSH_HAS_SAB_SCD_SAV_UserArgs_MT256x128x128_MI16x16x1_SN_AFEM8_AFEM8_ASEM1_GSU1_GSUC0_GSUWGMRR1_K1_MIWT4_8_SU8_SUM4_SUS1024_WGM19_WGMXCC8_WGMXCCG0
    SolutionIndex: 75
    SolutionNameMin: Cijk_Ailk_Bljk_F8NF8NS_BH_BiasSH_HAS_SAB_SCD_SAV_UserArgs_MT256x256x64_MI16x16x1_SN_AFEM8_AFEM16_ASEM1_GSU1_GSUC0_GSUWGMRR1_K1_MIWT8_8_SU8_SUM2_SUS128_WGM16_WGMXCC2_WGMXCCG0
    SolutionIndex: 76
    SolutionNameMin: Cijk_Ailk_Bljk_F8NF8NS_BH_BiasSH_HAS_SAB_SCD_SAV_UserArgs_MT128x64x128_MI16x16x1_SN_AFEM1_AFEM1_ASEM1_GSU1_GSUC0_GSUWGMRR0_K1_LBSPPA2048_LPA64_LPB32_MIWT4_2_SU4_SUM0_SUS128_WG32_8_1_WGM0_WGMXCC1_WGMXCCGn1
    SolutionIndex: 77
    SolutionNameMin: Cijk_Ailk_Bljk_F8NF8NS_BH_BiasSH_HAS_SAB_SCD_SAV_UserArgs_MT256x176x128_MI16x16x1_SN_AFEM16_AFEM16_ASEM32_GSU1_GSUC0_GSUWGMRR0_K1_MIWT4_11_SU16_SUM1_SUS2048_WGM1_WGMXCC2_WGMXCCG8
    SolutionIndex: 78
    SolutionNameMin: Cijk_Ailk_Bljk_F8NF8NS_BH_BiasSH_HAS_SAB_SCD_SAV_UserArgs_MT128x192x128_MI16x16x1_SN_AFEM8_AFEM8_ASEM8_GSU1_GSUC0_GSUWGMRR0_K1_MIWT4_6_SU4_SUM0_SUS256_WGM4_WGMXCC8_WGMXCCGn1
    SolutionIndex: 79
    SolutionNameMin: Cijk_Ailk_Bljk_F8NF8NS_BH_BiasSH_HAS_SAB_SCD_SAV_UserArgs_MT256x224x128_MI16x16x1_SN_AFEM8_AFEM8_ASEM1_GSU1_GSUC0_GSUWGMRR0_K1_MIWT4_14_SU32_SUM0_SUS256_WGM16_WGMXCC1_WGMXCCGn1
    SolutionIndex: 80
    SolutionNameMin: Cijk_Ailk_Bljk_F8NF8NS_BH_BiasSH_HAS_SAB_SCD_SAV_UserArgs_MT128x128x64_MI32x32x1_SN_AFEM8_AFEM1_ASEM1_GSU1_GSUC0_GSUWGMRR0_K1_LBSPPA0_LPA0_LPB16_LRVW16_MIWT2_2_SU16_SUM0_SUS64_WG64_4_1_WGM8_WGMXCC16_WGMXCCG0
    SolutionIndex: 81
    SolutionNameMin: Cijk_Ailk_Bljk_F8NF8NS_BH_BiasSH_HAS_SAB_SCD_SAV_UserArgs_MT128x48x256_MI16x16x1_SN_AFEM1_AFEM1_ASEM16_GSU1_GSUC1_GSUWGMRR1_K1_MIWT2_3_SU2_SUM1_SUS256_WGM16_WGMXCC8_WGMXCCGn1
    SolutionIndex: 82
    SolutionNameMin: Cijk_Ailk_Bljk_F8NF8NS_BH_BiasSH_HAS_SAB_SCD_SAV_UserArgs_MT256x128x32_MI16x16x1_SN_AFEM16_AFEM1_ASEM1_GSU1_GSUC0_GSUWGMRR0_K1_MIWT8_4_SU8_SUM0_SUS32_WGM304_WGMXCC2_WGMXCCG16
    SolutionIndex: 83
    SolutionNameMin: Cijk_Ailk_Bljk_F8NF8NS_BH_BiasSH_HAS_SAB_SCD_SAV_UserArgs_MT256x128x64_MI16x16x1_SN_AFEM16_AFEM1_ASEM16_GSU1_GSUC0_GSUWGMRR0_K1_MIWT4_8_SU2_SUM0_SUS64_WGM152_WGMXCC2_WGMXCCG2
    SolutionIndex: 84
    SolutionNameMin: Cijk_Ailk_Bljk_F8NF8NS_BH_BiasSH_HAS_SAB_SCD_SAV_UserArgs_MT256x64x128_MI16x16x1_SN_AFEM8_AFEM8_ASEM16_GSU1_GSUC0_GSUWGMRR0_K1_MIWT4_4_SU32_SUM2_SUS128_WGM304_WGMXCC1_WGMXCCG2
    SolutionIndex: 85
    SolutionNameMin: Cijk_Ailk_Bljk_F8NF8NS_BH_BiasSH_HAS_SAB_SCD_SAV_UserArgs_MT256x64x32_MI16x16x1_SN_AFEM16_AFEM1_ASEM32_GSU1_GSUC0_GSUWGMRR1_K1_MIWT4_4_SU2_SUM0_SUS32_WGM1_WGMXCC1_WGMXCCGn1
    SolutionIndex: 86
    SolutionNameMin: Cijk_Ailk_Bljk_F8NF8NS_BH_BiasSH_HAS_SAB_SCD_SAV_UserArgs_MT128x64x128_MI16x16x1_SN_AFEM8_AFEM1_ASEM1_GSU1_GSUC0_GSUWGMRR0_K1_LBSPPA2048_LPA64_LPB32_MIWT4_2_SU4_SUM2_SUS256_WG32_8_1_WGM4_WGMXCC1_WGMXCCG0
    SolutionIndex: 87
    SolutionNameMin: Cijk_Ailk_Bljk_F8NF8NS_BH_BiasSH_HAS_SAB_SCD_SAV_UserArgs_MT256x176x128_MI16x16x1_SN_AFEM16_AFEM16_ASEM8_GSU1_GSUC0_GSUWGMRR1_K1_MIWT4_11_SU8_SUM2_SUS1024_WGM19_WGMXCC4_WGMXCCGn1
    SolutionIndex: 88
    SolutionNameMin: Cijk_Ailk_Bljk_F8NF8NS_BH_BiasSH_HAS_SAB_SCD_SAV_UserArgs_MT64x64x256_MI16x16x1_SN_AFEM8_AFEM8_ASEM16_GSU1_GSUC0_GSUWGMRR1_K1_MIWT2_2_SU4_SUM3_SUS256_WGM304_WGMXCC4_WGMXCCG8
    SolutionIndex: 89
    SolutionNameMin: Cijk_Ailk_Bljk_F8NF8NS_BH_BiasSH_HAS_SAB_SCD_SAV_UserArgs_MT256x256x64_MI16x16x1_SN_AFEM8_AFEM1_ASEM8_GSU1_GSUC0_GSUWGMRR0_K1_MIWT8_8_SU4_SUM0_SUS128_WGM0_WGMXCC1_WGMXCCGn1
    SolutionIndex: 90
    SolutionNameMin: Cijk_Ailk_Bljk_F8NF8NS_BH_BiasSH_HAS_SAB_SCD_SAV_UserArgs_MT256x176x32_MI16x16x1_SN_AFEM1_AFEM1_ASEM16_GSU1_GSUC0_GSUWGMRR0_K1_MIWT4_11_SU8_SUM3_SUS32_WGM8_WGMXCC8_WGMXCCGn1
    SolutionIndex: 91
    SolutionNameMin: Cijk_Ailk_Bljk_F8NF8NS_BH_BiasSH_HAS_SAB_SCD_SAV_UserArgs_MT256x64x32_MI16x16x1_SN_AFEM1_AFEM8_ASEM32_GSU1_GSUC1_GSUWGMRR0_K1_MIWT4_4_SU2_SUM1_SUS32_WGM304_WGMXCC8_WGMXCCG16
    SolutionIndex: 92
    SolutionNameMin: Cijk_Ailk_Bljk_F8NF8NS_BH_BiasSH_HAS_SAB_SCD_SAV_UserArgs_MT256x128x64_MI16x16x1_SN_AFEM16_AFEM8_ASEM16_GSU1_GSUC1_GSUWGMRR0_K1_MIWT4_8_SU16_SUM0_SUS256_WGM2_WGMXCC2_WGMXCCGn1
    SolutionIndex: 93
    SolutionNameMin: Cijk_Ailk_Bljk_F8NF8NS_BH_BiasSH_HAS_SAB_SCD_SAV_UserArgs_MT256x176x32_MI16x16x1_SN_AFEM8_AFEM8_ASEM1_GSU1_GSUC0_GSUWGMRR1_K1_MIWT4_11_SU2_SUM3_SUS256_WGM76_WGMXCC8_WGMXCCGn1
    SolutionIndex: 94
    SolutionNameMin: Cijk_Ailk_Bljk_F8NF8NS_BH_BiasSH_HAS_SAB_SCD_SAV_UserArgs_MT256x176x32_MI16x16x1_SN_AFEM1_AFEM1_ASEM32_GSU1_GSUC0_GSUWGMRR1_K1_MIWT4_11_SU16_SUM0_SUS32_WGM4_WGMXCC8_WGMXCCG0
    SolutionIndex: 95
    SolutionNameMin: Cijk_Ailk_Bljk_F8NF8NS_BH_BiasSH_HAS_SAB_SCD_SAV_UserArgs_MT256x192x32_MI16x16x1_SN_AFEM1_AFEM1_ASEM1_GSU1_GSUC1_GSUWGMRR0_K1_MIWT8_6_SU4_SUM0_SUS32_WGM38_WGMXCC8_WGMXCCG0
    SolutionIndex: 96
    SolutionNameMin: Cijk_Ailk_Bljk_F8NF8NS_BH_BiasSH_HAS_SAB_SCD_SAV_UserArgs_MT256x128x64_MI16x16x1_SN_AFEM8_AFEM1_ASEM1_GSU1_GSUC0_GSUWGMRR1_K1_MIWT4_8_SU16_SUM1_SUS128_WGM304_WGMXCC1_WGMXCCG0
    SolutionIndex: 97
    SolutionNameMin: Cijk_Ailk_Bljk_F8NF8NS_BH_BiasSH_HAS_SAB_SCD_SAV_UserArgs_MT256x224x128_MI16x16x1_SN_AFEM8_AFEM1_ASEM32_GSU1_GSUC0_GSUWGMRR0_K1_MIWT4_14_SU8_SUM1_SUS128_WGM304_WGMXCC8_WGMXCCG0
    SolutionIndex: 98
    SolutionNameMin: Cijk_Ailk_Bljk_F8NF8NS_BH_BiasSH_HAS_SAB_SCD_SAV_UserArgs_MT128x128x128_MI16x16x1_SN_AFEM1_AFEM1_ASEM8_GSU1_GSUC0_GSUWGMRR0_K1_MIWT4_4_SU4_SUM1_SUS1024_WGM0_WGMXCC1_WGMXCCG76
    SolutionIndex: 99
    SolutionNameMin: Cijk_Ailk_Bljk_F8NF8NS_BH_BiasSH_HAS_SAB_SCD_SAV_UserArgs_MT256x128x64_MI16x16x1_SN_AFEM8_AFEM8_ASEM16_GSU1_GSUC0_GSUWGMRR0_K1_MIWT4_8_SU8_SUM1_SUS128_WGM2_WGMXCC16_WGMXCCG304
    SolutionIndex: 100
    SolutionNameMin: Cijk_Ailk_Bljk_F8NF8NS_BH_BiasSH_HAS_SAB_SCD_SAV_UserArgs_MT64x96x256_MI16x16x1_SN_AFEM16_AFEM16_ASEM16_GSU1_GSUC0_GSUWGMRR0_K1_MIWT2_3_SU2_SUM2_SUS256_WGM0_WGMXCC8_WGMXCCGn1
    SolutionIndex: 101
    SolutionNameMin: Cijk_Ailk_Bljk_F8NF8NS_BH_BiasSH_HAS_SAB_SCD_SAV_UserArgs_MT64x48x256_MI16x16x1_SN_AFEM16_AFEM16_ASEM32_GSU1_GSUC0_GSUWGMRR0_K1_MIWT1_3_SU2_SUM0_SUS512_WGM76_WGMXCC8_WGMXCCGn1
    SolutionIndex: 102
    SolutionNameMin: Cijk_Ailk_Bljk_F8NF8NS_BH_BiasSH_HAS_SAB_SCD_SAV_UserArgs_MT256x256x64_MI16x16x1_SN_AFEM1_AFEM1_ASEM16_GSU1_GSUC1_GSUWGMRR0_K1_MIWT8_8_SU16_SUM0_SUS64_WGM0_WGMXCC4_WGMXCCGn1
    SolutionIndex: 103
    SolutionNameMin: Cijk_Ailk_Bljk_F8NF8NS_BH_BiasSH_HAS_SAB_SCD_SAV_UserArgs_MT256x256x64_MI16x16x1_SN_AFEM16_AFEM1_ASEM1_GSU1_GSUC0_GSUWGMRR0_K1_MIWT8_8_SU4_SUM2_SUS64_WGM4_WGMXCC16_WGMXCCG0
    SolutionIndex: 104
    SolutionNameMin: Cijk_Ailk_Bljk_F8NF8NS_BH_BiasSH_HAS_SAB_SCD_SAV_UserArgs_MT256x128x64_MI16x16x1_SN_AFEM16_AFEM16_ASEM1_GSU1_GSUC0_GSUWGMRR0_K1_MIWT4_8_SU2_SUM0_SUS64_WGM19_WGMXCC8_WGMXCCGn1
    SolutionIndex: 105
    SolutionNameMin: Cijk_Ailk_Bljk_F8NF8NS_BH_BiasSH_HAS_SAB_SCD_SAV_UserArgs_MT256x128x64_MI16x16x1_SN_AFEM1_AFEM16_ASEM1_GSU1_GSUC0_GSUWGMRR0_K1_MIWT4_8_SU4_SUM0_SUS1024_WGM0_WGMXCC1_WGMXCCG8
    SolutionIndex: 106
    SolutionNameMin: Cijk_Ailk_Bljk_F8NF8NS_BH_BiasSH_HAS_SAB_SCD_SAV_UserArgs_MT256x128x128_MI32x32x1_SN_AFEM1_AFEM16_ASEM8_GSU1_GSUC0_GSUWGMRR0_K1_LBSPPA0_LPA0_LPB16_MIWT4_2_SU2_SUM4_SUS1024_WG64_4_1_WGM19_WGMXCC8_WGMXCCG0
    SolutionIndex: 107
    SolutionNameMin: Cijk_Ailk_Bljk_F8NF8NS_BH_BiasSH_HAS_SAB_SCD_SAV_UserArgs_MT128x96x128_MI16x16x1_SN_AFEM8_AFEM1_ASEM16_GSU1_GSUC0_GSUWGMRR0_K1_MIWT2_6_SU8_SUM1_SUS2048_WGM304_WGMXCC8_WGMXCCG152
    SolutionIndex: 108
    SolutionNameMin: Cijk_Ailk_Bljk_F8NF8NS_BH_BiasSH_HAS_SAB_SCD_SAV_UserArgs_MT256x224x128_MI16x16x1_SN_AFEM8_AFEM1_ASEM32_GSU1_GSUC0_GSUWGMRR0_K1_MIWT4_14_SU2_SUM0_SUS128_WGM4_WGMXCC8_WGMXCCGn1
    SolutionIndex: 109
    SolutionNameMin: Cijk_Ailk_Bljk_F8NF8NS_BH_BiasSH_HAS_SAB_SCD_SAV_UserArgs_MT256x96x128_MI16x16x1_SN_AFEM8_AFEM1_ASEM8_GSU1_GSUC0_GSUWGMRR0_K1_MIWT4_6_SU16_SUM2_SUS512_WGM152_WGMXCC16_WGMXCCG0
    SolutionIndex: 110
    SolutionNameMin: Cijk_Ailk_Bljk_F8NF8NS_BH_BiasSH_HAS_SAB_SCD_SAV_UserArgs_MT256x256x64_MI16x16x1_SN_AFEM8_AFEM1_ASEM8_GSU1_GSUC0_GSUWGMRR0_K1_MIWT8_8_SU16_SUM3_SUS64_WGM152_WGMXCC4_WGMXCCGn1
    SolutionIndex: 111
    SolutionNameMin: Cijk_Ailk_Bljk_F8NF8NS_BH_BiasSH_HAS_SAB_SCD_SAV_UserArgs_MT256x128x64_MI16x16x1_SN_AFEM16_AFEM1_ASEM32_GSU1_GSUC0_GSUWGMRR1_K1_MIWT4_8_SU8_SUM0_SUS64_WGM16_WGMXCC1_WGMXCCG8
    SolutionIndex: 112
    SolutionNameMin: Cijk_Ailk_Bljk_F8NF8NS_BH_BiasSH_HAS_SAB_SCD_SAV_UserArgs_MT128x48x256_MI16x16x1_SN_AFEM16_AFEM8_ASEM8_GSU1_GSUC0_GSUWGMRR1_K1_MIWT2_3_SU2_SUM2_SUS256_WGM76_WGMXCC8_WGMXCCG0
    SolutionIndex: 113
    SolutionNameMin: Cijk_Ailk_Bljk_F8NF8NS_BH_BiasSH_HAS_SAB_SCD_SAV_UserArgs_MT256x256x64_MI16x16x1_SN_AFEM16_AFEM1_ASEM1_GSU1_GSUC1_GSUWGMRR0_K1_MIWT8_8_SU0_SUM0_SUS0_WGM19_WGMXCC8_WGMXCCGn1
    SolutionIndex: 114
    SolutionNameMin: Cijk_Ailk_Bljk_F8NF8NS_BH_BiasSH_HAS_SAB_SCD_SAV_UserArgs_MT64x48x256_MI16x16x1_SN_AFEM1_AFEM1_ASEM1_GSU1_GSUC0_GSUWGMRR0_K1_MIWT1_3_SU2_SUM0_SUS256_WGM38_WGMXCC8_WGMXCCGn1
    SolutionIndex: 115
    SolutionNameMin: Cijk_Ailk_Bljk_F8NF8NS_BH_BiasSH_HAS_SAB_SCD_SAV_UserArgs_MT256x64x64_MI16x16x1_SN_AFEM16_AFEM1_ASEM1_GSU1_GSUC0_GSUWGMRR0_K1_MIWT4_4_SU0_SUM0_SUS0_WGM2_WGMXCC4_WGMXCCG0
    SolutionIndex: 116
    SolutionNameMin: Cijk_Ailk_Bljk_F8NF8NS_BH_BiasSH_HAS_SAB_SCD_SAV_UserArgs_MT256x176x32_MI16x16x1_SN_AFEM16_AFEM8_ASEM16_GSU1_GSUC0_GSUWGMRR0_K1_MIWT4_11_SU4_SUM0_SUS32_WGM76_WGMXCC8_WGMXCCG0
    SolutionIndex: 117
    SolutionNameMin: Cijk_Ailk_Bljk_F8NF8NS_BH_BiasSH_HAS_SAB_SCD_SAV_UserArgs_MT128x48x128_MI16x16x1_SN_AFEM8_AFEM8_ASEM1_GSU1_GSUC0_GSUWGMRR0_K1_MIWT2_3_SU32_SUM1_SUS512_WGM0_WGMXCC16_WGMXCCGn1
    SolutionIndex: 118
    SolutionNameMin: Cijk_Ailk_Bljk_F8NF8NS_BH_BiasSH_HAS_SAB_SCD_SAV_UserArgs_MT256x128x64_MI16x16x1_SN_AFEM16_AFEM1_ASEM1_GSU1_GSUC0_GSUWGMRR1_K1_MIWT4_8_SU16_SUM0_SUS64_WGM4_WGMXCC4_WGMXCCG0
    SolutionIndex: 119
    SolutionNameMin: Cijk_Ailk_Bljk_F8NF8NS_BH_BiasSH_HAS_SAB_SCD_SAV_UserArgs_MT256x64x64_MI16x16x1_SN_AFEM8_AFEM1_ASEM1_GSU1_GSUC0_GSUWGMRR0_K1_MIWT4_4_SU8_SUM0_SUS128_WGM0_WGMXCC8_WGMXCCGn1
    SolutionIndex: 120
    SolutionNameMin: Cijk_Ailk_Bljk_F8NF8NS_BH_BiasSH_HAS_SAB_SCD_SAV_UserArgs_MT256x128x32_MI32x32x1_SN_AFEM8_AFEM8_ASEM1_GRVWB8_GSU1_GSUC0_GSUWGMRR0_K1_LBSPPA0_LPA0_MIWT4_2_SU2_SUM0_SUS32_WG64_4_1_WGM1_WGMXCC8_WGMXCCG0
    SolutionIndex: 121
    SolutionNameMin: Cijk_Ailk_Bljk_F8NF8NS_BH_BiasSH_HAS_SAB_SCD_SAV_UserArgs_MT256x128x64_MI16x16x1_SN_AFEM16_AFEM1_ASEM8_GSU1_GSUC0_GSUWGMRR1_K1_MIWT4_8_SU0_SUM0_SUS0_WGM0_WGMXCC1_WGMXCCGn1
    SolutionIndex: 122
    SolutionNameMin: Cijk_Ailk_Bljk_F8NF8NS_BH_BiasSH_HAS_SAB_SCD_SAV_UserArgs_MT256x224x128_MI16x16x1_SN_AFEM1_AFEM1_ASEM16_GSU1_GSUC1_GSUWGMRR1_K1_MIWT4_14_SU4_SUM1_SUS1024_WGM2_WGMXCC2_WGMXCCG4
    SolutionIndex: 123
    SolutionNameMin: Cijk_Ailk_Bljk_F8NF8NS_BH_BiasSH_HAS_SAB_SCD_SAV_UserArgs_MT256x128x64_MI16x16x1_SN_AFEM16_AFEM1_ASEM8_GSU1_GSUC0_GSUWGMRR0_K1_MIWT4_8_SU64_SUM0_SUS128_WGM76_WGMXCC2_WGMXCCG0
    SolutionIndex: 124
    SolutionNameMin: Cijk_Ailk_Bljk_F8NF8NS_BH_BiasSH_HAS_SAB_SCD_SAV_UserArgs_MT256x128x64_MI16x16x1_SN_AFEM8_AFEM1_ASEM32_GSU1_GSUC0_GSUWGMRR0_K1_MIWT4_8_SU4_SUM3_SUS2048_WGM16_WGMXCC8_WGMXCCG16
    SolutionIndex: 125
    SolutionNameMin: Cijk_Ailk_Bljk_F8NF8NS_BH_BiasSH_HAS_SAB_SCD_SAV_UserArgs_MT128x96x128_MI16x16x1_SN_AFEM8_AFEM1_ASEM32_GSU1_GSUC0_GSUWGMRR1_K1_MIWT2_6_SU4_SUM2_SUS256_WGM16_WGMXCC8_WGMXCCG304
    SolutionIndex: 126
    SolutionNameMin: Cijk_Ailk_Bljk_F8NF8NS_BH_BiasSH_HAS_SAB_SCD_SAV_UserArgs_MT64x32x256_MI16x16x1_SN_AFEM1_AFEM1_ASEM16_GSU1_GSUC0_GSUWGMRR0_K1_MIWT2_1_SU2_SUM1_SUS256_WGM2_WGMXCC8_WGMXCCGn1
    SolutionIndex: 127
    SolutionNameMin: Cijk_Ailk_Bljk_F8NF8NS_BH_BiasSH_HAS_SAB_SCD_SAV_UserArgs_MT64x48x256_MI16x16x1_SN_AFEM8_AFEM16_ASEM1_GSU1_GSUC0_GSUWGMRR0_K1_MIWT1_3_SU8_SUM2_SUS256_WGM8_WGMXCC4_WGMXCCG76
    SolutionIndex: 128
    SolutionNameMin: Cijk_Ailk_Bljk_F8NF8NS_BH_BiasSH_HAS_SAB_SCD_SAV_UserArgs_MT64x64x256_MI16x16x1_SN_AFEM1_AFEM16_ASEM16_GSU1_GSUC0_GSUWGMRR0_K1_MIWT2_2_SU2_SUM3_SUS1024_WGM304_WGMXCC4_WGMXCCGn1
    SolutionIndex: 129
    SolutionNameMin: Cijk_Ailk_Bljk_F8NF8NS_BH_BiasSH_HAS_SAB_SCD_SAV_UserArgs_MT256x128x64_MI16x16x1_SN_AFEM16_AFEM1_ASEM32_GSU1_GSUC0_GSUWGMRR0_K1_MIWT4_8_SU8_SUM0_SUS64_WGM304_WGMXCC2_WGMXCCG0
    SolutionIndex: 130
    SolutionNameMin: Cijk_Ailk_Bljk_F8NF8NS_BH_BiasSH_HAS_SAB_SCD_SAV_UserArgs_MT256x128x64_MI16x16x1_SN_AFEM16_AFEM1_ASEM32_GSU1_GSUC0_GSUWGMRR0_K1_MIWT4_8_SU2_SUM0_SUS64_WGM152_WGMXCC1_WGMXCCGn1
    SolutionIndex: 131
    SolutionNameMin: Cijk_Ailk_Bljk_F8NF8NS_BH_BiasSH_HAS_SAB_SCD_SAV_UserArgs_MT64x16x256_MI16x16x1_SN_AFEM8_AFEM8_ASEM1_GSU1_GSUC0_GSUWGMRR0_K1_MIWT1_1_SU4_SUM0_SUS256_WGM76_WGMXCC4_WGMXCCG0
    SolutionIndex: 132
    SolutionNameMin: Cijk_Ailk_Bljk_F8NF8NS_BH_BiasSH_HAS_SAB_SCD_SAV_UserArgs_MT256x224x128_MI16x16x1_SN_AFEM16_AFEM16_ASEM1_GSU1_GSUC0_GSUWGMRR0_K1_MIWT4_14_SU2_SUM0_SUS128_WGM16_WGMXCC1_WGMXCCG152
    SolutionIndex: 133
    SolutionNameMin: Cijk_Ailk_Bljk_F8NF8NS_BH_BiasSH_HAS_SAB_SCD_SAV_UserArgs_MT256x224x128_MI16x16x1_SN_AFEM8_AFEM1_ASEM16_GSU1_GSUC1_GSUWGMRR0_K1_MIWT4_14_SU64_SUM0_SUS128_WGM2_WGMXCC16_WGMXCCGn1
    SolutionIndex: 134
    SolutionNameMin: Cijk_Ailk_Bljk_F8NF8NS_BH_BiasSH_HAS_SAB_SCD_SAV_UserArgs_MT256x256x64_MI16x16x1_SN_AFEM16_AFEM8_ASEM16_GSU1_GSUC0_GSUWGMRR0_K1_MIWT8_8_SU64_SUM0_SUS512_WGM4_WGMXCC2_WGMXCCGn1
    SolutionIndex: 135
    SolutionNameMin: Cijk_Ailk_Bljk_F8NF8NS_BH_BiasSH_HAS_SAB_SCD_SAV_UserArgs_MT16x64x256_MI16x16x1_SN_AFEM1_AFEM8_ASEM32_GSU1_GSUC0_GSUWGMRR1_K1_MIWT1_1_SU16_SUM4_SUS512_WGM1_WGMXCC1_WGMXCCG19
    SolutionIndex: 136
    SolutionNameMin: Cijk_Ailk_Bljk_F8NF8NS_BH_BiasSH_HAS_SAB_SCD_SAV_UserArgs_MT256x176x32_MI16x16x1_SN_AFEM16_AFEM16_ASEM16_GSU1_GSUC0_GSUWGMRR1_K1_MIWT4_11_SU16_SUM0_SUS512_WGM0_WGMXCC16_WGMXCCG0
    SolutionIndex: 137
    SolutionNameMin: Cijk_Ailk_Bljk_F8NF8NS_BH_BiasSH_HAS_SAB_SCD_SAV_UserArgs_MT256x256x64_MI16x16x1_SN_AFEM8_AFEM16_ASEM1_GSU1_GSUC0_GSUWGMRR0_K1_MIWT8_8_SU8_SUM1_SUS128_WGM16_WGMXCC8_WGMXCCG8
    SolutionIndex: 138
    SolutionNameMin: Cijk_Ailk_Bljk_F8NF8NS_BH_BiasSH_HAS_SAB_SCD_SAV_UserArgs_MT256x256x64_MI16x16x1_SN_AFEM16_AFEM1_ASEM8_GSU1_GSUC0_GSUWGMRR0_K1_MIWT8_8_SU16_SUM2_SUS256_WGM152_WGMXCC2_WGMXCCGn1
    SolutionIndex: 139
    SolutionNameMin: Cijk_Ailk_Bljk_F8NF8NS_BH_BiasSH_HAS_SAB_SCD_SAV_UserArgs_MT128x64x128_MI16x16x1_SN_AFEM8_AFEM16_ASEM8_GSU1_GSUC0_GSUWGMRR1_K1_LBSPPA2048_LPA64_LPB32_MIWT4_2_SU8_SUM0_SUS1024_WG32_8_1_WGM19_WGMXCC1_WGMXCCGn1
    SolutionIndex: 140
    SolutionNameMin: Cijk_Ailk_Bljk_F8NF8NS_BH_BiasSH_HAS_SAB_SCD_SAV_UserArgs_MT128x32x128_MI16x16x1_SN_AFEM1_AFEM1_ASEM32_GSU1_GSUC1_GSUWGMRR1_K1_MIWT2_2_SU16_SUM0_SUS128_WGM304_WGMXCC16_WGMXCCGn1
    SolutionIndex: 141
    SolutionNameMin: Cijk_Ailk_Bljk_F8NF8NS_BH_BiasSH_HAS_SAB_SCD_SAV_UserArgs_MT256x64x128_MI16x16x1_SN_AFEM1_AFEM1_ASEM1_GSU1_GSUC0_GSUWGMRR0_K1_MIWT4_4_SU0_SUM0_SUS0_WGM4_WGMXCC8_WGMXCCGn1
    SolutionIndex: 142
    SolutionNameMin: Cijk_Ailk_Bljk_F8NF8NS_BH_BiasSH_HAS_SAB_SCD_SAV_UserArgs_MT64x96x128_MI16x16x1_SN_AFEM16_AFEM1_ASEM16_GSU1_GSUC0_GSUWGMRR0_K1_LBSPPA1024_LPA32_LPB32_MIWT2_3_SU2_SUM1_SUS128_WG32_8_1_WGM8_WGMXCC4_WGMXCCG152
    SolutionIndex: 143
    SolutionNameMin: Cijk_Ailk_Bljk_F8NF8NS_BH_BiasSH_HAS_SAB_SCD_SAV_UserArgs_MT128x192x128_MI16x16x1_SN_AFEM1_AFEM8_ASEM16_GSU1_GSUC0_GSUWGMRR0_K1_MIWT4_6_SU2_SUM2_SUS1024_WGM304_WGMXCC8_WGMXCCGn1
    SolutionIndex: 144
    SolutionNameMin: Cijk_Ailk_Bljk_F8NF8NS_BH_BiasSH_HAS_SAB_SCD_SAV_UserArgs_MT256x176x32_MI16x16x1_SN_AFEM16_AFEM1_ASEM8_GSU1_GSUC0_GSUWGMRR0_K1_MIWT4_11_SU4_SUM2_SUS256_WGM8_WGMXCC8_WGMXCCGn1
    SolutionIndex: 145
    SolutionNameMin: Cijk_Ailk_Bljk_F8NF8NS_BH_BiasSH_HAS_SAB_SCD_SAV_UserArgs_MT256x176x64_MI16x16x1_SN_AFEM16_AFEM1_ASEM1_GSU1_GSUC0_GSUWGMRR0_K1_MIWT4_11_SU2_SUM1_SUS128_WGM76_WGMXCC8_WGMXCCGn1
    SolutionIndex: 146
    SolutionNameMin: Cijk_Ailk_Bljk_F8NF8NS_BH_BiasSH_HAS_SAB_SCD_SAV_UserArgs_MT128x64x128_MI16x16x1_SN_AFEM1_AFEM1_ASEM1_GSU1_GSUC0_GSUWGMRR0_K1_LBSPPA2048_LPA64_LPB32_MIWT4_2_SU2_SUM0_SUS128_WG32_8_1_WGM2_WGMXCC8_WGMXCCGn1
    SolutionIndex: 147
    SolutionNameMin: Cijk_Ailk_Bljk_F8NF8NS_BH_BiasSH_HAS_SAB_SCD_SAV_UserArgs_MT128x128x128_MI16x16x1_SN_AFEM8_AFEM16_ASEM8_GSU1_GSUC1_GSUWGMRR1_K1_MIWT4_4_SU8_SUM3_SUS128_WGM304_WGMXCC2_WGMXCCGn1
    SolutionIndex: 148
    SolutionNameMin: Cijk_Ailk_Bljk_F8NF8NS_BH_BiasSH_HAS_SAB_SCD_SAV_UserArgs_MT256x256x64_MI16x16x1_SN_AFEM16_AFEM1_ASEM16_GSU1_GSUC0_GSUWGMRR1_K1_MIWT8_8_SU4_SUM1_SUS64_WGM76_WGMXCC2_WGMXCCGn1
    SolutionIndex: 149
    SolutionNameMin: Cijk_Ailk_Bljk_F8NF8NS_BH_BiasSH_HAS_SAB_SCD_SAV_UserArgs_MT256x176x32_MI16x16x1_SN_AFEM16_AFEM16_ASEM8_GSU1_GSUC0_GSUWGMRR0_K1_MIWT4_11_SU2_SUM0_SUS128_WGM38_WGMXCC4_WGMXCCG0
    SolutionIndex: 150
    SolutionNameMin: Cijk_Ailk_Bljk_F8NF8NS_BH_BiasSH_HAS_SAB_SCD_SAV_UserArgs_MT128x96x128_MI16x16x1_SN_AFEM8_AFEM1_ASEM1_GSU1_GSUC1_GSUWGMRR1_K1_MIWT2_6_SU4_SUM4_SUS128_WGM4_WGMXCC4_WGMXCCG0
    SolutionIndex: 151
    SolutionNameMin: Cijk_Ailk_Bljk_F8NF8NS_BH_BiasSH_HAS_SAB_SCD_SAV_UserArgs_MT128x128x128_MI16x16x1_SN_AFEM16_AFEM16_ASEM16_GSU1_GSUC0_GSUWGMRR0_K1_MIWT4_4_SU32_SUM1_SUS2048_WGM0_WGMXCC1_WGMXCCG2
    SolutionIndex: 152
    SolutionNameMin: Cijk_Ailk_Bljk_F8NF8NS_BH_BiasSH_HAS_SAB_SCD_SAV_UserArgs_MT256x256x64_MI16x16x1_SN_AFEM16_AFEM1_ASEM1_GSU1_GSUC0_GSUWGMRR0_K1_MIWT8_8_SU8_SUM0_SUS1024_WGM16_WGMXCC8_WGMXCCG0
    SolutionIndex: 153
    SolutionNameMin: Cijk_Ailk_Bljk_F8NF8NS_BH_BiasSH_HAS_SAB_SCD_SAV_UserArgs_MT256x224x128_MI16x16x1_SN_AFEM8_AFEM8_ASEM1_GSU1_GSUC0_GSUWGMRR0_K1_MIWT4_14_SU8_SUM3_SUS128_WGM16_WGMXCC1_WGMXCCG1
    SolutionIndex: 154
    SolutionNameMin: Cijk_Ailk_Bljk_F8NF8NS_BH_BiasSH_HAS_SAB_SCD_SAV_UserArgs_MT16x64x256_MI16x16x1_SN_AFEM1_AFEM8_ASEM1_GSU1_GSUC0_GSUWGMRR0_K1_MIWT1_1_SU16_SUM0_SUS512_WGM0_WGMXCC1_WGMXCCG152
    SolutionIndex: 155
    SolutionNameMin: Cijk_Ailk_Bljk_F8NF8NS_BH_BiasSH_HAS_SAB_SCD_SAV_UserArgs_MT256x224x128_MI16x16x1_SN_AFEM1_AFEM1_ASEM32_GSU1_GSUC1_GSUWGMRR0_K1_MIWT4_14_SU2_SUM0_SUS128_WGM8_WGMXCC8_WGMXCCGn1
    SolutionIndex: 156
    SolutionNameMin: Cijk_Ailk_Bljk_F8NF8NS_BH_BiasSH_HAS_SAB_SCD_SAV_UserArgs_MT256x256x64_MI16x16x1_SN_AFEM16_AFEM1_ASEM32_GSU1_GSUC0_GSUWGMRR0_K1_MIWT8_8_SU32_SUM0_SUS256_WGM16_WGMXCC8_WGMXCCG0
    SolutionIndex: 157
    SolutionNameMin: Cijk_Ailk_Bljk_F8NF8NS_BH_BiasSH_HAS_SAB_SCD_SAV_UserArgs_MT256x64x128_MI16x16x1_SN_AFEM8_AFEM1_ASEM1_GSU1_GSUC0_GSUWGMRR0_K1_MIWT4_4_SU4_SUM0_SUS256_WGM19_WGMXCC8_WGMXCCG0
    SolutionIndex: 158
    SolutionNameMin: Cijk_Ailk_Bljk_F8NF8NS_BH_BiasSH_HAS_SAB_SCD_SAV_UserArgs_MT256x128x64_MI16x16x1_SN_AFEM16_AFEM8_ASEM1_GSU1_GSUC0_GSUWGMRR1_K1_MIWT4_8_SU32_SUM0_SUS64_WGM2_WGMXCC2_WGMXCCG4
    SolutionIndex: 159
    SolutionNameMin: Cijk_Ailk_Bljk_F8NF8NS_BH_BiasSH_HAS_SAB_SCD_SAV_UserArgs_MT256x128x64_MI16x16x1_SN_AFEM16_AFEM1_ASEM8_GSU1_GSUC0_GSUWGMRR0_K1_MIWT4_8_SU4_SUM0_SUS64_WGM76_WGMXCC2_WGMXCCG152
    SolutionIndex: 160
    SolutionNameMin: Cijk_Ailk_Bljk_F8NF8NS_BH_BiasSH_HAS_SAB_SCD_SAV_UserArgs_MT16x128x256_MI16x16x1_SN_AFEM1_AFEM16_ASEM16_GSU1_GSUC0_GSUWGMRR0_K1_MIWT1_2_SU2_SUM1_SUS256_WGM1_WGMXCC1_WGMXCCG2
    SolutionIndex: 161
    SolutionNameMin: Cijk_Ailk_Bljk_F8NF8NS_BH_BiasSH_HAS_SAB_SCD_SAV_UserArgs_MT256x160x32_MI16x16x1_SN_AFEM16_AFEM1_ASEM32_GSU1_GSUC0_GSUWGMRR0_K1_MIWT4_10_SU16_SUM2_SUS512_WGM16_WGMXCC8_WGMXCCG304
    SolutionIndex: 162
    SolutionNameMin: Cijk_Ailk_Bljk_F8NF8NS_BH_BiasSH_HAS_SAB_SCD_SAV_UserArgs_MT16x64x128_MI16x16x1_SN_AFEM1_AFEM16_ASEM16_GSU1_GSUC0_GSUWGMRR0_K1_MIWT1_1_SU4_SUM1_SUS128_WGM1_WGMXCC1_WGMXCCGn1
    SolutionIndex: 163
    SolutionNameMin: Cijk_Ailk_Bljk_F8NF8NS_BH_BiasSH_HAS_SAB_SCD_SAV_UserArgs_MT256x224x128_MI16x16x1_SN_AFEM8_AFEM1_ASEM16_GSU1_GSUC0_GSUWGMRR0_K1_MIWT4_14_SU2_SUM2_SUS512_WGM8_WGMXCC8_WGMXCCGn1
    SolutionIndex: 164
    SolutionNameMin: Cijk_Ailk_Bljk_F8NF8NS_BH_BiasSH_HAS_SAB_SCD_SAV_UserArgs_MT256x128x64_MI16x16x1_SN_AFEM16_AFEM8_ASEM16_GSU1_GSUC0_GSUWGMRR0_K1_MIWT4_8_SU0_SUM0_SUS0_WGM304_WGMXCC8_WGMXCCG0
    SolutionIndex: 165
    SolutionNameMin: Cijk_Ailk_Bljk_F8NF8NS_BH_BiasSH_HAS_SAB_SCD_SAV_UserArgs_MT16x64x256_MI16x16x1_SN_AFEM1_AFEM8_ASEM1_GSU1_GSUC0_GSUWGMRR0_K1_MIWT1_1_SU8_SUM3_SUS2048_WGM152_WGMXCC1_WGMXCCG304
    SolutionIndex: 166
    SolutionNameMin: Cijk_Ailk_Bljk_F8NF8NS_BH_BiasSH_HAS_SAB_SCD_SAV_UserArgs_MT32x32x256_MI16x16x1_SN_AFEM1_AFEM1_ASEM16_GSU1_GSUC0_GSUWGMRR0_K1_LBSPPA512_LPA16_LPB32_MIWT1_1_SU4_SUM0_SUS256_WG32_8_1_WGM19_WGMXCC4_WGMXCCGn1
    SolutionIndex: 167
    SolutionNameMin: Cijk_Ailk_Bljk_F8NF8NS_BH_BiasSH_HAS_SAB_SCD_SAV_UserArgs_MT16x16x256_MI16x16x1_SN_AFEM8_AFEM1_ASEM16_GSU1_GSUC0_GSUWGMRR1_K1_MIWT1_1_SU4_SUM4_SUS256_WGM19_WGMXCC4_WGMXCCG76
    SolutionIndex: 168
    SolutionNameMin: Cijk_Ailk_Bljk_F8NF8NS_BH_BiasSH_HAS_SAB_SCD_SAV_UserArgs_MT256x256x64_MI16x16x1_SN_AFEM16_AFEM16_ASEM1_GSU1_GSUC0_GSUWGMRR0_K1_MIWT8_8_SU64_SUM2_SUS2048_WGM2_WGMXCC2_WGMXCCGn1
    SolutionIndex: 169
    SolutionNameMin: Cijk_Ailk_Bljk_F8NF8NS_BH_BiasSH_HAS_SAB_SCD_SAV_UserArgs_MT16x64x256_MI16x16x1_SN_AFEM1_AFEM16_ASEM8_GSU1_GSUC0_GSUWGMRR1_K1_MIWT1_1_SU16_SUM0_SUS512_WGM8_WGMXCC4_WGMXCCG16
    SolutionIndex: 170
    SolutionNameMin: Cijk_Ailk_Bljk_F8NF8NS_BH_BiasSH_HAS_SAB_SCD_SAV_UserArgs_MT256x128x64_MI16x16x1_SN_AFEM16_AFEM1_ASEM32_GSU1_GSUC0_GSUWGMRR0_K1_MIWT4_8_SU2_SUM0_SUS1024_WGM1_WGMXCC32_WGMXCCG0
    SolutionIndex: 171
    SolutionNameMin: Cijk_Ailk_Bljk_F8NF8NS_BH_BiasSH_HAS_SAB_SCD_SAV_UserArgs_MT256x128x128_MI16x16x1_SN_AFEM16_AFEM8_ASEM1_GSU1_GSUC0_GSUWGMRR0_K1_MIWT4_8_SU64_SUM0_SUS128_WGM76_WGMXCC1_WGMXCCG304
    SolutionIndex: 172
    SolutionNameMin: Cijk_Ailk_Bljk_F8NF8NS_BH_BiasSH_HAS_SAB_SCD_SAV_UserArgs_MT256x128x64_MI16x16x1_SN_AFEM16_AFEM1_ASEM8_GSU1_GSUC0_GSUWGMRR1_K1_MIWT4_8_SU32_SUM2_SUS2048_WGM304_WGMXCC1_WGMXCCGn1
    SolutionIndex: 173
    SolutionNameMin: Cijk_Ailk_Bljk_F8NF8NS_BH_BiasSH_HAS_SAB_SCD_SAV_UserArgs_MT256x128x64_MI16x16x1_SN_AFEM8_AFEM16_ASEM1_GSU1_GSUC0_GSUWGMRR0_K1_MIWT4_8_SU2_SUM3_SUS1024_WGM152_WGMXCC2_WGMXCCG0
    SolutionIndex: 174
    SolutionNameMin: Cijk_Ailk_Bljk_F8NF8NS_BH_BiasSH_HAS_SAB_SCD_SAV_UserArgs_MT256x256x64_MI16x16x1_SN_AFEM1_AFEM16_ASEM8_GSU1_GSUC1_GSUWGMRR0_K1_MIWT8_8_SU8_SUM3_SUS64_WGM38_WGMXCC8_WGMXCCGn1
    SolutionIndex: 175
    SolutionNameMin: Cijk_Ailk_Bljk_F8NF8NS_BH_BiasSH_HAS_SAB_SCD_SAV_UserArgs_MT128x192x128_MI16x16x1_SN_AFEM16_AFEM1_ASEM8_GSU1_GSUC0_GSUWGMRR1_K1_MIWT4_6_SU8_SUM3_SUS256_WGM4_WGMXCC8_WGMXCCGn1
    SolutionIndex: 176
    SolutionNameMin: Cijk_Ailk_Bljk_F8NF8NS_BH_BiasSH_HAS_SAB_SCD_SAV_UserArgs_MT16x64x256_MI16x16x1_SN_AFEM1_AFEM8_ASEM16_GSU1_GSUC0_GSUWGMRR0_K1_MIWT1_1_SU8_SUM3_SUS2048_WGM1_WGMXCC1_WGMXCCGn1
    SolutionIndex: 177
    SolutionNameMin: Cijk_Ailk_Bljk_F8NF8NS_BH_BiasSH_HAS_SAB_SCD_SAV_UserArgs_MT256x128x32_MI32x32x1_SN_AFEM8_AFEM16_ASEM1_GRVWB8_GSU1_GSUC0_GSUWGMRR0_K1_LBSPPA0_LPA0_MIWT4_2_SU4_SUM3_SUS128_WG64_4_1_WGM1_WGMXCC8_WGMXCCG0
    SolutionIndex: 178
    SolutionNameMin: Cijk_Ailk_Bljk_F8NF8NS_BH_BiasSH_HAS_SAB_SCD_SAV_UserArgs_MT256x128x128_MI16x16x1_SN_AFEM8_AFEM16_ASEM8_GSU1_GSUC1_GSUWGMRR0_K1_MIWT4_8_SU4_SUM3_SUS256_WGM304_WGMXCC8_WGMXCCGn1
    SolutionIndex: 179
    SolutionNameMin: Cijk_Ailk_Bljk_F8NF8NS_BH_BiasSH_HAS_SAB_SCD_SAV_UserArgs_MT256x128x64_MI16x16x1_SN_AFEM16_AFEM8_ASEM32_GSU1_GSUC0_GSUWGMRR0_K1_MIWT4_8_SU0_SUM0_SUS0_WGM304_WGMXCC16_WGMXCCGn1
    SolutionIndex: 180
    SolutionNameMin: Cijk_Ailk_Bljk_F8NF8NS_BH_BiasSH_HAS_SAB_SCD_SAV_UserArgs_MT256x256x64_MI16x16x1_SN_AFEM16_AFEM8_ASEM32_GSU1_GSUC1_GSUWGMRR1_K1_MIWT8_8_SU64_SUM0_SUS64_WGM2_WGMXCC32_WGMXCCG0
    SolutionIndex: 181
    SolutionNameMin: Cijk_Ailk_Bljk_F8NF8NS_BH_BiasSH_HAS_SAB_SCD_SAV_UserArgs_MT256x128x64_MI16x16x1_SN_AFEM16_AFEM16_ASEM32_GSU1_GSUC0_GSUWGMRR0_K1_MIWT4_8_SU0_SUM0_SUS0_WGM76_WGMXCC2_WGMXCCGn1
    SolutionIndex: 182
    SolutionNameMin: Cijk_Ailk_Bljk_F8NF8NS_BH_BiasSH_HAS_SAB_SCD_SAV_UserArgs_MT256x256x64_MI16x16x1_SN_AFEM8_AFEM1_ASEM16_GSU1_GSUC0_GSUWGMRR0_K1_MIWT8_8_SU0_SUM0_SUS0_WGM4_WGMXCC8_WGMXCCGn1
    SolutionIndex: 183
    SolutionNameMin: Cijk_Ailk_Bljk_F8NF8NS_BH_BiasSH_HAS_SAB_SCD_SAV_UserArgs_MT256x128x64_MI32x32x1_SN_AFEM8_AFEM16_ASEM1_GRVWB16_GSU1_GSUC0_GSUWGMRR0_K1_LBSPPA0_LPA0_LPB16_LRVW16_MIWT4_2_SU64_SUM1_SUS256_WG64_4_1_WGM0_WGMXCC1_WGMXCCG2
    SolutionIndex: 184
    SolutionNameMin: Cijk_Ailk_Bljk_F8NF8NS_BH_BiasSH_HAS_SAB_SCD_SAV_UserArgs_MT256x128x64_MI16x16x1_SN_AFEM16_AFEM8_ASEM16_GSU1_GSUC0_GSUWGMRR1_K1_MIWT4_8_SU4_SUM0_SUS64_WGM304_WGMXCC1_WGMXCCG1
    SolutionIndex: 185
    SolutionNameMin: Cijk_Ailk_Bljk_F8NF8NS_BH_BiasSH_HAS_SAB_SCD_SAV_UserArgs_MT16x64x128_MI16x16x1_SN_AFEM1_AFEM16_ASEM32_GSU1_GSUC0_GSUWGMRR0_K1_MIWT1_1_SU64_SUM0_SUS128_WGM38_WGMXCC16_WGMXCCG16
    SolutionIndex: 186
    SolutionNameMin: Cijk_Ailk_Bljk_F8NF8NS_BH_BiasSH_HAS_SAB_SCD_SAV_UserArgs_MT256x128x32_MI32x32x1_SN_AFEM8_AFEM16_ASEM1_GRVWB8_GSU1_GSUC0_GSUWGMRR1_K1_LBSPPA0_LPA0_MIWT4_2_SU4_SUM1_SUS128_WG64_4_1_WGM1_WGMXCC8_WGMXCCG0
    SolutionIndex: 187
    SolutionNameMin: Cijk_Ailk_Bljk_F8NF8NS_BH_BiasSH_HAS_SAB_SCD_SAV_UserArgs_MT128x48x128_MI16x16x1_SN_AFEM1_AFEM1_ASEM8_GSU1_GSUC0_GSUWGMRR0_K1_MIWT2_3_SU4_SUM0_SUS512_WGM19_WGMXCC16_WGMXCCGn1
    SolutionIndex: 188
    SolutionNameMin: Cijk_Ailk_Bljk_F8NF8NS_BH_BiasSH_HAS_SAB_SCD_SAV_UserArgs_MT256x224x128_MI16x16x1_SN_AFEM16_AFEM8_ASEM16_GSU1_GSUC0_GSUWGMRR0_K1_MIWT4_14_SU16_SUM1_SUS256_WGM8_WGMXCC2_WGMXCCG16
    SolutionIndex: 189
    SolutionNameMin: Cijk_Ailk_Bljk_F8NF8NS_BH_BiasSH_HAS_SAB_SCD_SAV_UserArgs_MT128x128x128_MI16x16x1_SN_AFEM1_AFEM1_ASEM32_GSU1_GSUC1_GSUWGMRR1_K1_MIWT4_4_SU4_SUM0_SUS256_WGM38_WGMXCC4_WGMXCCG0
    SolutionIndex: 190
    SolutionNameMin: Cijk_Ailk_Bljk_F8NF8NS_BH_BiasSH_HAS_SAB_SCD_SAV_UserArgs_MT256x128x64_MI16x16x1_SN_AFEM8_AFEM1_ASEM1_GSU1_GSUC0_GSUWGMRR1_K1_MIWT4_8_SU16_SUM3_SUS256_WGM8_WGMXCC4_WGMXCCG0
    SolutionIndex: 191
    SolutionNameMin: Cijk_Ailk_Bljk_F8NF8NS_BH_BiasSH_HAS_SAB_SCD_SAV_UserArgs_MT16x128x256_MI16x16x1_SN_AFEM1_AFEM16_ASEM1_GSU1_GSUC0_GSUWGMRR0_K1_MIWT1_2_SU4_SUM0_SUS512_WGM1_WGMXCC8_WGMXCCG0
    SolutionIndex: 192
    SolutionNameMin: Cijk_Ailk_Bljk_F8NF8NS_BH_BiasSH_HAS_SAB_SCD_SAV_UserArgs_MT64x48x256_MI16x16x1_SN_AFEM1_AFEM1_ASEM16_GSU1_GSUC0_GSUWGMRR0_K1_MIWT1_3_SU2_SUM1_SUS256_WGM4_WGMXCC8_WGMXCCGn1
    SolutionIndex: 193
    SolutionNameMin: Cijk_Ailk_Bljk_F8NF8NS_BH_BiasSH_HAS_SAB_SCD_SAV_UserArgs_MT256x64x128_MI16x16x1_SN_AFEM8_AFEM16_ASEM16_GSU1_GSUC1_GSUWGMRR0_K1_MIWT4_4_SU2_SUM0_SUS128_WGM8_WGMXCC1_WGMXCCG38
    SolutionIndex: 194
    SolutionNameMin: Cijk_Ailk_Bljk_F8NF8NS_BH_BiasSH_HAS_SAB_SCD_SAV_UserArgs_MT256x256x64_MI16x16x1_SN_AFEM8_AFEM1_ASEM8_GSU1_GSUC0_GSUWGMRR0_K1_MIWT8_8_SU0_SUM0_SUS0_WGM304_WGMXCC4_WGMXCCGn1
    SolutionIndex: 195
    SolutionNameMin: Cijk_Ailk_Bljk_F8NF8NS_BH_BiasSH_HAS_SAB_SCD_SAV_UserArgs_MT128x64x128_MI16x16x1_SN_AFEM16_AFEM16_ASEM16_GSU1_GSUC0_GSUWGMRR0_K1_LBSPPA2048_LPA64_LPB32_MIWT4_2_SU2_SUM4_SUS256_WG32_8_1_WGM19_WGMXCC2_WGMXCCGn1
    SolutionIndex: 196
    SolutionNameMin: Cijk_Ailk_Bljk_F8NF8NS_BH_BiasSH_HAS_SAB_SCD_SAV_UserArgs_MT256x176x128_MI16x16x1_SN_AFEM1_AFEM1_ASEM16_GSU1_GSUC0_GSUWGMRR0_K1_MIWT4_11_SU4_SUM1_SUS2048_WGM38_WGMXCC32_WGMXCCG0
    SolutionIndex: 197
    SolutionNameMin: Cijk_Ailk_Bljk_F8NF8NS_BH_BiasSH_HAS_SAB_SCD_SAV_UserArgs_MT16x128x256_MI16x16x1_SN_AFEM1_AFEM8_ASEM1_GSU1_GSUC0_GSUWGMRR0_K1_MIWT1_2_SU32_SUM0_SUS512_WGM304_WGMXCC8_WGMXCCG0
    SolutionIndex: 198
    SolutionNameMin: Cijk_Ailk_Bljk_F8NF8NS_BH_BiasSH_HAS_SAB_SCD_SAV_UserArgs_MT256x128x32_MI16x16x1_SN_AFEM1_AFEM1_ASEM8_GSU1_GSUC0_GSUWGMRR0_K1_MIWT8_4_SU2_SUM4_SUS512_WGM1_WGMXCC1_WGMXCCGn1
    SolutionIndex: 199
    SolutionNameMin: Cijk_Ailk_Bljk_F8NF8NS_BH_BiasSH_HAS_SAB_SCD_SAV_UserArgs_MT256x128x64_MI16x16x1_SN_AFEM1_AFEM16_ASEM8_GSU1_GSUC1_GSUWGMRR0_K1_MIWT4_8_SU2_SUM0_SUS512_WGM19_WGMXCC8_WGMXCCG16
    SolutionIndex: 200
    SolutionNameMin: Cijk_Ailk_Bljk_F8NF8NS_BH_BiasSH_HAS_SAB_SCD_SAV_UserArgs_MT256x256x64_MI16x16x1_SN_AFEM16_AFEM8_ASEM32_GSU1_GSUC0_GSUWGMRR0_K1_MIWT8_8_SU32_SUM1_SUS128_WGM16_WGMXCC2_WGMXCCG304
    SolutionIndex: 201
    SolutionNameMin: Cijk_Ailk_Bljk_F8NF8NS_BH_BiasSH_HAS_SAB_SCD_SAV_UserArgs_MT256x208x64_MI16x16x1_SN_AFEM8_AFEM1_ASEM8_GSU1_GSUC0_GSUWGMRR0_K1_MIWT4_13_SU4_SUM0_SUS64_WGM304_WGMXCC2_WGMXCCGn1
    SolutionIndex: 202
    SolutionNameMin: Cijk_Ailk_Bljk_F8NF8NS_BH_BiasSH_HAS_SAB_SCD_SAV_UserArgs_MT256x256x64_MI16x16x1_SN_AFEM16_AFEM16_ASEM32_GSU1_GSUC0_GSUWGMRR0_K1_MIWT8_8_SU64_SUM4_SUS512_WGM304_WGMXCC32_WGMXCCG0
    SolutionIndex: 203
    SolutionNameMin: Cijk_Ailk_Bljk_F8NF8NS_BH_BiasSH_HAS_SAB_SCD_SAV_UserArgs_MT256x256x64_MI32x32x1_SN_AFEM1_AFEM1_ASEM1_GRVWB16_GSU1_GSUC0_GSUWGMRR0_K1_LBSPPA0_LPA0_LPB16_LRVW16_MIWT4_4_SU32_SUM0_SUS128_WG64_4_1_WGM76_WGMXCC2_WGMXCCGn1
    SolutionIndex: 204
    SolutionNameMin: Cijk_Ailk_Bljk_F8NF8NS_BH_BiasSH_HAS_SAB_SCD_SAV_UserArgs_MT256x224x128_MI16x16x1_SN_AFEM16_AFEM1_ASEM8_GSU1_GSUC0_GSUWGMRR0_K1_MIWT4_14_SU32_SUM1_SUS256_WGM16_WGMXCC1_WGMXCCG304
    SolutionIndex: 205
    SolutionNameMin: Cijk_Ailk_Bljk_F8NF8NS_BH_BiasSH_HAS_SAB_SCD_SAV_UserArgs_MT256x224x128_MI16x16x1_SN_AFEM8_AFEM1_ASEM1_GSU1_GSUC0_GSUWGMRR0_K1_MIWT4_14_SU8_SUM2_SUS256_WGM16_WGMXCC1_WGMXCCGn1
    SolutionIndex: 206
    SolutionNameMin: Cijk_Ailk_Bljk_F8NF8NS_BH_BiasSH_HAS_SAB_SCD_SAV_UserArgs_MT256x176x32_MI16x16x1_SN_AFEM16_AFEM8_ASEM32_GSU1_GSUC0_GSUWGMRR1_K1_MIWT4_11_SU4_SUM3_SUS2048_WGM152_WGMXCC8_WGMXCCG0
    SolutionIndex: 207
    SolutionNameMin: Cijk_Ailk_Bljk_F8NF8NS_BH_BiasSH_HAS_SAB_SCD_SAV_UserArgs_MT256x176x32_MI16x16x1_SN_AFEM16_AFEM16_ASEM1_GSU1_GSUC0_GSUWGMRR1_K1_MIWT4_11_SU2_SUM0_SUS32_WGM0_WGMXCC8_WGMXCCG0
    SolutionIndex: 208
    SolutionNameMin: Cijk_Ailk_Bljk_F8NF8NS_BH_BiasSH_HAS_SAB_SCD_SAV_UserArgs_MT128x128x128_MI32x32x1_SN_AFEM1_AFEM1_ASEM8_GSU1_GSUC0_GSUWGMRR0_K1_LBSPPA0_LPA0_LPB16_MIWT2_2_SU4_SUM1_SUS128_WG64_4_1_WGM0_WGMXCC1_WGMXCCGn1
    SolutionIndex: 209
    SolutionNameMin: Cijk_Ailk_Bljk_F8NF8NS_BH_BiasSH_HAS_SAB_SCD_SAV_UserArgs_MT256x256x64_MI16x16x1_SN_AFEM8_AFEM8_ASEM16_GSU1_GSUC0_GSUWGMRR0_K1_MIWT8_8_SU2_SUM0_SUS256_WGM2_WGMXCC16_WGMXCCG0
    SolutionIndex: 210
    SolutionNameMin: Cijk_Ailk_Bljk_F8NF8NS_BH_BiasSH_HAS_SAB_SCD_SAV_UserArgs_MT256x128x64_MI16x16x1_SN_AFEM16_AFEM1_ASEM1_GSU1_GSUC0_GSUWGMRR1_K1_MIWT4_8_SU64_SUM0_SUS512_WGM0_WGMXCC16_WGMXCCG0
    SolutionIndex: 211
    SolutionNameMin: Cijk_Ailk_Bljk_F8NF8NS_BH_BiasSH_HAS_SAB_SCD_SAV_UserArgs_MT256x256x64_MI16x16x1_SN_AFEM16_AFEM1_ASEM8_GSU1_GSUC0_GSUWGMRR0_K1_MIWT8_8_SU4_SUM0_SUS64_WGM0_WGMXCC32_WGMXCCG0
    SolutionIndex: 212
    SolutionNameMin: Cijk_Ailk_Bljk_F8NF8NS_BH_BiasSH_HAS_SAB_SCD_SAV_UserArgs_MT256x64x128_MI16x16x1_SN_AFEM1_AFEM8_ASEM16_GSU1_GSUC1_GSUWGMRR0_K1_MIWT4_4_SU64_SUM3_SUS256_WGM16_WGMXCC4_WGMXCCG16
    SolutionIndex: 213
    SolutionNameMin: Cijk_Ailk_Bljk_F8NF8NS_BH_BiasSH_HAS_SAB_SCD_SAV_UserArgs_MT128x64x128_MI16x16x1_SN_AFEM1_AFEM1_ASEM8_GSU1_GSUC0_GSUWGMRR1_K1_LBSPPA2048_LPA64_LPB32_MIWT4_2_SU16_SUM2_SUS128_WG32_8_1_WGM1_WGMXCC16_WGMXCCGn1
    SolutionIndex: 214
    SolutionNameMin: Cijk_Ailk_Bljk_F8NF8NS_BH_BiasSH_HAS_SAB_SCD_SAV_UserArgs_MT128x96x128_MI16x16x1_SN_AFEM8_AFEM1_ASEM32_GSU1_GSUC0_GSUWGMRR0_K1_MIWT2_6_SU0_SUM0_SUS0_WGM38_WGMXCC16_WGMXCCGn1
    SolutionIndex: 215
    SolutionNameMin: Cijk_Ailk_Bljk_F8NF8NS_BH_BiasSH_HAS_SAB_SCD_SAV_UserArgs_MT256x256x64_MI16x16x1_SN_AFEM16_AFEM1_ASEM32_GSU1_GSUC0_GSUWGMRR0_K1_MIWT8_8_SU4_SUM2_SUS2048_WGM16_WGMXCC1_WGMXCCGn1
- - - [69632, 512, 1, 25600]
    - [0, 0.0]
  - - [25600, 128, 1, 139264]
    - [1, 0.0]
  - - [1600, 25600, 1, 1024]
    - [2, 0.0]
  - - [557056, 512, 1, 3200]
    - [3, 0.0]
  - - [7040, 4096, 1, 25600]
    - [4, 0.0]
  - - [25600, 512, 1, 1]
    - [5, 0.0]
  - - [1600, 512, 1, 25600]
    - [6, 0.0]
  - - [25600, 256, 1, 34816]
    - [7, 0.0]
  - - [25600, 4096, 1, 1600]
    - [8, 0.0]
  - - [800, 557056, 1, 64]
    - [9, 0.0]
  - - [25600, 256, 1, 139264]
    - [10, 0.0]
  - - [557056, 64, 1, 800]
    - [11, 0.0]
  - - [1600, 512, 1, 557056]
    - [12, 0.0]
  - - [139264, 25600, 1, 256]
    - [13, 0.0]
  - - [25600, 1024, 1, 1760]
    - [14, 0.0]
  - - [3200, 557056, 1, 512]
    - [15, 0.0]
  - - [25600, 1024, 1, 3200]
    - [16, 0.0]
  - - [3200, 128, 1, 557056]
    - [17, 0.0]
  - - [34816, 512, 1, 25600]
    - [18, 0.0]
  - - [1, 25600, 1, 1024]
    - [19, 0.0]
  - - [6400, 25600, 1, 512]
    - [20, 0.0]
  - - [25600, 1024, 1, 6400]
    - [21, 0.0]
  - - [3200, 557056, 1, 128]
    - [22, 0.0]
  - - [3520, 25600, 1, 1024]
    - [23, 0.0]
  - - [1, 512, 1, 25600]
    - [24, 0.0]
  - - [6400, 557056, 1, 64]
    - [25, 0.0]
  - - [1760, 25600, 1, 512]
    - [26, 0.0]
  - - [25600, 2048, 1, 3200]
    - [27, 0.0]
  - - [25600, 1024, 1, 1600]
    - [28, 0.0]
  - - [25600, 512, 1, 6400]
    - [29, 0.0]
  - - [800, 25600, 1, 1024]
    - [30, 0.0]
  - - [6400, 557056, 1, 512]
    - [31, 0.0]
  - - [800, 1024, 1, 25600]
    - [32, 0.0]
  - - [1600, 128, 1, 557056]
    - [33, 0.0]
  - - [800, 512, 1, 25600]
    - [34, 0.0]
  - - [25600, 4096, 1, 1760]
    - [35, 0.0]
  - - [2, 25600, 1, 512]
    - [36, 0.0]
  - - [25600, 512, 1, 278528]
    - [37, 0.0]
  - - [557056, 256, 1, 800]
    - [38, 0.0]
  - - [25600, 128, 1, 34816]
    - [39, 0.0]
  - - [557056, 512, 1, 800]
    - [40, 0.0]
  - - [25600, 1024, 1, 800]
    - [41, 0.0]
  - - [800, 557056, 1, 512]
    - [42, 0.0]
  - - [557056, 128, 1, 6400]
    - [43, 0.0]
  - - [69632, 256, 1, 25600]
    - [44, 0.0]
  - - [1760, 25600, 1, 4096]
    - [45, 0.0]
  - - [25600, 512, 1, 3520]
    - [46, 0.0]
  - - [1600, 557056, 1, 512]
    - [47, 0.0]
  - - [139264, 256, 1, 25600]
    - [48, 0.0]
  - - [25600, 512, 1, 3200]
    - [49, 0.0]
  - - [2, 25600, 1, 4096]
    - [50, 0.0]
  - - [6400, 2048, 1, 25600]
    - [51, 0.0]
  - - [1, 4096, 1, 25600]
    - [52, 0.0]
  - - [25600, 4096, 1, 3520]
    - [53, 0.0]
  - - [3520, 512, 1, 25600]
    - [54, 0.0]
  - - [1, 2048, 1, 25600]
    - [55, 0.0]
  - - [139264, 128, 1, 25600]
    - [56, 0.0]
  - - [1600, 25600, 1, 4096]
    - [57, 0.0]
  - - [3200, 557056, 1, 256]
    - [58, 0.0]
  - - [3200, 25600, 1, 4096]
    - [59, 0.0]
  - - [557056, 512, 1, 6400]
    - [60, 0.0]
  - - [278528, 512, 1, 25600]
    - [61, 0.0]
  - - [880, 25600, 1, 4096]
    - [62, 0.0]
  - - [1760, 2048, 1, 25600]
    - [63, 0.0]
  - - [25600, 512, 1, 7040]
    - [64, 0.0]
  - - [557056, 512, 1, 1600]
    - [65, 0.0]
  - - [25600, 2048, 1, 2]
    - [66, 0.0]
  - - [1760, 4096, 1, 25600]
    - [67, 0.0]
  - - [278528, 25600, 1, 256]
    - [68, 0.0]
  - - [25600, 512, 1, 139264]
    - [69, 0.0]
  - - [800, 128, 1, 557056]
    - [70, 0.0]
  - - [800, 25600, 1, 2048]
    - [71, 0.0]
  - - [800, 557056, 1, 128]
    - [72, 0.0]
  - - [25600, 1024, 1, 1]
    - [73, 0.0]
  - - [3520, 2048, 1, 25600]
    - [74, 0.0]
  - - [6400, 25600, 1, 4096]
    - [75, 0.0]
  - - [25600, 64, 1, 278528]
    - [76, 0.0]
  - - [25600, 512, 1, 34816]
    - [77, 0.0]
  - - [1600, 4096, 1, 25600]
    - [78, 0.0]
  - - [1760, 25600, 1, 2048]
    - [79, 0.0]
  - - [557056, 128, 1, 3200]
    - [80, 0.0]
  - - [3200, 512, 1, 557056]
    - [81, 0.0]
  - - [25600, 512, 1, 2]
    - [82, 0.0]
  - - [1600, 25600, 1, 512]
    - [83, 0.0]
  - - [69632, 64, 1, 25600]
    - [84, 0.0]
  - - [557056, 64, 1, 6400]
    - [85, 0.0]
  - - [25600, 64, 1, 34816]
    - [86, 0.0]
  - - [25600, 1024, 1, 7040]
    - [87, 0.0]
  - - [880, 1024, 1, 25600]
    - [88, 0.0]
  - - [557056, 256, 1, 6400]
    - [89, 0.0]
  - - [25600, 1024, 1, 880]
    - [90, 0.0]
  - - [557056, 64, 1, 3200]
    - [91, 0.0]
  - - [1600, 25600, 1, 2048]
    - [92, 0.0]
  - - [25600, 512, 1, 800]
    - [93, 0.0]
  - - [25600, 512, 1, 1760]
    - [94, 0.0]
  - - [25600, 512, 1, 880]
    - [95, 0.0]
  - - [880, 25600, 1, 512]
    - [96, 0.0]
  - - [7040, 2048, 1, 25600]
    - [97, 0.0]
  - - [34816, 128, 1, 25600]
    - [98, 0.0]
  - - [800, 25600, 1, 512]
    - [99, 0.0]
  - - [800, 2048, 1, 25600]
    - [100, 0.0]
  - - [3200, 256, 1, 557056]
    - [101, 0.0]
  - - [557056, 256, 1, 1600]
    - [102, 0.0]
  - - [34816, 25600, 1, 512]
    - [103, 0.0]
  - - [69632, 25600, 1, 64]
    - [104, 0.0]
  - - [557056, 128, 1, 1600]
    - [105, 0.0]
  - - [25600, 256, 1, 278528]
    - [106, 0.0]
  - - [1760, 1024, 1, 25600]
    - [107, 0.0]
  - - [7040, 25600, 1, 4096]
    - [108, 0.0]
  - - [25600, 256, 1, 69632]
    - [109, 0.0]
  - - [25600, 2048, 1, 6400]
    - [110, 0.0]
  - - [3520, 25600, 1, 512]
    - [111, 0.0]
  - - [3200, 512, 1, 25600]
    - [112, 0.0]
  - - [69632, 25600, 1, 512]
    - [113, 0.0]
  - - [1600, 256, 1, 557056]
    - [114, 0.0]
  - - [557056, 64, 1, 1600]
    - [115, 0.0]
  - - [25600, 2048, 1, 880]
    - [116, 0.0]
  - - [880, 2048, 1, 25600]
    - [117, 0.0]
  - - [1760, 25600, 1, 1024]
    - [118, 0.0]
  - - [278528, 64, 1, 25600]
    - [119, 0.0]
  - - [25600, 2048, 1, 1]
    - [120, 0.0]
  - - [6400, 557056, 1, 256]
    - [121, 0.0]
  - - [3520, 4096, 1, 25600]
    - [122, 0.0]
  - - [880, 25600, 1, 1024]
    - [123, 0.0]
  - - [34816, 256, 1, 25600]
    - [124, 0.0]
  - - [6400, 512, 1, 25600]
    - [125, 0.0]
  - - [3200, 64, 1, 557056]
    - [126, 0.0]
  - - [880, 512, 1, 25600]
    - [127, 0.0]
  - - [1760, 512, 1, 25600]
    - [128, 0.0]
  - - [1600, 557056, 1, 128]
    - [129, 0.0]
  - - [800, 557056, 1, 256]
    - [130, 0.0]
  - - [1600, 64, 1, 557056]
    - [131, 0.0]
  - - [3200, 25600, 1, 1024]
    - [132, 0.0]
  - - [800, 25600, 1, 4096]
    - [133, 0.0]
  - - [557056, 256, 1, 3200]
    - [134, 0.0]
  - - [2, 512, 1, 25600]
    - [135, 0.0]
  - - [25600, 2048, 1, 1760]
    - [136, 0.0]
  - - [6400, 25600, 1, 2048]
    - [137, 0.0]
  - - [25600, 4096, 1, 3200]
    - [138, 0.0]
  - - [25600, 64, 1, 139264]
    - [139, 0.0]
  - - [6400, 64, 1, 557056]
    - [140, 0.0]
  - - [25600, 128, 1, 278528]
    - [141, 0.0]
  - - [1600, 1024, 1, 25600]
    - [142, 0.0]
  - - [6400, 1024, 1, 25600]
    - [143, 0.0]
  - - [25600, 512, 1, 1600]
    - [144, 0.0]
  - - [25600, 1024, 1, 3520]
    - [145, 0.0]
  - - [6400, 128, 1, 557056]
    - [146, 0.0]
  - - [1600, 2048, 1, 25600]
    - [147, 0.0]
  - - [25600, 4096, 1, 7040]
    - [148, 0.0]
  - - [25600, 4096, 1, 880]
    - [149, 0.0]
  - - [800, 4096, 1, 25600]
    - [150, 0.0]
  - - [3520, 1024, 1, 25600]
    - [151, 0.0]
  - - [278528, 25600, 1, 512]
    - [152, 0.0]
  - - [3200, 4096, 1, 25600]
    - [153, 0.0]
  - - [2, 4096, 1, 25600]
    - [154, 0.0]
  - - [25600, 4096, 1, 6400]
    - [155, 0.0]
  - - [139264, 25600, 1, 512]
    - [156, 0.0]
  - - [7040, 512, 1, 25600]
    - [157, 0.0]
  - - [7040, 25600, 1, 1024]
    - [158, 0.0]
  - - [1600, 557056, 1, 64]
    - [159, 0.0]
  - - [2, 25600, 1, 1024]
    - [160, 0.0]
  - - [25600, 4096, 1, 800]
    - [161, 0.0]
  - - [1, 25600, 1, 512]
    - [162, 0.0]
  - - [7040, 25600, 1, 2048]
    - [163, 0.0]
  - - [278528, 25600, 1, 128]
    - [164, 0.0]
  - - [1, 1024, 1, 25600]
    - [165, 0.0]
  - - [800, 256, 1, 557056]
    - [166, 0.0]
  - - [800, 64, 1, 557056]
    - [167, 0.0]
  - - [34816, 25600, 1, 128]
    - [168, 0.0]
  - - [2, 1024, 1, 25600]
    - [169, 0.0]
  - - [34816, 25600, 1, 64]
    - [170, 0.0]
  - - [880, 25600, 1, 2048]
    - [171, 0.0]
  - - [278528, 25600, 1, 64]
    - [172, 0.0]
  - - [3200, 557056, 1, 64]
    - [173, 0.0]
  - - [25600, 2048, 1, 3520]
    - [174, 0.0]
  - - [3200, 2048, 1, 25600]
    - [175, 0.0]
  - - [2, 2048, 1, 25600]
    - [176, 0.0]
  - - [25600, 4096, 1, 2]
    - [177, 0.0]
  - - [7040, 1024, 1, 25600]
    - [178, 0.0]
  - - [139264, 25600, 1, 64]
    - [179, 0.0]
  - - [69632, 25600, 1, 128]
    - [180, 0.0]
  - - [3200, 25600, 1, 512]
    - [181, 0.0]
  - - [139264, 512, 1, 25600]
    - [182, 0.0]
  - - [278528, 128, 1, 25600]
    - [183, 0.0]
  - - [1600, 557056, 1, 256]
    - [184, 0.0]
  - - [1, 25600, 1, 4096]
    - [185, 0.0]
  - - [25600, 4096, 1, 1]
    - [186, 0.0]
  - - [6400, 256, 1, 557056]
    - [187, 0.0]
  - - [3520, 25600, 1, 2048]
    - [188, 0.0]
  - - [3200, 1024, 1, 25600]
    - [189, 0.0]
  - - [7040, 25600, 1, 512]
    - [190, 0.0]
  - - [1, 25600, 1, 2048]
    - [191, 0.0]
  - - [800, 512, 1, 557056]
    - [192, 0.0]
  - - [139264, 64, 1, 25600]
    - [193, 0.0]
  - - [25600, 2048, 1, 7040]
    - [194, 0.0]
  - - [34816, 64, 1, 25600]
    - [195, 0.0]
  - - [25600, 512, 1, 69632]
    - [196, 0.0]
  - - [2, 25600, 1, 2048]
    - [197, 0.0]
  - - [557056, 128, 1, 800]
    - [198, 0.0]
  - - [69632, 128, 1, 25600]
    - [199, 0.0]
  - - [6400, 25600, 1, 1024]
    - [200, 0.0]
  - - [6400, 4096, 1, 25600]
    - [201, 0.0]
  - - [139264, 25600, 1, 128]
    - [202, 0.0]
  - - [278528, 256, 1, 25600]
    - [203, 0.0]
  - - [3200, 25600, 1, 2048]
    - [204, 0.0]
  - - [3520, 25600, 1, 4096]
    - [205, 0.0]
  - - [25600, 2048, 1, 800]
    - [206, 0.0]
  - - [25600, 1024, 1, 2]
    - [207, 0.0]
  - - [25600, 128, 1, 69632]
    - [208, 0.0]
  - - [25600, 2048, 1, 1600]
    - [209, 0.0]
  - - [6400, 557056, 1, 128]
    - [210, 0.0]
  - - [69632, 25600, 1, 256]
    - [211, 0.0]
  - - [880, 4096, 1, 25600]
    - [212, 0.0]
  - - [25600, 64, 1, 69632]
    - [213, 0.0]
  - - [6400, 512, 1, 557056]
    - [214, 0.0]
  - - [34816, 25600, 1, 256]
    - [215, 0.0]
- null
- null
- DeviceEfficiency
- Equality
